title,link,snippet,position,rating,ratingCount
"Video: 3 Siklon Kepung Indonesia, Daerah Mana Saja yang ...",https://20.detik.com/detikupdate/20251216-251216055/video-3-siklon-kepung-indonesia-daerah-mana-saja-yang-harus-waspada,"Kategori Berita. detikNews · detikFinance · detikInet · detikHot · detikSport ... Video: Imbas Tarif Trump, Perusahaan Teknologi AS Menuju ...",3,,
"Jembatan Bailey Rampung 100 Persen, Akses Jalan ...",https://www.youtube.com/watch?v=zzgNw73GqwM,... berita televisi nasional yang berada di bawah naungan Elang Mahkota Teknologi (Emtek) Group. Liputan 6 SCTV juga menyajikan informasi dalam ...,4,,
Refleksi dan Arah Pengembangan Sains dan Teknologi,https://lldikti3.kemdikbud.go.id/undangan-reportoar-2025-refleksi-dan-arah-pengembangan-sains-dan-teknologi/,"... teknologi, kemitraan multipihak, dan peningkatan kapasitas masyarakat. ... Berita Terbaru. Undangan Sosialisasi Pelaksanaan Akreditasi oleh LAM ...",5,,
ITB Berikan Bantuan Instalasi Pengolahan Air ke Daerah ...,https://itb.ac.id/berita/itb-berikan-bantuan-instalasi-pengolahan-air-ke-daerah-bencana/63184,"BANDUNG, itb.ac.id — Institut Teknologi Bandung (ITB) mengirimkan ... Berita; Utama. ITB Berikan Bantuan Instalasi Pengolahan Air ke ...",6,,
WOHOO~ Leaderboard sementara! 🥳🏅 Di Reward ...,https://www.tiktok.com/@clashofchampionsofficial/video/7585776272748465428,Nantikan info-info terbarunya di media sosial Ruangguru. Stay ... Teknologi Informasi Silver Medal - World Mathematics Invitation ...,7,,
Pria Lempar Granat Asap dan Menusuk Warga di MRT ...,https://www.youtube.com/watch?v=J-0qtxeLn5M,/www.youtube.com/@Liputan6Daerah Liputan 6 SCTV adalah program berita televisi nasional yang berada di bawah naungan Elang Mahkota Teknologi ...,8,,
Kategori: Potensi (4 Berita) | Portal Merauke,https://portal.merauke.go.id/berita/kategori/potensi,berita · Sains dan Teknologi. 202 berita · Otomotif. 22 berita · Potensi. 4 berita ... berita · Info Covid 19. 15 berita · Statistik. 12 berita · Pojok Merauke.,9,,
Kumpulan Berita perkembangan teknologi di indonesia,https://www.antaranews.com/tag/perkembangan-teknologi-di-indonesia,"Kumpulan Berita perkembangan teknologi di indonesia dari ANTARA News, portal berita terkini dan terpercaya Indonesia.",10,,
Kumpulan Berita perkembangan teknologi di indonesia,https://www.antaranews.com/tag/perkembangan-teknologi-di-indonesia,"Kumpulan Berita perkembangan teknologi di indonesia dari ANTARA News, portal berita terkini dan terpercaya Indonesia.",1,,
Berita Teknologi Digital Hari Ini - Kabar Terbaru Terkini,https://www.liputan6.com/tag/teknologi-digital,Berita Teknologi Digital - Blibli menjelaskan posisi Artificial Intelligence (AI) sebagai perangkat kolaboratif bagi karyawan dalam meningkatkan kemampuan ...,2,,
Kenapa Indonesia Keukeuh Tolak Bantuan Asing Imbas ...,https://video.kompas.com/watch/1897805/kenapa-indonesia-keukeuh-tolak-bantuan-asing-imbas-bencana-sumatera,"... News. 2 ... Gurun Sahara Afrika Bisa Suburkan Hutan Amazon, Kok Bisa? Teknologi.",3,,
Telkom Perluas Infrastruktur untuk Mendukung Akselerasi ...,https://www.telkom.co.id/sites/berita/id_ID/article/telkom-perluas-infrastruktur-untuk-mendukung-akselerasi-digitalisasi-indonesia-127,... teknologi informasi dan teknologi komunikasi yang stabil. Kombinasi ... Bagikan Berita di: Whatsapp arrow_outward · Facebook ...,4,,
Dalam Konferensi Pers Perkembangan Penanggulangan ...,https://www.tiktok.com/@inilahcom/video/7585522667105570066,Baca berita di inilah.com https://www ... Inovasi Teknologi untuk Ekosistem: Zero Waste Mining: Laporan UI mencatat penggunaan teknologi ...,5,,
Telkomsel Raih Penghargaan Inovasi AI Di Thailand,https://www.gadgetdiva.id/news/telkomsel-raih-penghargaan-inovasi-ai,"... teknologi, tetapi juga memberikan dampak nyata bagi ... Cek berita teknologi, review gadget dan video Gadgetdiva.id di Google News.",6,,
"Wujudkan Kedaulatan AI, Kemkomdigi Siapkan Diaspora ...",https://portal.komdigi.go.id/kanal-publik/berita-kini/9883,"Banyak talenta Indonesia kini bekerja di perusahaan teknologi global, termasuk di DeepMind, Inggris. Wamen Nezar mengatakan Kemkomdigi telah ...",7,,
MAIN SCATTER TOPTECH LINFORMATICIEN ...,https://toptech.linformaticien.com/cache/cookies/MAIN-SCATTER-2961,"... BERITA, ANALISIS, DAN WAWASAN MENDALAM SEPUTAR PERKEMBANGAN TEKNOLOGI TERKINI YANG RELEVAN DENGAN KEBUTUHAN DUNIA DIGITAL MASA KINI, DI MANA ...",8,,
[Full] Teddy Keras Soal Bencana Sumatera: Anda Punya ...,https://www.youtube.com/watch?v=vUBrJ3ELwUY,... berita televisi nasional yang berada di bawah naungan Elang Mahkota Teknologi (Emtek) Group. Liputan 6 SCTV juga menyajikan informasi dalam ...,9,,
Dunia olahraga dan sinema global bersiap menyambut ...,https://www.tiktok.com/@inilahcom/video/7585565254139251988,Baca berita di inilah.com https://www ... Inovasi Teknologi untuk Ekosistem: Zero Waste Mining: Laporan UI mencatat penggunaan teknologi ...,10,,
Telkom Perluas Infrastruktur untuk Mendukung Akselerasi ...,https://www.telkom.co.id/sites/berita/id_ID/article/telkom-perluas-infrastruktur-untuk-mendukung-akselerasi-digitalisasi-indonesia-127,... teknologi informasi dan teknologi komunikasi yang stabil. Kombinasi ... Bagikan Berita di: Whatsapp arrow_outward · Facebook ...,1,,
Berita Teknologi Digital Hari Ini - Kabar Terbaru Terkini,https://www.liputan6.com/tag/teknologi-digital,Berita Teknologi Digital - Blibli menjelaskan posisi Artificial Intelligence (AI) sebagai perangkat kolaboratif bagi karyawan dalam meningkatkan kemampuan ...,2,,
Kenapa Indonesia Keukeuh Tolak Bantuan Asing Imbas ...,https://video.kompas.com/watch/1897805/kenapa-indonesia-keukeuh-tolak-bantuan-asing-imbas-bencana-sumatera,"... News. 2 ... Gurun Sahara Afrika Bisa Suburkan Hutan Amazon, Kok Bisa? Teknologi.",3,,
"Buat Masker Cerdas dari Limbah, Tim Mahasiswa ITB ...",https://itb.ac.id/berita/buat-masker-cerdas-dari-limbah-tim-mahasiswa-itb-juara-1-inovasi-produk-nasional/63181,"(ITB) dari Program Studi Teknologi Pascapanen meraih Juara 1 dalam ... Berita; Utama. Buat Masker Cerdas dari Limbah, Tim Mahasiswa ITB ...",4,,
Dalam Konferensi Pers Perkembangan Penanggulangan ...,https://www.tiktok.com/@inilahcom/video/7585522667105570066,Baca berita di inilah.com https://www ... Inovasi Teknologi untuk Ekosistem: Zero Waste Mining: Laporan UI mencatat penggunaan teknologi ...,5,,
Pemerintah Segera Susun PP Atur Jabatan Sipil Apa Saja ...,https://www.youtube.com/watch?v=h8dR5SQrpZ0,... berita televisi nasional yang berada di bawah naungan Elang Mahkota Teknologi (Emtek) Group. Liputan 6 SCTV juga menyajikan informasi dalam ...,6,,
MARAG Nyaba ka Lembur Gelar Bakti Sosial untuk ...,https://www.garutkab.go.id/berita/marag-nyaba-ka-lembur-gelar-bakti-sosial-untuk-masyarakat-cihurip,... Teknologi (21) Pajak (4) Perkebunan (18) Peternakan (23) Industri ... Berita SKPD. Semua Informasi (18) Ekonomi (56) Kegiatan (126) ...,7,,
Dunia olahraga dan sinema global bersiap menyambut ...,https://www.tiktok.com/@inilahcom/video/7585565254139251988,Baca berita di inilah.com https://www ... Inovasi Teknologi untuk Ekosistem: Zero Waste Mining: Laporan UI mencatat penggunaan teknologi ...,8,,
Prabowo Perintahkan Bentuk PP untuk Jawab Polemik ...,https://video.kompas.com/watch/1898018/prabowo-perintahkan-bentuk-pp-untuk-jawab-polemik-perpol-102025,Prabowo Perintahkan Bentuk PP untuk Jawab Polemik Perpol 10/2025. News. 14 jam lalu. dimas nanda krisna.,9,,
Berita Teknologi | Bharata Online,https://www.bharataonline.com/berita/kategori/7,Berita Teknologi · Para Peneliti Tiongkok Menyelesaikan Kasus Sukses Kedua dalam Uji Coba Antarmuka Otak-K... · Tiongkok Terbitkan Standar Pertama untuk Metrik ...,10,,
Berita Terkini Harian Teknologi Informasi Terbaru Hari Ini,https://www.kompas.com/tag/teknologi-informasi,"Anak dan Pelajar Jadi Sasaran, Polri Temukan Tren Baru Rekrutmen Terorisme · HUT Ke-80 TNI, Puan Maharani Tekankan Pentingnya Kemandirian Teknologi Pertahanan ...",1,,
"Pasca banjir yang melanda Aceh Tamiang, relawan ...",https://www.tiktok.com/@inilahcom/video/7585527873046662420,Baca berita di inilah.com https://www ... Inovasi Teknologi untuk Ekosistem: Zero Waste Mining: Laporan UI mencatat penggunaan teknologi ...,2,,
"Penampilan Terbaru Ferdy Sambo, Beri Khutbah di Lapas",https://video.kompas.com/watch/1897119/penampilan-ferdy-sambo-terbaru-beri-khutbah-di-lapas,"Penampilan Terbaru Ferdy Sambo, Beri Khutbah di Lapas. News. 16 Desember 2025. Fathir Rochman,. Inggried Dwi. Tim Redaksi.",3,,
Berita Terkini Teknologi - Sains,https://www.cnnindonesia.com/teknologi/sains,"CNNIndonesia.com menyajikan berita sains meliputi peristiwa sains, antariksa, flora, fauna hingga penemuan terbaru dan terkini.",4,,
"Empat Rumah Terbakar, Lima Penghuni Tewas Terjebak Api",https://www.youtube.com/watch?v=7qtjShGMx1E,... berita televisi nasional yang berada di bawah naungan Elang Mahkota Teknologi (Emtek) Group. Liputan 6 SCTV juga menyajikan informasi dalam ...,5,,
Kategori: Berita Sorotan (3 Berita) | Portal Merauke,https://portal.merauke.go.id/berita/kategori/berita-sorotan,berita · Sains dan Teknologi. 202 berita · Otomotif. 22 berita · Potensi. 4 berita ... berita · Info Covid 19. 15 berita · Statistik. 12 berita · Pojok Merauke.,6,,
Banyak warganet mengungkapkan kemarahan sekaligus ...,https://www.tiktok.com/@inilahcom/video/7585807115168566548,info kalau udah dibpecat ya min. 4h ago ... Inovasi Teknologi untuk Ekosistem: Zero Waste Mining: Laporan UI mencatat penggunaan teknologi ...,7,,
Anggota DPR: Literasi digital penting hadapi ...,https://www.antaranews.com/berita/5315290/anggota-dpr-literasi-digital-penting-hadapi-perkembangan-teknologi,... Berita ANTARA. Tags: I NENGAH SENANTARA · ANGGOTA DPR · LITERASI DIGITAL · PERKEMBANGAN TEKNOLOGI. Komentar. Komentar menjadi tanggung-jawab ...,8,,
RefeleksidanArahPengembanga...,https://lldikti3.kemdikbud.go.id/tag/refeleksidanarahpengembangansainsdanteknologi/,"... Teknologi Kemdiktisaintek […] Lembaga Layanan Pendidikan Tinggi Wilayah III Kementerian Pendidikan Tinggi, Sains, dan Teknologi. Satuan kerja ...",9,,
Berita Teknologi informasi Hari Ini - Kabar Terbaru Terkini,https://www.liputan6.com/tag/teknologi-informasi,"Berita Teknologi informasi - Remala menandatangani sejumlah Nota Kesepahaman (MoU) dengan enam penyedia jaringan telekomunikasi, baik nasional maupun ...",10,,
Anggota DPR: Literasi digital penting hadapi ...,https://www.antaranews.com/berita/5315290/anggota-dpr-literasi-digital-penting-hadapi-perkembangan-teknologi,... Berita ANTARA. Tags: I NENGAH SENANTARA · ANGGOTA DPR · LITERASI DIGITAL · PERKEMBANGAN TEKNOLOGI. Komentar. Komentar menjadi tanggung-jawab ...,1,,
Trump Murka Setelah 3 Warga AS Tewas Diserang di ...,https://video.kompas.com/watch/1896615/trump-murka-setelah-3-warga-as-tewas-diserang-di-suriah-janji-balas,"... Teknologi. 1 jam lalu · 03:32. Kamboja ""Minta Tolong"" Dunia Bantu Lawan Thailand. News. 1 jam ...",2,,
Berita Teknologi informasi Hari Ini - Kabar Terbaru Terkini,https://www.liputan6.com/tag/teknologi-informasi,"Berita Teknologi informasi - Remala menandatangani sejumlah Nota Kesepahaman (MoU) dengan enam penyedia jaringan telekomunikasi, baik nasional maupun ...",3,,
16 Layanan Enterprise Telkom untuk Meningkatkan ...,https://www.telkom.co.id/sites/berita/id_ID/article/16-layanan-enterprise-telkom-untuk-meningkatkan-operasional-bisnis-anda-131,"Dengan dukungan jaringan nasional yang luas dan teknologi terkini, layanan ini memungkinkan bisnis menjaga kelancaran komunikasi internal, ...",4,,
ITB Raih Anugerah Keterbukaan Informasi Publik Tahun ...,https://itb.ac.id/berita/itb-raih-anugerah-keterbukaan-informasi-publik-tahun-2025-kualifikasi-informatif/63166,"Berita; Institusi. ITB Raih Anugerah Keterbukaan Informasi Publik Tahun ... JAKARTA, itb.ac.id – Institut Teknologi Bandung (ITB) kembali ...",5,,
Kami Institusi Taat Hukum | Liputan 6,https://www.youtube.com/watch?v=IRYD5U-Q1f0,... berita televisi nasional yang berada di bawah naungan Elang Mahkota Teknologi (Emtek) Group. Liputan 6 SCTV juga menyajikan informasi dalam ...,6,,
Indeks Berita Teknologi Informasi dan Komunikasi - 1 - detikInet,https://inet.detik.com/indeks,"Kumpulan berita teknologi informasi dan komunikasi terkini, mengulas tentang dunia internet, gadget, game, social media, aplikasi, fotografi, komputer, ...",7,,
AGEN POKER WILAYAH RESMI TOPTECH TEKNOLOGI ...,https://toptech.linformaticien.com/cache/cookies/AGEN-POKER-1494,"AGEN POKER VISI MISI RESMI TOPTECH REFERENSI TEKNOLOGI MENENTUKAN PLATFORM INFORMASI MODERN YANG BERFOKUS PADA PENYAJIAN BERITA, ANALISIS, ...",8,4.3,612806
WUHUUU TIM MERBABU DAN TIM MERAPI SIAP ...,https://www.tiktok.com/@clashofchampionsofficial/video/7585563778868120853,Nantikan info-info terbarunya di media sosial Ruangguru. Stay ... Teknologi Informasi Silver Medal - World Mathematics Invitation ...,9,,
Berita Terkini Harian Teknologi Informasi Terbaru Hari Ini,https://www.kompas.com/tag/teknologi-informasi,"Anak dan Pelajar Jadi Sasaran, Polri Temukan Tren Baru Rekrutmen Terorisme · HUT Ke-80 TNI, Puan Maharani Tekankan Pentingnya Kemandirian Teknologi Pertahanan ...",10,,
Berita dan Informasi Inovasi teknologi Terkini dan Terbaru ...,https://www.detik.com/tag/inovasi-teknologi,"Putra Ilham Setiyansyah, dari Energi Terbarukan ke Juragan Kafe Bandung. 6 Tren AI yang Diprediksi Akan Populer pada 2026, Bakal Secanggih Apa? detikEduMinggu, ...",1,,
NO DRAKOR COM CARI LINK TOPTECH ...,https://toptech.linformaticien.com/cache/cookies/NO-DRAKOR-COM-1308,"NO DRAKOR COM ALAMAT SITUS TOPTECH BERITA TEKNOLOGI MENENTUKAN PLATFORM INFORMASI MODERN YANG BERFOKUS PADA PENYAJIAN BERITA, ANALISIS, ...",2,,
"Buat Masker Cerdas dari Limbah, Tim Mahasiswa ITB ...",https://itb.ac.id/berita/buat-masker-cerdas-dari-limbah-tim-mahasiswa-itb-juara-1-inovasi-produk-nasional/63181,"(ITB) dari Program Studi Teknologi Pascapanen meraih Juara 1 dalam ... Berita; Utama. Buat Masker Cerdas dari Limbah, Tim Mahasiswa ITB ...",3,,
"Sentilan Keras Gus Kikin di Haul Gus Dur: ""Kita Lebih ...",https://www.tiktok.com/@inilahcom/video/7585166459677052168,... berita di inilah.com https ... Inovasi Teknologi untuk Ekosistem: Zero Waste Mining: Laporan UI mencatat penggunaan teknologi ...,4,,
RefeleksidanArahPengembanga...,https://lldikti3.kemdikbud.go.id/tag/refeleksidanarahpengembangansainsdanteknologi/,"... Teknologi Kemdiktisaintek […] Lembaga Layanan Pendidikan Tinggi Wilayah III Kementerian Pendidikan Tinggi, Sains, dan Teknologi. Satuan kerja ...",5,,
Berita Terkini Harian Perkembangan Teknologi Terbaru ...,https://www.kompas.com/tag/perkembangan-teknologi,"10 Pekerjaan Diprediksi Akan Hilang 5 Tahun ke Depan, Apa Saja? · 12 Dampak Positif Perkembangan Teknologi. Skola. 5 April 2025. Teknologi AI AuroraLLM Siap ...",6,,
Pak Purbaya siapkan 60 TRILIUN buat Sumatera dari ...,https://www.tiktok.com/@geraldvincentt/video/7585801304400842005,"... berita Gorontalo terbaru, video viral Gorontalo, DPRD Gorontalo insiden ... teknologi informasi di Indonesia, tantangan teknologi Indonesia ...",7,,
keadaan rumah ibu yang belum ketemu anaknya ..,https://www.tiktok.com/@vilmeijuga/video/7584762611158682901,"... berita Medan terbaru, hukum anak di bawah umur, kejadian kriminal ... Tantangan Rama Cici Dola, momen emosional Cici Dola, teknologi di ...",8,,
[FULL] Prabowo Keras Depan Pejabat Papua Bicara ...,https://m.youtube.com/watch?v=DUylBU-qOMw,... berita televisi nasional yang berada di bawah naungan Elang Mahkota Teknologi (Emtek) Group. Liputan 6 SCTV juga menyajikan informasi dalam ...,9,,
Berita Teknologi Unik Hari Ini - Kabar Terbaru Terkini,https://www.liputan6.com/tag/teknologi-unik,Teknologi Unik · PC Gaming Ini Punya Fitur Kulkas (Sumber: Little Black Book Online) · Bahan Pembuat Pasta Gigi Ini Bisa Tambah Daya Tempuh Mobil Listrik ( ...,10,,
ITB Raih Anugerah Keterbukaan Informasi Publik Tahun ...,https://itb.ac.id/berita/itb-raih-anugerah-keterbukaan-informasi-publik-tahun-2025-kualifikasi-informatif/63166,"Berita; Institusi. ITB Raih Anugerah Keterbukaan Informasi Publik Tahun ... JAKARTA, itb.ac.id – Institut Teknologi Bandung (ITB) kembali ...",1,,
Tendik Fakultas Vokasi ITNY Lolos Sertifikasi Kompetensi ...,https://lldikti5.kemdikbud.go.id/home/detailpost/tendik-fakultas-vokasi-itny-lolos-sertifikasi-kompetensi-tendik-vokasi-2025-tingkat-nasional,"Tendik Fakultas Vokasi ITNY Lolos Sertifikasi Kompetensi Tendik Vokasi 2025 Tingkat Nasional. Berita PT Kamis,18 Desember 2025. Institut Teknologi Nasional ...",2,,
Sharp AQUOS R10 dan Sense10 Resmi Masuk Indonesia!,https://www.youtube.com/shorts/UuBOAS-dfGQ,"Pakai Snapdragon 7+ Gen3 dan 7s Gen3, worth-it harga segini? #jagatreview #beritateknologi #smartphone #Sharp #AquosR10 #AquosSense10 ...",3,,
Khofifah: OPOP harus naik kelas lewat inovasi dan ...,https://www.antaranews.com/berita/5314456/khofifah-opop-harus-naik-kelas-lewat-inovasi-dan-teknologi-its,"Dilarang keras mengambil konten, melakukan crawling atau pengindeksan otomatis untuk AI di situs web ini tanpa izin tertulis dari Kantor Berita ...",4,,
Inilah penampakan Hutan Kota di Kabupaten Berau ...,https://www.tiktok.com/@inilahcom/video/7585131450685476117,Baca berita di inilah.com https://www ... Inovasi Teknologi untuk Ekosistem: Zero Waste Mining: Laporan UI mencatat penggunaan teknologi ...,5,,
Berita Terkini Harian Teknologi Digital Terbaru Hari Ini,https://www.kompas.com/tag/teknologi-digital,"Inovasi Layanan Publik Digital Antarkan Menkomdigi Raih OPSI KIPP 2025 · Tes Calon Kepala DPRKPP Surabaya, Kandidat Tawarkan Teknologi Digital Twin · Studi ...",6,,
POCO M8 Pro Pakai SoC Qualcomm!,https://www.youtube.com/shorts/R-k1XPvJihY,#jagatreview #smartphone #beritateknologi #poco.,7,,
Apa bener berobat di Malaysia lebih bagus dan lebih murah?,https://www.tiktok.com/@geraldvincentt/video/7585167470898466069,"... berita Gorontalo terbaru, video viral Gorontalo, DPRD Gorontalo insiden ... teknologi informasi di Indonesia, tantangan teknologi Indonesia ...",8,,
Salut banget sama ARMY Indonesia! Fans BTS turun ...,https://www.tiktok.com/@kitabisacom/video/7585127934910909714,"֮Aii_Koo. suka heran, kalau ada berita positif gini kok haters suka ngilang? ... •Teknologi F4.1 Terbaru Unit T-0317 ini sudah membawa standar F4.1 ...",9,,
CARA MASAK KWETIAU LANGKAH SITUS ...,https://toptech.linformaticien.com/cache/cookies/CARA-MASAK-KWETIAU-1251,"CARA MASAK KWETIAU CHAT RESMI TOPTECH MENENTUKAN PLATFORM INFORMASI MODERN YANG BERFOKUS PADA PENYAJIAN BERITA, ANALISIS, ...",10,,
Inilah penampakan Hutan Kota di Kabupaten Berau ...,https://www.tiktok.com/@inilahcom/video/7585131450685476117,Baca berita di inilah.com https://www ... Inovasi Teknologi untuk Ekosistem: Zero Waste Mining: Laporan UI mencatat penggunaan teknologi ...,1,,
Berita Terkini Harian Teknologi Komunikasi Terbaru Hari Ini,https://www.kompas.com/tag/teknologi-komunikasi,"China Luncurkan Satelit Komunikasi Baru, Roket Long March 5 · Di HUT Ke-30 Kompas.com, Menkomdigi Bercerita Cepatnya Perkembangan Teknologi · Anggaran Teknologi ...",2,,
PRIMA ITB dan CEO Summit 2025 Dorong Hilirisasi ...,https://itb.ac.id/berita/prima-itb-dan-ceo-summit-2025-dorong-hilirisasi-dan-sinergi-riset-teknologi-mendalam-dengan-industri/63171,Berita · PRIMA ITB dan CEO Summit 2025 Dorong Hilirisasi dan Sinergi Riset Teknologi Mendalam dengan Industri.,3,,
POCO M8 Pro Pakai SoC Qualcomm!,https://www.youtube.com/shorts/R-k1XPvJihY,#jagatreview #smartphone #beritateknologi #poco.,4,,
Apa bener berobat di Malaysia lebih bagus dan lebih murah?,https://www.tiktok.com/@geraldvincentt/video/7585167470898466069,"... berita Gorontalo terbaru, video viral Gorontalo, DPRD Gorontalo insiden ... teknologi informasi di Indonesia, tantangan teknologi Indonesia ...",5,,
Salut banget sama ARMY Indonesia! Fans BTS turun ...,https://www.tiktok.com/@kitabisacom/video/7585127934910909714,"֮Aii_Koo. suka heran, kalau ada berita positif gini kok haters suka ngilang? ... •Teknologi F4.1 Terbaru Unit T-0317 ini sudah membawa standar F4.1 ...",6,,
Berita Humaniora & Informasi Pengetahuan Terkini,https://www.kompas.id/kategori/ilmu-pengetahuan-teknologi,Sains & Teknologi·. 18 jam lalu ...,7,,
"Android - Berita Teknologi Gadget, Games Keren, Aplikasi ...",https://www.liputan6.com/tekno/android,"Berita Teknologi Liputan6.com menyajikan kabar gadget terbaru, games keren, daftar aplikasi ponsel, aktititas internet hingga operator telekomunikasi.",8,,
MENTARI MULIA TOPTECH TEKNOLOGI DENGAN ...,https://toptech.linformaticien.com/cache/cookies/MENTARI-MULIA-74,... TEKNOLOGI UNTUK KOLABORASI RESMI KONTAK KAMI TOPTECH BERITA TEKNOLOGI. REGISTRASI MEMBER TOPTECH DUNIA DIGITAL DIDUKUNG OLEH PARTNER RESMI ...,9,,
Berita Terbaru Teknologi Indonesia Dunia Hari Ini,https://mediaindonesia.com/teknologi/1886,"Samsung Rilis Galaxy A07, Ponsel Bertenaga Harga Sejutaan · MSH 15-52: Nebula 'Tangan Kosmik' Menakjubkan dari Sisa Ledakan Supernova · Misteri ""Hubble Tension"" ...",10,,
MENTARI MULIA TOPTECH TEKNOLOGI DENGAN ...,https://toptech.linformaticien.com/cache/cookies/MENTARI-MULIA-74,... TEKNOLOGI UNTUK KOLABORASI RESMI KONTAK KAMI TOPTECH BERITA TEKNOLOGI. REGISTRASI MEMBER TOPTECH DUNIA DIGITAL DIDUKUNG OLEH PARTNER RESMI ...,1,,
Berita Terkini Harian Inovasi Teknologi Terbaru Hari Ini,https://www.kompas.com/tag/inovasi-teknologi,"China Berambisi Pimpin Dunia Modern, Ubah Prinsip Pabrik Jadi Pusat Teknologi · Pemprov Jakarta, Inotek, dan Starbucks Indonesia Luncurkan Program KRING untuk ...",2,,
Berita Terbaru Teknologi Indonesia Dunia Hari Ini,https://mediaindonesia.com/teknologi/1886,"Samsung Rilis Galaxy A07, Ponsel Bertenaga Harga Sejutaan · MSH 15-52: Nebula 'Tangan Kosmik' Menakjubkan dari Sisa Ledakan Supernova · Misteri ""Hubble Tension"" ...",3,,
Khofifah OPOP harus naik kelas lewat inovasi dan ...,https://jatim.antaranews.com/berita/1015642/khofifah-opop-harus-naik-kelas-lewat-inovasi-dan-teknologi-its,"Dilarang keras mengambil konten, melakukan crawling atau pengindeksan otomatis untuk AI di situs web ini tanpa izin tertulis dari Kantor Berita ...",4,,
"Akurasi Presisi Berbasis AI, Tim Drone Al-Mubarok UMY ...",https://lldikti5.kemdikbud.go.id/home/detailpost/akurasi-presisi-berbasis-ai-tim-drone-al-mubarok-umy-sabet-penghargaan-nasional-the-best-potential-team,"... teknologi pengiriman barang (dropping cargo) ... Kami menyajikan informasi dan berita seputar kegiatan di LLDIKTI Wilayah V, berita ...",5,,
ITB Berikan Bantuan Instalasi Pengolahan Air ke Daerah ...,https://itb.ac.id/berita/itb-berikan-bantuan-instalasi-pengolahan-air-ke-daerah-bencana/63184,"BANDUNG, itb.ac.id — Institut Teknologi Bandung (ITB) mengirimkan ... Berita; Utama. ITB Berikan Bantuan Instalasi Pengolahan Air ke ...",6,,
Berita Berita Teknologi Hari Ini - Kabar Terbaru Terkini,https://www.liputan6.com/tag/berita-teknologi,Berita Teknologi · Organoid otak manusia yang dihubungkan ke chip komputer kini dapat belajar mengendalikan robot berkat antarmuka biokomputasi · Solusi deteksi ...,7,,
CARA DESAIN WEB SENDIRI PLATFORM SITUS ...,https://toptech.linformaticien.com/cache/cookies/CARA-DESAIN-WEB-SENDIRI-2431,"... BERITA, ANALISIS, DAN WAWASAN MENDALAM SEPUTAR PERKEMBANGAN TEKNOLOGI TERKINI YANG RELEVAN DENGAN KEBUTUHAN DUNIA DIGITAL MASA KINI, DI MANA ...",8,,
Berita Terkini Harian Teknologi Canggih Terbaru Hari Ini,https://www.kompas.com/tag/teknologi-canggih,"Kisah China Memburu Mantan Pejabatnya di AS Pakai Teknologi Canggih · China Buka Mal Robot Humanoid, Lebih dari 100 Jenis Dipamerkan · Teknologi Canggih Chery ...",9,,
UAJY AJAK MAHASISWA ASING IKUTI PRE-HOLIDAY ...,https://lldikti5.kemdikbud.go.id/home/detailpost/uajy-ajak-mahasiswa-asing-ikuti-pre-holiday-party-jelang-libur-semester,"Kami menyajikan informasi dan berita seputar kegiatan di LLDIKTI Wilayah V, berita ... Kementerian Pendidikan Tinggi, Sains dan Teknologi ...",10,,
MIX PARLAY HARI INI TOPTECH EDUKASI TEKNOLOGI ...,https://toptech.linformaticien.com/cache/cookies/MIX-PARLAY-HARI-INI-2610,"... BERITA, ANALISIS, DAN WAWASAN MENDALAM SEPUTAR PERKEMBANGAN TEKNOLOGI TERKINI YANG RELEVAN DENGAN KEBUTUHAN DUNIA DIGITAL MASA KINI, DI MANA ...",1,4.7,225880
Berita Teknologi Canggih Hari Ini - Kabar Terbaru Terkini,https://www.liputan6.com/tag/teknologi-canggih,Teknologi Canggih · Viral Penjual Soto Jualan Pakai Apple Vision Pro. · Ilustrasi AI Robotika Bersalaman dengan Manusia (Foto: Freepik) · Polda Sumut ...,2,,
Berita Terkini Harian Berita Teknologi Terbaru Hari Ini,https://www.kompas.com/tag/berita-teknologi,All rights reserved. #Berita Teknologi. Semua. Artikel. Video. Ada 0 artikel dan 1 video dari tag terkait. Terbaru Terlama. 02:01 ...,3,,
MAIN SCATTER TOPTECH LINFORMATICIEN ...,https://toptech.linformaticien.com/cache/cookies/MAIN-SCATTER-2961,"... BERITA, ANALISIS, DAN WAWASAN MENDALAM SEPUTAR PERKEMBANGAN TEKNOLOGI TERKINI YANG RELEVAN DENGAN KEBUTUHAN DUNIA DIGITAL MASA KINI, DI MANA ...",4,,
Berita Hardware Teknologi Terbaru Hari ini,https://tekno.kompas.com/hardware,"Samsung Resmi Rilis Exynos 2600, Chip HP 2nm Pertama di Dunia · Qualcomm Rilis Snapdragon 6s 4G Gen 2 dan Snapdragon 4 Gen 4, HP Murah Makin Kencang · Apakah ...",5,,
CARA MEMASAK BOCI KUAH PEDAS ...,https://toptech.linformaticien.com/cache/cookies/CARA-MEMASAK-BOCI-KUAH-PEDAS,"... BERITA, ANALISIS, DAN WAWASAN MENDALAM SEPUTAR PERKEMBANGAN TEKNOLOGI TERKINI YANG RELEVAN DENGAN KEBUTUHAN DUNIA DIGITAL MASA KINI, DI MANA ...",6,,
Berita Gadget Terbaru Hari ini,https://tekno.kompas.com/gadget,"Berita Gadget Hari Ini, Kabar Berita Terkini Produk Gadget Terbaru Meliputi Produk Smartphone, Tablet, Laptop, Komputer, Handphone di Indonesia dan Dunia.",7,,
