title,link,snippet,position,rating,ratingCount
Berita Teknologi IT Terbaru Hari Ini - Kompas.com,https://tekno.kompas.com/,"REVIEW · Samsung Resmi Rilis Exynos 2600, Chip HP 2nm Pertama di Dunia · OpenAI Rilis GPT-5.2 Codex, AI Paling Jago Coding dan Kebal Retas · OpenAI Punya ""Toko ...",1,,
Berita dan artikel terkini seputar teknologi,https://www.antaranews.com/tekno,"Berita dan artikel terkini dan terpercaya mengenai dunia teknologi, gadget, smartphone, telekomunikasi, games, aplikasi, internet, hingga review produk.",2,,
CNN Indonesia | Berita Terkini Teknologi,https://www.cnnindonesia.com/teknologi,"CNNIndonesia.com menyajikan berita teknologi meliputi teknologi informasi, Otomotif, sains hingga berita otomotif terbaru dan terkini.",3,,
detikInet - Berita Teknologi Informasi Gadget Terbaru Hari ini,https://inet.detik.com/,"Berita teknologi informasi dan komunikasi terkini, mengulas tentang dunia internet, gadget, game, social media, aplikasi, fotografi, komputer, software dan ...",4,,
Teknologi ID - Berita Teknologi Indonesia & Komunitas IT Online,https://teknologi.id/,"Platform berita teknologi terbaru. kabar berita gadget, tips dan cara dunia IT, review produk, dunia digital, software & hardware.",5,,
Berita Teknologi Hari Ini Update dan Terbaru - Techbiz.id,https://techbiz.id/,"Latest News · Lagi Diskon! · Apple Bidik India untuk Perakitan Chip iPhone, Gandeng Perusahaan Semikonduktor Lokal · Galaxy Z TriFold Dukung DeX Mandiri dan ...",6,,
"Bisnis Tekno - Berita seputar Teknologi, Gadget, Gaming ...",https://teknologi.bisnis.com/,"Bisnis.com menyajikan berita teknologi informasi terkait gadget, gawai, aplikasi, ponsel, startup, elektronik hingga tips dan trik terbaru terkini.",7,,
Kanal Berita Teknologi Tazkia,https://tazkia.ac.id/berita/teknologi,"DeepSeek menjadi Rising Stars di Teknologi AI , ChatGPT Harus Siap-Siap! Teknologi, di satu sisi, bisa terasa mengerikan, ya, karena rasanya semua hal mulai ...",8,,
Berita Tentang Teknologi Terkini Dan Terlengkap,https://www.cnbcindonesia.com/tag/teknologi,"China Sudah Ditinggalkan, Ini Negara Penggantinya. Tech 2 hari yang lalu · Bos Mata-Mata Inggris Ungkap Presiden dan Perdana Menteri Cuma Boneka.",9,,
iTNews Indonesia - Berita Teknologi Informasi Terkini,https://www.itnews.id/,"Berita Seputar Teknologi Informasi Terkini, Platform Digital, Hardware, Update Informasi Pengembangan dan Inovasi Teknologi.",10,,
Berita Teknologi Terbaru (@tekdotid) · Jakarta,https://www.instagram.com/tekdotid/,"Berita seputar teknologi, gadget, inovasi dan gaya hidup hi@tek.id. Dipakai kerja, ngonten, sampai nemenin aktivitas seharian.",1,,
Berita Teknologi oleh Voice of America,https://www.voaindonesia.com/z/410,"Aplikasi AI Klaim 99,8% Akurat Deteksi Kanker Kulit. Perusahaan teknologi Inggris, Skin Analytics, telah mendapat persetujuan regulasi untuk DERM - sistem ...",2,,
Berita Teknologi,http://www.youtube.com/beritateknologi,Videos · Belajar Docker dengan Mengenal Apa itu Docker lebih Mendalam · Walker calon Robot Asisten Rumah Tangga Masa Depan · Samsung Galaxy J7 2016 vs Vivo V5 ...,3,,
Berita Teknologi dan Digital Terkini,https://www.cbn.id/id/news,"Temukan informasi, promosi dan berita terlengkap dari CBN terkait dengan teknologi, digital, internet, dan masih banyak lagi.",4,,
Berita Teknologi Dan Inovasi Terbaru Hari Ini 20 ...,https://www.tempo.co/sains/teknologi-dan-inovasi,Google Akan Uji Pusat Data di Luar Angkasa pada 2027 · Pesawat Eksperimental X-66 NASA Lalui Uji Wind Tunnel · SpaceX Tuding Satelit Cina Nyaris Tabrak ...,5,,
Berita Teknologi Terbaru Hari Ini,https://translate.google.com/translate?u=https://www.reuters.com/technology/&hl=id&sl=en&tl=id&client=srp,"Video Teknologi · Blackstone berencana memperluas proyek pusat data Spanyol senilai $5 miliar · Pengadilan Moskow mendenda Pinterest dan Twitch karena gagal ...Find latest technology news from every corner of the globe at Reuters.com, your online source for breaking international news coverage.",6,,
"Berita Teknologi, Gadget, hingga Game Terbaru Hari Ini",https://www.inilah.com/tag/teknologi,"Sajian Berita Teknologi Terkini, mengulas seputar smartphone terbaru, perkembangan IT, kecerdasan buatan, rekomendasi gadget, hingga games terupdate.",7,,
Video dan berita teknologi informasi Terkini dan Terbaru ...,https://www.metrotvnews.com/tag/2136/teknologi-informasi,"Tantang Dominasi PS5 dan Xbox, Valve Umumkan Konsol Gim Steam Machine Generasi Baru ... OpenAI Rilis ChatGPT 5.1, Apa Saja Keunggulannya? OpenAI Rilis ChatGPT 5.1 ...",8,,
Techmind.id - Berita Teknologi Terbaru Hari Ini,https://techmind.id/,"Memudahkan masyarakat Indonesia menemukan berita & forum teknologi dari AI, gadget, hingga bisnis yang terpercaya dan disadur ahli industri.",9,,
Berita Teknologi Terkini dan Terbaru Hari Ini,https://www.sindonews.com/topic/1385/teknologi,"Berita harian Teknologi terkini, terlengkap, hari ini - Perkuat Ekspansi Bisnis Nasional, Dahua Kolaborasi PT ECS Indo Jaya. ITS Siapkan 100 Beasiswa bagi ...",10,,
"Berita Teknologi Gadget, Games Keren, Aplikasi Terbaru ...",https://www.liputan6.com/tekno,"Berita Teknologi Liputan6.com menyajikan kabar gadget terbaru, games keren, daftar aplikasi ponsel, aktititas internet hingga operator telekomunikasi.",1,,
https://news.google.com/topics/CAAqJggKIiBDQkFTRWd...,https://news.google.com/topics/CAAqJggKIiBDQkFTRWdvSUwyMHZNRGRqTVhZU0FtbGtHZ0pKUkNnQVAB?hl=id&gl=ID&ceid=ID%3Aid,Tidak ada informasi mengenai halaman ini.,2,,
Kemajuan Teknologi dan Peran Program Studi Sistem ...,https://news.bsi.ac.id/berita/kemajuan-teknologi-dan-peran-sistem-informasi/,"BSINews, Cikampek — Kemajuan teknologi telah membawa dampak besar pada berbagai aspek kehidupan, termasuk dunia pendidikan.",3,,
Berita Teknologi Informasi Terbaru dan Terkini Hari ini,https://www.medcom.id/tag/16290/teknologi-informasi,Teknologi Informasi · Survei: 90% Tim IT di Indonesia Hadapi Keterbatasan Anggaran · Cara Teknologi Informasi Mengubah Wajah Demokrasi · Unggul di Dimensi Data ...,4,,
Berita Teknologi Terbaru Hari Ini Generasi Millennial,https://www.idntimes.com/tech,"Berita teknologi terbaru hari ini di Indonesia dan dunia. Mulai dari review gadget/smartphone, review game, tips dan trik, harga terbaru hingga tren ...",5,,
Artikel Berita Teknologi - Situs Resmi Acer Indonesia,https://www.acerid.com/berita-teknologi,Artikel seputar teknologi terkini yang dimiliki produk-produk Acer hingga tips dan trik terhadap fitur dan teknologi pada perangkat gadget masa kini.,6,,
Berita Teknologi Terbaru dan Terupdate,https://kumparan.com/topic/teknologi,Teknologi · Ancaman Dehumanisasi di Balik Dominasi AI dan Gadget · Pajak Digital: Bagaimana Teknologi Mengubah Cara Kita Membayar Pajak · Rumah Sakit Gleneagles ...,7,,
Techno Okezone - Berita Teknologi IT Terbaru Terkini Hari Ini,https://ototekno.okezone.com/techno,"Berita Teknologi Hari Ini, Berita Teknologi Indonesia dan Kabar Berita Terkini Dunia IT Meliputi Gadget , Games, Apps, Smartphone Terbaru, Review Produk, ...",8,,
Berita Teknologi Dan Internet Terbaru Hari Ini,https://www.idxchannel.com/technology,"Berita Teknologi Terkini Hari Ini Seputar Informasi Teknologi, Gadget, Komputer, Aplikasi, Cara Transfer, Dunia Digital, Internet, Games, Software, ...",9,,
Teknologi AI Tidak Sepenuhnya Bisa Menggantikan ...,https://ugm.ac.id/id/berita/kehadiran-ai-menghadirkan-dinamika-kompleks/,"Kemunculan teknologi kecerdasan buatan atau AI menghadirkan dinamika yang kompleks. AI sebagai inovasi dapat memberikan manfaat, ...",10,,
Berita perkembangan teknologi Terbaru Hari Ini,https://www.kompas.id/label/perkembangan-teknologi,"Perkembangan teknologi melesat di abad ke-21. Namun, Indonesia masih dihadang tantangan besar, yakni literasi digital, kesenjangan SDM, ...",1,,
Berita teknologi Terbaru Hari Ini,https://www.tribunnews.com/tag/teknologi,"Anggota Komisi XII DPR Dorong Penerapan Teknologi Secara Cermat pada Pengelolaan Sumur Migas · Hingga Kuartal III 2025, Emiten Hashim Djojohadikusumo Kantongi ...",2,,
TechNewsWorld - Berita dan Informasi Teknologi,https://translate.google.com/translate?u=https://www.technewsworld.com/&hl=id&sl=en&tl=id&client=srp,"Berita teknologi, ulasan dan analisis komputasi, TI perusahaan, keamanan siber, teknologi seluler, komputasi awan, tren industri teknologi, petunjuk, ...Tech news, reviews and analysis of computing, enterprise IT, cybersecurity, mobile technology, cloud computing, tech industry trends, how-tos, ...",3,,
Len Dorong Integritas Teknologi Alutsista Modern,https://www.jabarprov.go.id/berita/len-dorong-integritas-teknologi-alutsista-modern-22549,"Len memposisikan teknologi sebagai enabler strategis dalam memperkuat kesiapsiagaan, mobilitas, dan efektivitas operasi, baik pada level taktis ...",4,,
Berita Teknologi dan Sains - ABC News,https://translate.google.com/translate?u=https://abcnews.go.com/Technology&hl=id&sl=en&tl=id&client=srp,"Berita Teknologi · Panggilan katak asli terdengar lagi di California Selatan · Laporan triwulanan Nvidia akan mengukur suhu kegilaan AI · NCAA membantu atlet ...Get the latest science news and technology news, read tech reviews and more at ABC News.",5,,
BMKG Pamerkan Teknologi Peringatan Dini di EDRR ...,https://www.bmkg.go.id/berita/bmkg-pamerkan-teknologi-peringatan-dini-di-edrr-indonesia-2025-dorong-aksi-dini-untuk-semua,"Dalam pameran ini, BMKG memamerkan beragam inovasi, teknologi mutakhir, dan Alat Operasional Utama (Aloptama) yang mendukung sistem peringatan ...",6,,
Berita Terbaru Tentang Teknologi Hari Ini 20 Desember 2025,https://www.tempo.co/tag/teknologi,AI Mulai Mampu Rancang Virus Baru. Seberapa Bahaya? Prabowo Perintahkan TNI Ikuti Perkembangan Teknologi dan AI · Pentingnya Literasi Teknologi demi Tingkatkan ...,7,,
Teknologi - BBC News Indonesia,https://www.bbc.com/indonesia/topics/c5qvpxjzq1xt,Korban kekerasan seksual anak minta Elon Musk hapus tautan ke fotonya – Investigasi BBC temukan penjual kontennya ada di Indonesia ... Wisatawan mancanegara ...,8,,
Berita Hoaks Terkait,https://www.komdigi.go.id/berita/berita-hoaks,[HOAKS] Video Anggota Dewan Minta Uang Sewa Tenda Darurat ke Pengungsi Korban Bencana · [HOAKS] Tautan Pesan Berantai WhatsApp Group Bantuan PKH dan BLT Tahun ...,9,,
Sony Indonesia | Berita Teknologi Terbaru | Elektronik | Hiburan,https://www.sony.co.id/id/,"Temukan beragam produk berkualitas tinggi dari Sony dan teknologi yang mengusungnya, dapatkan akses instan ke toko dan Jaringan Hiburan kami.",10,,
Kategori: Sains dan Teknologi (202 Berita),https://portal.merauke.go.id/berita/kategori/sains-dan-teknologi,Pj Gubernur Launching Aplikasi SIMPEG Terintegrasi dan SIAPPS Provinsi Papua Selatan · 3 Okt 2024. 3521 ; Pemprov Papua Selatan Launching Aplikasi CSR (Si-CSR) ...,1,,
Artikel Berita Teknologi Terbaru Hari Ini,https://translate.google.com/translate?u=https://apnews.com/technology&hl=id&sl=en&tl=id&client=srp,"Teknologi · Studi mengatakan chatbot AI perlu memperbaiki respons bunuh diri, karena keluarga menggugat atas peran ChatGPT dalam kematian anak laki-laki ...Don't miss an update on the latest tech news from The Associated Press. AP News has everything you need to know for technology news today.",2,,
Semua berita tentang Teknologi | Euronews,https://translate.google.com/translate?u=https://www.euronews.com/tag/technology&hl=id&sl=en&tl=id&client=srp,Kategori. Berita Teknologi · Uang · Ruang angkasa · Program. Dub.AI · Pemburu Peretas · Memikirkan kembali · Unggulan. Obrolan Teknologi Euronews. Euronews Tech ...Donald Trump and Ursula von der Leyen announcing the EU-US trade agreement in July · Europe News · Analysis: Trump's policies set to widen EU-US innovation gap.,3,,
Tekno,https://waktu.news/tekno/,"Dapatkan berita teknologi terkini dari sumber terpercaya. Temukan panduan lengkap tentang gadget terbaru, aplikasi revolusioner, dan tren di dunia ...",4,,
Ruang Kolaborasi PTP Guna Memperkuat Digitalisasi ...,https://kemendikdasmen.go.id/berita/14433-ruang-kolaborasi-ptp-guna-memperkuat-digitalisasi-pembelajaran-menuju-indonesia-emas-2045,"Jakarta, 18 Desember 2025 – Melengkapi keseruan acara Pengembang Teknologi Pembelajaran (PTP) Connect 2025, Kementerian Pendidikan Dasar dan Menengah ...",5,,
Telkom Jadi Penggerak Utama BUMN Digital Lewat ...,https://www.telkom.co.id/sites/berita/id_ID/article/telkom-jadi-penggerak-utama-bumn-digital-lewat-ekosistem-teknologi-terintegrasi-125,"Sebagai BUMN digital, Telkom tidak hanya membangun jaringan internet, tetapi juga menghadirkan ekosistem teknologi ... Bagikan Berita di:.",6,,
Berita Teknologi Informasi dan Komunikasi Hari Ini,https://www.liputan6.com/tag/teknologi-informasi-dan-komunikasi,Teknologi Informasi dan Komunikasi. Orang yang membatasi waktunya di media sosial cenderung lebih bahagia dibandingkan mereka yang selalu membuka media sosial.,7,,
Berita Tentang Teknologi Digital Terkini Dan Terlengkap,https://www.cnbcindonesia.com/tag/teknologi-digital,"CNBC Indonesia menyajikan berita terkini, riset, dan analisis mendalam seputar Berita Tentang Teknologi Digital Terkini Dan Terlengkap - CNBC Indonesia.",8,,
Ilmu komputer dan teknologi | Berita MIT | Institut ...,https://translate.google.com/translate?u=https://news.mit.edu/topic/computers&hl=id&sl=en&tl=id&client=srp,"Pendekatan AI generatif baru untuk memprediksi reaksi kimia. Sistem yang dikembangkan di MIT dapat memberikan prediksi realistis untuk berbagai macam reaksi, ...Computer science and technology. Download RSS feed: News Articles / In the Media / Audio. Displaying 1 - 15 of 2033 news articles related to this topic. Show:.",9,,
"Berita, artikel, dan fitur teknologi | Ilmuwan Baru",https://translate.google.com/translate?u=https://www.newscientist.com/subject/technology/&hl=id&sl=en&tl=id&client=srp,"Dari peralatan batu paling awal hingga kemajuan terbaru dalam kecerdasan buatan, robotika, blockchain, dan realitas virtual, teknologi telah terus mengubah ...New Scientist. Science news and long reads from expert journalists, covering developments in science. Technology. From the earliest stone tools to the ...",10,,
Berita dan Informasi Teknologi Terkini dan Terbaru Hari ini,https://www.detik.com/tag/teknologi,Kumpulan berita harian Teknologi terbaru dan terlengkap hanya di detik.com.,1,,
"Berita Teknologi, Riset & Inovasi",https://translate.google.com/translate?u=https://scitechdaily.com/news/technology/&hl=id&sl=en&tl=id&client=srp,"Temukan berita teknologi terkini dan artikel penelitian menarik tentang terobosan dalam nanoteknologi, bioteknologi, teknologi hijau, dan banyak lagi.Find the latest technology news and interesting research articles on breakthroughs in nanotechnology, biotechnology, green tech, and more.",2,,
Berita Teknologi,https://www.um-surabaya.ac.id/news/category/teknologi,"Berita Teknologi · Marak Penipuan Pembelian iPhone, Pakar IT UM Surabaya: Begini Cara Membedakannya · Sosok Lukman Hakim, Dosen UM Surabaya yang Dulu jadi ...",3,,
Berita Teknologi - Official Website Teknik Komputer UBT,https://ce.ubt.ac.id/category/berita-teknologi/,"Sejumlah layanan Google antara lain YouTube, Gmail, Google Drive, Google Hangouts, dan Google Meet sempat bermasalah pada Senin (14/12/2020) malam sekitar ...",4,,
"SINDOnews: Berita Teknologi, Gadget, Telekomunikasi ...",https://tekno.sindonews.com/,Laptop Sultan Seharga Mobil: Lenovo Legion 9i Resmi Hadir dengan Layar 3D Tanpa Kacamata dan RAM 192GB! 19 Desember 2025 - 20:31 WIB · Salju Menyelimuti ...,5,,
Sains dan Teknologi | Berita terbaru hari ini dari Al Jazeera,https://translate.google.com/translate?u=https://www.aljazeera.com/tag/science-and-technology/&hl=id&sl=en&tl=id&client=srp,"Sains dan Teknologi · Musk menggugat Apple dan OpenAI atas dugaan penindasan kompetisi AI · Intel mengatakan saham pemerintah AS dapat merusak penjualan, Gedung ...Stay on top of Science and Technology latest developments on the ground with Al Jazeera's fact-based news, exclusive video footage, photos and updated maps.",6,,
PRIMA dan CEO Summit 2025 Bahas Peran ...,https://itb.ac.id/berita/prima-dan-ceo-summit-2025-bahas-peran-teknologi-mendalam-untuk-industri-hijau/63174,"Berita; Utama. PRIMA dan CEO Summit 2025 Bahas Peran Teknologi ... teknologi, dan permintaan pasar. “Saat ini terdapat dua pendekatan ...",7,,
Kumpulan Berita teknologi informasi dan komunikasi,https://www.antaranews.com/tag/teknologi-informasi-dan-komunikasi,"Kumpulan Berita teknologi informasi dan komunikasi dari ANTARA News, portal berita terkini dan terpercaya Indonesia.",8,,
Berita perangkat lunak - Organisasi Teknologi,https://translate.google.com/translate?u=https://www.technology.org/category/technologies/software-hardware/&hl=id&sl=en&tl=id&client=srp,Perangkat lunak berkembang pesat karena perannya yang penting dalam berbagai industri di dunia untuk membantu meningkatkan proses. Baca berita perangkat ...Software is quickly evolving due to its importance in many worldwide industries in order to help improve processes. Read the latest software news here to ...,9,,
Uhamka Luluskan Mahasiswa Unggul di Bidang Teknologi ...,https://www.suaramuhammadiyah.id/read/uhamka-luluskan-mahasiswa-unggul-di-bidang-teknologi-farmasi-ekonomi-dan-psikologi-dalam-wisuda-2025,"Berita · Berita. Uhamka Luluskan Mahasiswa Unggul di Bidang Teknologi, Farmasi, Ekonomi dan Psikologi dalam Wisuda 2025. Publish. 20 December ...",10,,
berita – UPA. Teknologi Informasi dan Komunikasi ...,https://tik.unila.ac.id/tag/berita/,"Pelaksanaan UTBK SIMANILA 2025 Hari Kedua Berjalan Kondusif di UPA TIK Unila Universitas Lampung, 09 Juli 2025 — Pelaksanaan hari kedua Ujian Tulis Berbasis ...",1,,
Poltekkes Kemenkes Tanjungkarang Benchmarking Tata ...,https://sevima.com/poltekkes-kemenkes-tanjungkarang-benchmarking-tata-kelola-teknologi-informasi/,... teknologi informasi. Delegasi Unit TI Poltekkes Kemenkes ... Berita · Poltekkes Kemenkes Tanjungkarang Lakukan Benchmarking ke UIN Raden ...,2,,
Berita Terkini Teknologi - Teknologi Informasi,https://www.cnnindonesia.com/teknologi/teknologi-informasi,"CNNIndonesia.com menyajikan berita teknologi informasi meliputi gadget, gawai, aplikasi, ponsel, start up, hingga tips dan trik terbaru dan terkini.",3,,
"Teknologi masa depan: Berita, fitur, dan artikel",https://translate.google.com/translate?u=https://www.livescience.com/technology&hl=id&sl=en&tl=id&client=srp,"Tiongkok meluncurkan robot pertama di dunia yang dapat berjalan sendiri 24/7 — saksikan robot ini mengganti baterainya sendiri dalam rekaman baru yang ...From incredible new inventions to the technology of the future, get the latest tech news and features from Live Science.",4,,
Technology Indonesia - Indonesian Technology News Portal,https://technologyindonesia.id/,TechnologyIndonesia.id – Pemanfaatan repositori arsip digital yang dikombinasikan dengan teknologi Application Programming Interface (API) dan Artificial ...,5,,
Berita Teknologi Tinggi & Inovasi,https://translate.google.com/translate?u=https://techxplore.com/hi-tech-news/&hl=id&sl=en&tl=id&client=srp,"Berita terbaru seputar teknologi tinggi, inovasi dan penemuan baru, berita dan informasi komputer.The latest news on hi-tech, innovation and new inventions technology, computer news and information.",6,,
Teknologi,https://translate.google.com/translate?u=https://www.theverge.com/tech&hl=id&sl=en&tl=id&client=srp,"Berita teknologi terbaru tentang perangkat keras, aplikasi, dan banyak lagi terbaik (dan terkadang terburuk) di dunia. Dari perusahaan papan atas seperti ...The latest tech news about the world's best (and sometimes worst) hardware, apps, and much more. From top companies like Google and Apple to tiny startups ...",7,,
Berita Terbaru Teknologi Indonesia Dunia Hari Ini,https://mediaindonesia.com/teknologi/941,Berita teknologi terbaru hari ini seperti mengulas gadget game social media dunia internet komputer software dan hardware.,8,,
Berita Teknologi Dan Science Terbaru,https://www.suara.com/tekno,"Berita Teknologi terkini suara.com. Informasi teknologi, games, aplikasi, gadget, dunia digital, internet, komputer, dunia sains, tips dan trik hari ini.",9,,
Berita Teknologi Terbaru,https://translate.google.com/translate?u=https://www.pcmag.com/news&hl=id&sl=en&tl=id&client=srp,"3 MacBook Apple Ini Sudah Usang, Satu iPhone Beralih ke Model Vintage. Empat produk Apple telah diperbarui dalam daftar merek gadget jadul dan usang, yang ...Get the latest technology news and in-depth analysis from the expert analysts at PCMag.",10,,
Berita Teknologi Dan Science Terbaru,https://www.suara.com/tekno,"Berita Teknologi terkini suara.com. Informasi teknologi, games, aplikasi, gadget, dunia digital, internet, komputer, dunia sains, tips dan trik hari ini.",1,,
Berita Terbaru Teknologi Indonesia Dunia Hari Ini,https://mediaindonesia.com/teknologi/941,Berita teknologi terbaru hari ini seperti mengulas gadget game social media dunia internet komputer software dan hardware.,2,,
Techdaily - Berita Teknologi dan Gadget Terbaru,https://techdaily.id/,"Menyajikan berbagai informasi terbaru dan terkini seputar gadget, smartphone, laptop, aplikasi, game, serta informasi berita teknologi lainnya.",3,,
"﻿Asops Kasau Tekankan Iman, Safety, dan Adaptasi ...",https://tni-au.mil.id/berita/detail/asops-kasau-tekankan-iman-safety-dan-adaptasi-teknologi-koharmatau-siap-wujudkan-tni-au-yang-ampuh,"Beranda · Berita Satuan · ﻿Asops Kasau Tekankan Iman, Safety, dan Adaptasi Teknologi: Koharmatau Siap Wujudkan TNI AU yang AMPUH.",4,,
Teknologi digital,https://www.cna.id/topic/teknologi-digital,"Follow the latest news and comprehensive coverage on Teknologi digital at CNA.id: Berita Indonesia, Asia dan Dunia.",5,,
Berita Terbaru Hari Ini - teknologi,https://disway.id/listtag/330/teknologi,"#teknologi · Pakar Sebut Alih Teknologi Harus Jadi Pilar Utama Proyek Pemetaan Nasional · Makin Banyak Perusahaan Pakai Perangkat NAS untuk Sistem CCTV, Ini ...",6,,
Kumpulan Berita Tek,https://www.tek.id/tek,"... Ponsel Lipat Kembali Populer, Ini Perjalanan dan Teknologi di Baliknya. Rabu, 17 Desember 2025 18:50 ...",7,,
Berita Teknologi,https://translate.google.com/translate?u=https://www.usnews.com/news/technology&hl=id&sl=en&tl=id&client=srp,"Berita Teknologi · Menteri Kecerdasan Buatan Albania Tampil Perdana di Parlemen · Nvidia Akan Investasikan $5 Miliar di Saingan Intel yang Sedang Berjuang.US News is a recognized leader in college, grad school, hospital, mutual fund, and car rankings. Track elected officials, research health conditions, ...",8,,
"Berita Teknologi Terbaru - Berita, Foto, Video",https://www.fimela.com/tag/berita-teknologi,"Berita Berita Teknologi - Sebuah studi mengejutkan menemukan bahwa Gen Z memiliki kata sandi yang lebih buruk dibandingkan kakek nenek mereka, ...",9,,
Teknologi | CNN Business,https://translate.google.com/translate?u=https://www.cnn.com/business/tech&hl=id&sl=en&tl=id&client=srp,"Lihat berita utama teknologi terkini, tren gadget dan telepon pintar, serta wawasan dari para pemimpin industri teknologi.... News Network. A Warner Bros. Discovery Company. All Rights Reserved. CNN Sans ™ & © 2016 Cable News Network. Download the CNN app. Scan the QR code to ...",10,,
Teknologi | CNN Business,https://translate.google.com/translate?u=https://www.cnn.com/business/tech&hl=id&sl=en&tl=id&client=srp,"Lihat berita utama teknologi terkini, tren gadget dan telepon pintar, serta wawasan dari para pemimpin industri teknologi.... News Network. A Warner Bros. Discovery Company. All Rights Reserved. CNN Sans ™ & © 2016 Cable News Network. Download the CNN app. Scan the QR code to ...",1,,
"Berita Teknologi, Berita Peluncuran Ponsel dan Gadget",https://translate.google.com/translate?u=https://www.newsbytesapp.com/news/science&hl=id&sl=en&tl=id&client=srp,"Dapatkan berita teknologi terbaru dan terhangat. Berita utama hari ini tentang teknologi, berita perangkat seluler, TV, dan laptop. Berita tentang Apple ...Google has confirmed that its next-generation AI platform, Gemini, will fully replace Google Assistant on Android devices by 2026. 21 Dec 2025.",2,,
"Teknologi - Wikipedia bahasa Indonesia, ensiklopedia bebas",https://id.wikipedia.org/wiki/Teknologi,"↑ ""Technology news"". BBC News. Diarsipkan dari asli tanggal 2006-02-09. Diakses tanggal 2006-02-17. ↑ Stiegler, Bernard (1998). Technics and Time, 1: The ...",3,,
Berita Teknologi | Tren Digital,https://translate.google.com/translate?u=https://www.digitaltrends.com/topic/news/&hl=id&sl=en&tl=id&client=srp,"Berita teknologi terbaru tentang perangkat keras, aplikasi, elektronik, dan banyak lagi. Dengan perusahaan-perusahaan besar seperti Google, Apple, dan Amazon ...Oops! Something went wrong.",4,,
Mendiktisaintek Berikan Anugerah Diktisaintek 2025 ...,https://www.youtube.com/watch?v=MBhyzjvadeI,... berita televisi nasional yang berada di bawah naungan Elang Mahkota Teknologi ... berita #beritabola #beritabolaterbaru #beritaterkini ...,5,,
Kumpulan Artikel Terbaru teknologi,https://www.kompasiana.com/tag/teknologi,Inovasi Teknologi sebagai Wadah Kreativitas dan Perubahan. Humaniora. 19. 0. 0 ... Mengandung berita bohong/hoaks/misinformasi. Promosi aktivitas ilegal ...,6,,
Kisah Madif Tuli Fasya dan Doktor Neyla di Wisuda UB ...,https://prasetya.ub.ac.id/kisah-madif-tuli-fasya-dan-doktor-neyla-di-wisuda-ub-periode-ix/,Prasetya Online - Portal Berita Universitas Brawijaya. ... Mahasiswi Fakultas Teknologi Pertanian UB tersebut juga merupakan ...,7,,
"Aplikasi Pantunesia Resmi Diluncurkan, Perkuat Pelestarian ...",https://kepriprov.go.id/berita/pemprov-kepri/aplikasi-pantunesia-resmi-diluncurkan-perkuat-pelestarian-pantun-melayu-berbasis-teknologi,"Artikel / Berita Pemprov Kepri. Aplikasi Pantunesia Resmi Diluncurkan, Perkuat Pelestarian Pantun Melayu Berbasis Teknologi. Kamis, 18 ...",8,,
