title,link,snippet,position,rating,ratingCount
Berita Teknologi Terkini Dan Terbaru Hari Ini,https://www.okezone.com/tag/teknologi,Okezone.com - Berita Teknologi Terkini Dan Terbaru Hari Ini - Pendidikan tinggi dituntut menjadi motor penggerak kemajuan bangsa di tengah percepatan ...,9,,
Berita Teknologi,https://bbcmedia.news/category/berita-teknologi/,"Berita Teknologi · Internet Canggih, Ancaman Siber Nyata: Kenali Malware dan Spyware · Kembalinya PPSh-41 dan PPS-43: Senjata Legendaris dalam Konflik Rusia- ...",10,,
Berita Teknologi,https://bbcmedia.news/category/berita-teknologi/,"Berita Teknologi · Internet Canggih, Ancaman Siber Nyata: Kenali Malware dan Spyware · Kembalinya PPSh-41 dan PPS-43: Senjata Legendaris dalam Konflik Rusia- ...",1,,
Video: Belajar Sejarah Lebih Efektif dengan VR - 20detik,https://20.detik.com/deutsche-welle-news/20251220-251220060/video-belajar-sejarah-lebih-efektif-dengan-vr,Perkembangan teknologi virtual reality (VR) membuka peluang baru dalam cara manusia mempelajari sejarah ... Kategori Berita. detikNews ...,2,,
"Kabar Berita Teknologi Terkini, Unik dan Menarik",https://www.liputan6.com/tekno/berita,Tekno News Liputan6.com menyajikan kabar berita perkembangan dunia teknologi terkini dari berbagai penjuru dunia yang unik dan menarik.,3,,
"Perkuat Layanan Air Bersih, Pemko Banda Aceh Jajaki Kerja ...",https://prokopim.bandaacehkota.go.id/berita/42355/perkuat-layanan-air-bersih-pemko-banda-aceh-jajaki-kerja-sama-teknologi-dengan-pt-panah-perak-megasarana.html,"Home Berita. asdf. Perkuat Layanan Air Bersih, Pemko Banda Aceh Jajaki Kerja Sama Teknologi dengan PT Panah Perak Megasarana. admin-prokopim; 18 ...",4,,
Berita Teknologi Internet Terbaru dan Terpopuler Hari ini,https://m.jpnn.com/teknologi/internet,"BERITA UTAMA · Komdigi Salurkan Bantuan Internet Gratis ke 6 Sekolah di Sumut, Berlaku Satu Tahun · Hypernet Technologies Gandeng Fortinet Perkuat Pertahanan ...",5,,
Telkomsel Raih Penghargaan Inovasi AI Di Thailand,https://www.gadgetdiva.id/news/telkomsel-raih-penghargaan-inovasi-ai,"... teknologi, tetapi juga memberikan dampak nyata bagi ... Cek berita teknologi, review gadget dan video Gadgetdiva.id di Google News.",6,,
Teknologi - The New York Times International,https://translate.google.com/translate?u=https://www.nytimes.com/international/section/technology&hl=id&sl=en&tl=id&client=srp,"Berita, komentar, dan analisis industri teknologi, dengan laporan tentang teknologi besar, perusahaan rintisan, dan budaya internet.Technology industry news, commentary and analysis, with reporting on big tech, startups, and internet culture.",7,,
"PWRI Garut Gelar Muscab ke-VIII, Tekankan Peran ...",https://www.garutkab.go.id/berita/pwri-garut-gelar-muscab-ke-viii-tekankan-peran-pensiunan-sebagai-aset-pembangunan-daerah,... Teknologi (21) Pajak (4) Perkebunan (18) Peternakan (23) Industri ... Berita SKPD. Semua Informasi (18) Ekonomi (56) Kegiatan (126) ...,8,,
Mahasiswa Teknologi Pangan Fp Usu Jadi Bagian Tim ...,https://fp.usu.ac.id/id/berita/mahasiswa-teknologi-pangan-fp-usu-jadi-bagian-tim-indonesia-raih-winner-of-performance-di-icf-2025,> Berita > Mahasiswa Teknologi Pangan FP USU Jadi Bagian Tim Indonesia Raih Winner of Performance di ICF 2025. Mahasiswa Teknologi Pangan FP ...,9,,
Berita dan Video Saintek Teknologi Terkini Hari Ini,https://www.kompas.tv/saintek/teknologi,"Berita saintek teknologi terkini hari ini, menyajikan informasi seputar ilmu pengetahuan dan teknologi terbaru.",10,,
Berita Terkini Harian Teknologi Terbaru Hari Ini,https://www.kompas.com/tag/teknologi,Hyundai Motor Group dan Michelin Berkolaborasi Percepat Pengembangan Teknologi Ban Terbaru untuk Mobilitas Masa Depan. Advertorial. 19 Desember 2025.,1,,
Teknologi,https://www.merdeka.com/teknologi,"merdeka, com, Berita, Politik, Ekonomi, Hukum, Kriminal, Olahraga, Sepak, Bola, Teknologi, Otomotif, Artis, di, Indonesia, dan, Dunia.",2,,
"detikcom Dilansir dari Free Press Journal, badai ekstrem ...",https://www.instagram.com/p/DSUHossAtM4/,... berita menarik lainnya hanya di detik.com! Creator: Angel #detikcom ... teknologi hingga pelosok negeri. Ajang ini diharapkan bisa ...,3,,
Berita dan Informasi Teknologi Terkini dan Terbaru Hari ini,https://www.bisnis.com/topic/437/teknologi,"Telkomsel Deteksi 1,4 Miliar Percobaan Penipuan Digital (SCAM). 16 Des 2025 | 19:09 WIB · 20 Link Twibbon Natal dan Tahun Baru 2026 Gratis!",4,,
Berita Teknologi Informasi Terkini dan Terbaru Hari Ini,https://www.sindonews.com/topic/1036/teknologi-informasi,"Berita harian Teknologi Informasi terkini, terlengkap, hari ini - Berapa Gaji Data Analyst di Luar Negeri? Cek Rinciannya di 6 Negara Ini.",5,,
Situs Portal Berita Teknologi Informasi: Teknologi.info,https://teknologi.info/,Teknologi.info adalah sebuah situs portal berita yang khusus membahas dunia Teknologi-Informasi dari beragam topik terkait. Press release hadir setiap hari!,6,,
Berita Terbaru Teknologi Indonesia Dunia Hari Ini,https://mediaindonesia.com/teknologi,Berita teknologi terbaru hari ini seperti mengulas gadget game social media dunia internet komputer software dan hardware.,7,,
Kumpulan Berita teknologi digital,https://www.antaranews.com/tag/teknologi-digital,Kami mempunyai 7.816 berita tentang teknologi digital. Kolaborasi swasta dan Kementerian UMKM dorong ekraf Kudus · Kolaborasi swasta dan Kementerian UMKM dorong ...,8,,
Hujan Deras Menyebabkan Banjir Bandang di Kawasan ...,https://www.youtube.com/watch?v=FqMX4TdcY1g,... berita televisi nasional yang berada di bawah naungan Elang Mahkota Teknologi (Emtek) Group. Liputan 6 SCTV juga menyajikan informasi dalam ...,9,,
PRIMA x CEO Summit ITB 2025 Dorong Inovasi Industri ...,https://itb.ac.id/berita/prima-x-ceo-summit-itb-2025-dorong-inovasi-industri-hayati-dan-teknologi-ketahanan/63175,"... Berita; Utama. PRIMA x CEO Summit ITB 2025 Dorong Inovasi Industri Hayati dan Teknologi Ketahanan. Rabu, 17 - Desember - 2025, 13:45:15 - ( update : 17- ...",10,,
"Video: Imbas Tarif Trump, Perusahaan Teknologi AS Menuju ...",https://20.detik.com/detikupdate/20251216-251216052/video-imbas-tarif-trump-perusahaan-teknologi-as-menuju-kebangkrutan,"Kategori Berita. detikNews · detikFinance · detikInet · detikHot · detikSport ... Video: Imbas Tarif Trump, Perusahaan Teknologi AS Menuju ...",1,,
Kumpulan Berita Teknologi Terbaru Dan Terkini,https://www.suara.com/tag/teknologi,Kumpulan Berita Teknologi Terbaru Dan Terkini · 7 Tren Fintech yang Diprediksi Mengubah Cara Masyarakat Bertransaksi pada 2026 · 5 Cara AI Finansial untuk ...,2,,
Berita Teknologi Informasi Terbaru,https://www.tempo.co/tag/teknologi-informasi,"Berita Teknologi Informasi Terbaru · Mau Tidak Mau, Kita Harus Mengikuti AI · Transformasi Teknologi Korporasi · Pakistan Targetkan Perluasan Sektor Ekonomi dan ...",3,,
"Transformasi Digital RI Melesat, Telkom Jadi Motor ...",https://www.telkom.co.id/sites/berita/id_ID/article/transformasi-digital-ri-melesat-telkom-jadi-motor-ekosistem-129,Transformasi digital Indonesia tidak hanya soal teknologi informasi dan teknologi komunikasi di balik layar. ... Bagikan Berita di:.,4,,
Perkuat SDM Unggul Menuju Indonesia Emas 2045 ...,https://www.ekon.go.id/publikasi/detail/6743/perkuat-sdm-unggul-menuju-indonesia-emas-2045-kemenko-perekonomian-ajak-generasi-muda-manfaatkan-peluang-ekonomi-dan-teknologi,"Publikasi Berita Perkuat SDM Unggul Menuju Indonesia Emas 2045, Kemenko Perekonomian Ajak Generasi Muda Manfaatkan Peluang Ekonomi dan Teknologi.",5,,
Kategori: Berita Utama | Portal Merauke,https://portal.merauke.go.id/berita/kategori/berita-utama,berita · Sains dan Teknologi. 202 berita · Otomotif. 22 berita · Potensi. 4 berita ... berita · Info Covid 19. 15 berita · Statistik. 12 berita · Pojok Merauke.,6,,
Webinar Pengelolaan Daerah Aliran Sungai 2025,https://lldikti5.kemdikbud.go.id/home/detailpost/webinar-pengelolaan-daerah-aliran-sungai-2025,"Webinar Pengelolaan Daerah Aliran Sungai 2025. Berita PT Sabtu,20 Desember 2025. Institut Teknologi Yogyakarta | 33 kali. Senin 8 Desember 2025, ...",7,,
Pemandangan memilukan terjadi di Pemandian Air Panas ...,https://www.tiktok.com/@inilahcom/video/7585923024046656788,Baca berita di inilah.com https://www ... Inovasi Teknologi untuk Ekosistem: Zero Waste Mining: Laporan UI mencatat penggunaan teknologi ...,8,,
Berita Teknologi Pekan Ini: LG Luncurkan TV RGB LED ...,https://bisnisupdate.com/tekno/berita-teknologi-pekan-ini-lg-luncurkan-tv-rgb-led-dan-google-hadirkan-find-hub-untuk-wear-os/337643/,"Berita Teknologi Pekan Ini: LG Luncurkan TV RGB LED, dan Google Hadirkan Find Hub untuk Wear OS. 20 Desember 2025 oleh Dina Sari. Batalkan segala rencana ...",9,,
Berita dan informasi seputar tekno,https://teknologi.id/category/tekno,Berita Menarik. Lihat Selanjutnya. teknologi id logo full white. Media dan Platform berita teknologi Indonesia dan dunia terbaru hari ini. Tips dan berita ...,10,,
Perkuat SDM Unggul Menuju Indonesia Emas 2045 ...,https://www.ekon.go.id/publikasi/detail/6743/perkuat-sdm-unggul-menuju-indonesia-emas-2045-kemenko-perekonomian-ajak-generasi-muda-manfaatkan-peluang-ekonomi-dan-teknologi,"Publikasi Berita Perkuat SDM Unggul Menuju Indonesia Emas 2045, Kemenko Perekonomian Ajak Generasi Muda Manfaatkan Peluang Ekonomi dan Teknologi.",1,,
Berita Teknologi Informasi Terbaru,https://www.tempo.co/tag/teknologi-informasi,Baca berita terbaru tentang teknologi-informasi di sini. Informasi terkini seputar teknologi-informasi yang akurat dan terpercaya.,2,,
Kategori: Berita Utama | Portal Merauke,https://portal.merauke.go.id/berita/kategori/berita-utama,berita · Sains dan Teknologi. 202 berita · Otomotif. 22 berita · Potensi. 4 berita ... berita · Info Covid 19. 15 berita · Statistik. 12 berita · Pojok Merauke.,3,,
"Berita Terkini Tech, Startup, Bitcoin",https://www.cnbcindonesia.com/tech,"CNBC Indonesia menyajikan berita terkini dan analisis mendalam seputar startup, tech, teknologi finansial, peer to peer lending, dan bitcoin.",4,,
Berita Teknologi Pekan Ini: LG Luncurkan TV RGB LED ...,https://bisnisupdate.com/tekno/berita-teknologi-pekan-ini-lg-luncurkan-tv-rgb-led-dan-google-hadirkan-find-hub-untuk-wear-os/337643/,"Berita Teknologi Pekan Ini: LG Luncurkan TV RGB LED, dan Google Hadirkan Find Hub untuk Wear OS. 20 Desember 2025 oleh Dina Sari. Batalkan segala rencana ...",5,,
Berita dan informasi seputar tekno,https://teknologi.id/category/tekno,Berita Menarik. Lihat Selanjutnya. teknologi id logo full white. Media dan Platform berita teknologi Indonesia dan dunia terbaru hari ini. Tips dan berita ...,6,,
Video: Belajar Sejarah Lebih Efektif dengan VR - 20detik,https://20.detik.com/deutsche-welle-news/20251220-251220060/video-belajar-sejarah-lebih-efektif-dengan-vr,Perkembangan teknologi virtual reality (VR) membuka peluang baru dalam cara manusia mempelajari sejarah ... Kategori Berita. detikNews ...,7,,
Informasi terbaru seputar teknologi,https://www.suaramerdeka.com/teknologi,"Pesantren Digital di Demak, XLSMART Bekali Santri dengan Literasi dan Teknologi AI. Senin, 15 Desember 2025 | 11:21 WIB. Berita Terkini ...",8,,
"SEA Games Thailand 2025 Selesai, Ini Perolehan Medali ...",https://video.kompas.com/watch/1898013/sea-games-thailand-2025-selesai-ini-perolehan-medali-indonesia,"SEA Games Thailand 2025 Selesai, Ini Perolehan Medali Indonesia! News. 13 jam lalu. Fathir Rochman ...",9,,
Berita Seputar Teknologi dan Informasi Terkini - 1 - detikInet,https://inet.detik.com/news,"Most Popular · 1 Viral Influencer Diduga Anak Jack Ma Disuapi di Kafe, Ini Faktanya · 2 Hands-on Samsung Galaxy Z TriFold: Sensasi HP Lipat Tiga Rasa Tablet · 3 ...",10,,
Polinela Perkuat Pendidikan Vokasi Perikanan lewat Prodi ...,https://sevima.com/polinela-perkuat-pendidikan-vokasi-perikanan-lewat-prodi-teknologi-cerdas-penangkapan-ikan/,... Teknologi Cerdas Penangkapan Ikan Program Sarjana Terapan pada Jurusan Perikanan dan Kelautan. ... Berita · ITK Kembali Raih Predikat Badan ...,1,,
Teknologi - Tribunners,https://www.tribunnews.com/tribunners/teknologi,"Tribun Teknologi - Tribunners menyajikan berita dan video terkini seputar Teknologi - Tribunners regional, nasional dan internasional dengan sudut pandang ...",2,,
Berita Teknologi Terbaru dan Terkini Hari ini,https://www.medcom.id/tag/370/teknologi,"Teknologi · Review Poco M7, HP Baterai 7000 mAh Cocok Buat Nonton Video Berjam-jam · Dreame Resmi Buka Store di Trans Studio Mall Cibubur · Pilihan Smartphone ...",3,,
Berita Daerah || Wabup Garut Ajak PC PMII Menjadi Agen ...,https://www.garutkab.go.id/berita/wabup-garut-ajak-pc-pmii-menjadi-agen-penggerak-pembangunan-daerah,... Teknologi (21) Pajak (4) Perkebunan (18) Peternakan (23) Industri ... Berita SKPD. Semua Informasi (18) Ekonomi (56) Kegiatan (126) ...,4,,
[FULL] Pidato Presiden Prabowo di Akad Massal Rumah ...,https://www.youtube.com/watch?v=UECLBw5rDKI,... berita televisi nasional yang berada di bawah naungan Elang Mahkota Teknologi (Emtek) Group. Liputan 6 SCTV juga menyajikan informasi dalam ...,5,,
Berita Teknologi Hari Ini - Kabar Terbaru Terkini,https://www.liputan6.com/tag/teknologi,"Teknologi · iQOO 15 Siap Debut di Indonesia 2 Desember 2025, Chipset Snapdragon 8 Elite Gen 5 · Narwal, brand robot vacuum premium resmi melakukan ekspansi ke ...",6,,
Informasi Berita Teknologi Gadget Terbaru Hari Ini,https://www.suara.com/tekno/tekno-category/gadget,"Berita Teknologi Gadget terkini suara.com. Informasi gadget, spesifikasi, hp android, tablet, laptop, merk samsung,apple,asus,xiaomi,lenovo terbaru hari ...",7,,
Talenta AI Jadi Kunci Indonesia Masuk Industri Chip Dunia,https://portal.komdigi.go.id/kanal-publik/berita-kini/9877,"Wakil Menteri Komunikasi dan Digital Nezar Patria menegaskan Indonesia tidak boleh hanya menjadi pasar teknologi, tetapi harus masuk ke rantai ...",8,,
Mahasiswa UMSURA Bantu Petani Desa Supiturang ...,https://www.um-surabaya.ac.id/news/mahasiswa-umsura-bantu-petani-desa-supiturang-pascabencana-semeru-lewat-dryer-reborn-dan-lampu-surya,Gambar Berita Mahasiswa UMSURA Bantu Petani Desa Supiturang Pascabencana Semeru Lewat Dryer Reborn dan Lampu Surya. 20 Des; 2025. Penyerahan teknologi tepat ...,9,,
Berita Teknologi Digital Terkini dan Terbaru Hari Ini,https://www.sindonews.com/topic/36742/teknologi-digital,"Berita harian Teknologi Digital terkini, terlengkap, hari ini - Neuropolitika, Kapitalisme Emosional dan Pilihan Politik. Perkuat Inklusi Keuangan Syariah, ...",10,,
"Kompetisi Inovasi Drone Nasional, UMY Sabet ...",https://www.suaramuhammadiyah.id/read/kompetisi-inovasi-drone-nasional-umy-sabet-penghargaan-the-best-potential-team,"Berita · Berita. Kompetisi Inovasi Drone Nasional, UMY Sabet ... teknologi pengiriman barang (dropping cargo) berbasis kecerdasan ...",1,,
"Tekankan Etika Pendidikan, Beyond AI Outlook 2026 ...",https://news.bsi.ac.id/event/tekankan-etika-pendidikan-beyond-ai-outlook-2026-disambut-antusias-peserta/,... teknologi melalui kegiatan Beyond AI Outlook 2026. Acara ini ... Berita · Prodi Sistem Informasi UBSI Kampus Yogyakarta Siap Gebrak Awal ...,2,,
[FULL] Pidato Presiden Prabowo di Akad Massal Rumah ...,https://www.youtube.com/watch?v=UECLBw5rDKI,... berita televisi nasional yang berada di bawah naungan Elang Mahkota Teknologi (Emtek) Group. Liputan 6 SCTV juga menyajikan informasi dalam ...,3,,
Berita Teknologi Hari Ini - Kabar Terbaru Terkini,https://www.liputan6.com/tag/teknologi,"Teknologi · iQOO 15 Siap Debut di Indonesia 2 Desember 2025, Chipset Snapdragon 8 Elite Gen 5 · Narwal, brand robot vacuum premium resmi melakukan ekspansi ke ...",4,,
Berita Teknologi Digital Terkini dan Terbaru Hari Ini,https://www.sindonews.com/topic/36742/teknologi-digital,"Berita harian Teknologi Digital terkini, terlengkap, hari ini - Neuropolitika, Kapitalisme Emosional dan Pilihan Politik. Perkuat Inklusi Keuangan Syariah, ...",5,,
Talenta AI Jadi Kunci Indonesia Masuk Industri Chip Dunia,https://portal.komdigi.go.id/kanal-publik/berita-kini/9877,"Wakil Menteri Komunikasi dan Digital Nezar Patria menegaskan Indonesia tidak boleh hanya menjadi pasar teknologi, tetapi harus masuk ke rantai ...",6,,
Seorang nenek ditolak saat hendak membayar secara ...,https://www.instagram.com/reel/DSeraeHETL3/,... teknologi digital. VT. arlius_zebua #infojabodetabek ... [Baca berita dan informasi menarik lainnya hanya di www.indozone.id]. more.,7,,
Daerah objek wisata air panas Guci di Tegal diterjang ...,https://www.tiktok.com/@detikcom/video/7585985318566776071,"banjir di jawa belum 2 hari aja langsung masuk berita yg ada centang biru nya, lekas bgt updeat ny ... Dalam dokumen visual terbaru ini, sejumlah ...",8,,
Berita Teknologi Informasi Terbaru dan Terkini Hari ini,https://www.medcom.id/tag/16290/teknologi-informasi,Teknologi Informasi · Survei: 90% Tim IT di Indonesia Hadapi Keterbatasan Anggaran · Cara Teknologi Informasi Mengubah Wajah Demokrasi · Unggul di Dimensi Data ...,9,,
Kumpulan Berita teknologi digital,https://www.antaranews.com/tag/teknologi-digital,Kami mempunyai 7.816 berita tentang teknologi digital. Kolaborasi swasta dan Kementerian UMKM dorong ekraf Kudus · Kolaborasi swasta dan Kementerian UMKM dorong ...,10,,
[FULL] Pidato Presiden Prabowo di Akad Massal Rumah ...,https://www.youtube.com/watch?v=UECLBw5rDKI,... berita televisi nasional yang berada di bawah naungan Elang Mahkota Teknologi (Emtek) Group. Liputan 6 SCTV juga menyajikan informasi dalam ...,1,,
PSSI Copot Indra Sjafri Dari Pelatih U-22 - Video,https://www.bloombergtechnoz.com/detail-video/1630/pssi-copot-indra-sjafri-dari-pelatih-u-22,Daftar Perusahaan Teknologi PHK Karyawan di Bulan Desember 2025 ... Hak Cipta © 2023 - Properti Berita Mediatama Indonesia.,2,,
Informasi Berita Terknologi Terbaru dan Terkini - Beritadata.com,https://www.beritadata.com/tech/techno,Kumpulan berita teknologi terkini dan terupdate di beritadata.com.,3,,
ITB Sabet Dua Penghargaan di UI GreenMetric Indonesia ...,https://itb.ac.id/berita/itb-sabet-dua-penghargaan-di-ui-greenmetric-indonesia-awarding-2025/63176,"SEMARANG, itb.ac.id - Institut Teknologi Bandung (ITB) berhasil ... Berita; Utama. ITB Sabet Dua Penghargaan di UI GreenMetric Indonesia ...",4,,
"Antisipasi Ancaman Siber, Kasenkom Lanud H. AS ...",https://tni-au.mil.id/berita/detail/antisipasi-ancaman-siber-kasenkom-lanud-h-as-hanandjoeddin-tekankan-disiplin-penggunaan-akun-dinas,"Berita Tentara Nasional Indonesia. ... Dengan meningkatnya kesadaran dan profesionalisme dalam penggunaan teknologi informasi, diharapkan keamanan ...",5,,
FTI UAJY SAMBUT NATAL DENGAN SHARING SESSION ...,https://lldikti5.kemdikbud.go.id/home/detailpost/fti-uajy-sambut-natal-dengan-sharing-session-bertema-self-healing,"Fakultas Teknologi Industri Universitas Atma Jaya ... Kami menyajikan informasi dan berita seputar kegiatan di LLDIKTI Wilayah V, berita ...",6,,
"VIDEO: Pascabanjir di Aceh Barat, Warga Ramai- ...",https://media.sindonews.com/video/play/115613/6/pascabanjir-di-aceh-barat-warga-ramai-ramai-cari-butiran-emas,"Teknologi · Otomotif · Edukasi · Kalam · Multimedia · Indeks · HI-LITE ... Dapatkan berita terkini dan kejutan menarik dari SINDOnews.com, Klik ...",7,,
"Video: Trump Nyerah, China Siap Borong Chip Amerika",https://www.cnbcindonesia.com/tech/20251216114159-39-694593/video-trump-nyerah-china-siap-borong-chip-amerika,Video: China Tolak Sanksi AS Terkait Teknologi AI 02:43 Video: China ... Home Market My Money News Tech Lifestyle Sharia Entrepreneur ...,8,,
Informasi Seputar Gadget dan Teknologi Terkini - 1 - detikInet,https://inet.detik.com/gadget,Mengulas tentang gaya hidup penggemar gadget dan berita seputar teknologi gadget terbaru. halaman 1.,9,,
Kumpulan Berita Gadget,https://www.tek.id/gadget,"... JBL Indonesia Tampilkan Solusi Teknologi Audio dalam Kampanye The Open Sound Experience. Kamis, 13 ...",10,,
"Antisipasi Ancaman Siber, Kasenkom Lanud H. AS ...",https://tni-au.mil.id/berita/detail/antisipasi-ancaman-siber-kasenkom-lanud-h-as-hanandjoeddin-tekankan-disiplin-penggunaan-akun-dinas,"Berita Tentara Nasional Indonesia. ... Dengan meningkatnya kesadaran dan profesionalisme dalam penggunaan teknologi informasi, diharapkan keamanan ...",1,,
ITB Sabet Dua Penghargaan di UI GreenMetric Indonesia ...,https://itb.ac.id/berita/itb-sabet-dua-penghargaan-di-ui-greenmetric-indonesia-awarding-2025/63176,"SEMARANG, itb.ac.id - Institut Teknologi Bandung (ITB) berhasil ... Berita; Utama. ITB Sabet Dua Penghargaan di UI GreenMetric Indonesia ...",2,,
"Sudah Diterima, Bantuan Asing Dikembalikan | Liputan 6",https://www.youtube.com/watch?v=g9ju-Q6vLNo,... Teknologi (Emtek) Group. Liputan 6 SCTV juga menyajikan informasi ... berita #beritabola #beritabolaterbaru #beritaterkini ...,3,,
"Indeks Berita Teknologi Terbaru, Terkini",https://www.cnnindonesia.com/teknologi/indeks/8,"Indeks CNNIndonesia.com menyajikan berita teknologi meliputi teknologi informasi, Otomotif, sains hingga berita otomotif terbaru dan terkini.",4,,
Berita Teknologi Digital Hari Ini - Kabar Terbaru Terkini,https://www.liputan6.com/tag/teknologi-digital,Teknologi Digital · Menteri Komunikasi dan Digital Meutya Hafid. · Ukraina kini masuk jajaran teratas negara-negara yang sukses melakukan program digitalisasi ...,5,,
Informasi Berita Teknologi Internasional Terkini,https://www.suara.com/tekno/tekno-category/tekno,"Informasi Berita Teknologi Internasional Terkini · 7 HP Murah RAM 8 GB untuk Hadiah Natal Anak, Mulai Rp1 Jutaan · 28 Kode Redeem FC Mobile Terbaru 20 Desember ...",6,,
"Video: Trump Nyerah, China Siap Borong Chip Amerika",https://www.cnbcindonesia.com/tech/20251216114159-39-694593/video-trump-nyerah-china-siap-borong-chip-amerika,Video: China Tolak Sanksi AS Terkait Teknologi AI 02:43 Video: China ... Home Market My Money News Tech Lifestyle Sharia Entrepreneur ...,7,,
Indeks Berita Teknologi Informasi dan Komunikasi - 1 - detikInet,https://inet.detik.com/indeks,"News Index ... Video: Duel Samsung Vs Apple di 10 HP Terlaris Q3 2025, Siapa Juaranya?",8,,
Berita Humaniora & Informasi Pengetahuan Terkini,https://www.kompas.id/kategori/ilmu-pengetahuan-teknologi,Sains & Teknologi·. 18 jam lalu ...,9,,
Refleksi dan Arah Pengembangan Sains dan Teknologi,https://lldikti3.kemdikbud.go.id/undangan-reportoar-2025-refleksi-dan-arah-pengembangan-sains-dan-teknologi/,"... teknologi, kemitraan multipihak, dan peningkatan kapasitas masyarakat. ... Berita Terbaru. Undangan Sosialisasi Pelaksanaan Akreditasi oleh LAM ...",10,,
Kumpulan Berita Future,https://www.tek.id/future,"Future · Telkomsel–AWS Lahirkan 750 Talenta Disabilitas Mahir Cloud dan AI, Dorong Inklusi Digital Indonesia. Senin, 15 Desember 2025 16:12.",1,,
Berita Teknologi Masa Depan Hari Ini - Kabar Terbaru Terkini,https://www.liputan6.com/tag/teknologi-masa-depan,"Berita Teknologi Masa Depan - Samsung Solve for Tomorrow dan Samsung Innovation Campus secara konsisten berinvestasi dalam pembentukan talenta digital, ...",2,,
"Listri di Banda Aceh Pulih, Teriring Seruan Takbir - Video",https://www.bloombergtechnoz.com/detail-video/1634/listri-di-banda-aceh-pulih-teriring-seruan-takbir,Teknologi · Global · Nasional · Finansial · Businessweek · Gaya Hidup · Energi · Sektor Riil ... Hak Cipta © 2023 - Properti Berita Mediatama ...,3,,
"Jembatan Bailey Rampung 100 Persen, Akses Jalan ...",https://www.youtube.com/watch?v=zzgNw73GqwM,... berita televisi nasional yang berada di bawah naungan Elang Mahkota Teknologi (Emtek) Group. Liputan 6 SCTV juga menyajikan informasi dalam ...,4,,
Penembakan di Australia Libatkan Ayah dan Anak Saat ...,https://video.kompas.com/watch/1896757/penembakan-di-australia-libatkan-ayah-dan-anak-saat-perayaan-hanukkah,"Rusia Mode Serius: Pasang Rudal Oreshnik di Gerbang Timur NATO, Sinyal Perang Besar 2026? News ... Megah Bak Kipas China Raksasa, Gedung Shanghai ...",5,,
"PWRI Garut Gelar Muscab ke-VIII, Tekankan Peran ...",https://www.garutkab.go.id/berita/pwri-garut-gelar-muscab-ke-viii-tekankan-peran-pensiunan-sebagai-aset-pembangunan-daerah,... Teknologi (21) Pajak (4) Perkebunan (18) Peternakan (23) Industri ... Berita SKPD. Semua Informasi (18) Ekonomi (56) Kegiatan (126) ...,6,,
Insiden penus*kan massal disertai serangan b*m asap ...,https://www.tiktok.com/@inilahcom/video/7585918835295898901,Baca berita di inilah.com https://www ... Inovasi Teknologi untuk Ekosistem: Zero Waste Mining: Laporan UI mencatat penggunaan teknologi ...,7,,
Informasi Berita Teknologi Internasional Terkini,https://www.suara.com/tekno/tekno-category/tekno,"Berita Teknologi Internasional terkini suara.com. Informasi teknologi senjata, gadget internasional dari amerika,eropa dan negara lain terbaru hari ini.",8,,
"Video: 3 Siklon Kepung Indonesia, Daerah Mana Saja yang ...",https://20.detik.com/detikupdate/20251216-251216055/video-3-siklon-kepung-indonesia-daerah-mana-saja-yang-harus-waspada,"Kategori Berita. detikNews · detikFinance · detikInet · detikHot · detikSport ... Video: Imbas Tarif Trump, Perusahaan Teknologi AS Menuju ...",9,,
Pria Lempar Granat Asap dan Menusuk Warga di MRT ...,https://www.youtube.com/watch?v=J-0qtxeLn5M,/www.youtube.com/@Liputan6Daerah Liputan 6 SCTV adalah program berita televisi nasional yang berada di bawah naungan Elang Mahkota Teknologi ...,10,,
Berita Gadget Terbaru Hari ini,https://tekno.kompas.com/gadget,"Berita Gadget Hari Ini, Kabar Berita Terkini Produk Gadget Terbaru Meliputi Produk Smartphone, Tablet, Laptop, Komputer, Handphone di Indonesia dan Dunia.",1,,
Informasi Berita Teknologi Internasional Terkini,https://www.suara.com/tekno/tekno-category/tekno,"Berita Teknologi Internasional terkini suara.com. Informasi teknologi senjata, gadget internasional dari amerika,eropa dan negara lain terbaru hari ini.",2,,
