No,Keyword,Title,Link,Description,is_legal,is_ilegal
857,situs slot gacor,Pusat Pengetahuan | Sistem Pangan Tangguh,https://translate.google.com/translate?u=https://www.resilientfoodsystems.co/kc&hl=id&sl=en&tl=id&client=srp,"Pusat Pengetahuan Sistem Pangan Tangguh adalah platform untuk pembelajaran dan pertukaran pengetahuan. Jika Anda adalah anggota tim proyek negara atau mitra ...Bergabunglah dengan SLOT123, situs slot gacor online 123 hari ini. Cukup depo 10K via QRIS, Anda sudah bisa bermain slot terpercaya dengan kesempatan ...",0,1
858,situs slot gacor,JudolHoki88 : Agen Link Daftar Slot Maxwin Hari Ini Pasti ...,http://innateimmunity.mit.edu/,JudolHoki88 : Agen Link Daftar Slot Maxwin Hari Ini Pasti Gacor Gampang Jepe. JudolHoki88 memberikan pembaruan link akses secara rutin agar pengguna dapat ...,0,1
859,situs slot gacor,SLOT99BET: Link Situs Slot Gacor Hari ini Online Terbaru ...,https://www.figoitalian.com/menu,SLOT99BET ialah situs slot gacor hari ini terbaru dengan beragam pilihan game link slot online gampang jackpot terpercaya perkalian hingga x1000 maxwin.,0,1
860,situs slot gacor,Fisip Umrah – Fisip Umrah,https://fisip.umrah.ac.id/,Selamat Datang di Fisip Umrah · Acara Terbaru · Alumni Berprestasi · Asosiasi Fakultas Ilmu Sosial dan Ilmu Politik.,0,1
861,situs slot gacor,Aktuelle Informationen - Aufarbeitung Brandenburg,https://aufarbeitung.brandenburg.de/beratung/aktuelles-und-fristen/,"Fristen und Änderungen bei SED-Unrechtsbereinigung, Dopingopferhilfe, Rehabilitierung und Ausgleichsleistungen in Brandenburg.",0,1
862,situs slot gacor,Slot88ku: Link Bandar Slot88 Online Terpercaya & Situs ...,https://eva.istjm.edu.ec/,Slot88ku menurut slot88 merupakan login link bandar slot online terpercaya dan platform situs gacor yang resmi hari ini dengan rtp game slot gampang maxwin ...,0,1
863,situs slot gacor,HOME - Universitas Andalas,https://fkep.unand.ac.id/,SELEKSI NASIONAL BERBASIS PRESTASI · SELEKSI NASIONAL BERBASIS TES - UTBK · SELEKSI MASUK MANDIRI FKEP UNAND · SELEKSI MASUK PERGURUAN TINGGI NEGERI BARAT,0,1
864,situs slot gacor,slot gacor - dharmawanita OKU Selatan,https://dharmawanita.okuselatankab.go.id/struktur-organisasi/,INDOSLOT menjadi salah satu rekomendasi terpercaya situs slot online gacor maxwin hari ini sekaligus sebagai pelopor link slot777 gampang menang malam ini.,0,1
865,situs slot gacor,Link Resmi Slot Gacor Maxwin Terpercaya Slot88 Online Bet ...,https://ditsmp.dikdasmen.go.id/,HOKIJITU merupakan link slot gacor terpercaya hari ini sangat mudah menang dapat maxwin dengan slot88 online minimal bet 200 dengan lisensi resmi platform game ...,0,1
866,situs slot gacor,Bakar77: Link Resmi Slot Gacor Mudah Maxwin Situs ...,https://jmeterenespanol.org/en/,Bakar77 menghadirkan pengalaman bermain slot online yang profesional dengan sistem transparan dan peluang kemenangan tinggi. Setiap permainan dirancang untuk ...,0,1
867,situs slot gacor,BADAK178: Situs Link Slot Gacor Online Thailand Punya Pola ...,https://jtam.ulm.ac.id/,"BADAK178 adalah situs slot online yang berorientasi pada server Thailand untuk menyediakan game slot88 gacor hari ini, rasakan pengalaman main ribuan model ...",0,1
868,situs slot gacor,JudolHoki88 : Agen Link Daftar Slot Maxwin Hari Ini Pasti ...,http://innateimmunity.mit.edu/,JudolHoki88 : Agen Link Daftar Slot Maxwin Hari Ini Pasti Gacor Gampang Jepe. JudolHoki88 memberikan pembaruan link akses secara rutin agar pengguna dapat ...,0,1
869,situs slot gacor,KRATONBET | Link Situs Toto Slot Gacor 4D Server ...,https://www.ezpeleta.com/historia,"Sebagai platform slot gacor 4D Thailand yang sedang populer, KRATONBET menyuguhkan berbagai jenis bonus menarik guna memperkaya pengalaman bermain dan ...",0,1
870,situs slot gacor,SLOT777: Link Situs Slot Gacor Thailand Agen Slot Resmi ...,https://journal.ua.ac.id/,SLOT777 merupakan salah satu daftar link situs slot gacor server thailand berlisensi internasional yang menyediakan bocoran rtp live semua provider slot ...,0,1
871,situs slot gacor,GACOR22: Situs Slot Gacor QRIS Gampang Menang Hari Ini ...,https://miranchitoct.net/mi-ranchito-menu/,GACOR22 adalah situs slot gacor deposit qris terbaru yang disediakan oleh provider slot88 online terpercaya gampang menang dijamin jackpot x500. ayo main di ...,0,1
872,situs slot gacor,E-Jurnal Universitas Buddhi Dharma,https://jurnal.buddhidharma.ac.id/,"Jurnal Bhumantara merupakan wadah akademik yang berfokus pada kajian multidisipliner dalam bidang ilmu komunikasi, sastra, linguistik, dan budaya.",0,1
873,situs slot gacor,SLOT Thailand » Link Gacor Slot Online Terbaru TOTO 4D ...,https://e-journal.upr.ac.id/,"SLOT Thailand menghadirkan link gacor 4D terbaru, login mudah di situs slot 888, dan peluang maxwin 2025. Main cepat, aman, dan menang konsisten!",0,1
874,situs slot gacor,Madrasah Jurnal,https://ejournal.unia.ac.id/,slot gacor gampang menang hari inislot online gacor terbaru 2025slot gacor maxwin tanpa polaslot gacor gampang jp setiap harislot gacor hari ini pasti menang ...,0,1
875,situs slot gacor,Pusat Pengetahuan | Sistem Pangan Tangguh,https://translate.google.com/translate?u=https://www.resilientfoodsystems.co/kc&hl=id&sl=en&tl=id&client=srp,"Pusat Pengetahuan Sistem Pangan Tangguh adalah platform untuk pembelajaran dan pertukaran pengetahuan. Jika Anda adalah anggota tim proyek negara atau mitra ...Bergabunglah dengan SLOT123, situs slot gacor online 123 hari ini. Cukup depo 10K via QRIS, Anda sudah bisa bermain slot terpercaya dengan kesempatan ...",0,1
876,situs slot gacor,SLOT99BET: Link Situs Slot Gacor Hari ini Online Terbaru ...,https://www.figoitalian.com/menu,SLOT99BET ialah situs slot gacor hari ini terbaru dengan beragam pilihan game link slot online gampang jackpot terpercaya perkalian hingga x1000 maxwin.,0,1
877,situs slot gacor,SLOT99BET: Link Situs Slot Gacor Hari ini Online Terbaru ...,https://www.figoitalian.com/menu,SLOT99BET ialah situs slot gacor hari ini terbaru dengan beragam pilihan game link slot online gampang jackpot terpercaya perkalian hingga x1000 maxwin.,0,1
878,situs slot gacor,Balai Monitoring Spektrum Frekuensi Radio Kelas I Semarang,http://balmonsemarang.postel.go.id/,"By using this website you accept our cookies and agree to our privacy policy, including cookie policy. Accept Cookies. Chat Bot Balmon Semarang. Halo! Ada ...",0,1
879,situs slot gacor,OURA88: Slot88 Link Slot Gacor 777 Situs Judi Online ...,http://pustaka.aget.faperta.unand.ac.id/,Oura88 destinasi slot88 menjadi link slot gacor 777 yang merupakan situs judi slot777 aplikasi slot online mudah gampang menang dengan peluang maxwin tinggi ...,0,1
880,situs slot gacor,SLOT777 ❄️ Link Daftar Situs Slot Gacor 777 Online ...,https://jamesmazurdpm.com/salisbury-office/,SLOT777 merupakan salah satu rekomendasi slot gacor 777 online terbaik se Indonesia yang menghadirkan permainan judi slotgacor banjir maxwin ...,0,1
881,situs slot gacor,Fisip Umrah – Fisip Umrah,https://fisip.umrah.ac.id/,Selamat Datang di Fisip Umrah · Acara Terbaru · Alumni Berprestasi · Asosiasi Fakultas Ilmu Sosial dan Ilmu Politik.,0,1
882,situs slot gacor,LSPR Publishing,https://omp.lspr.edu/,Buku panduan pembinaan ini merupakan pelengkap untuk Proyek Penelitian ERIA: Pengembangan Buku Panduan Berbasis Pembinaan untuk Meningkatkan Kualitas Hidup ...,0,1
883,situs slot gacor,Geoportal Data RCoE,https://translate.google.com/translate?u=https://rcoe-geoportal.rcmrd.org/&hl=id&sl=en&tl=id&client=srp,"Pusat Keunggulan Regional (RCoE) untuk Pengelolaan Ekosistem Hutan, Keanekaragaman Hayati dan Bentang Laut, yang dilaksanakan oleh RCMRD & CIFOR.Regional Centre of Excellence (RCoE) for Forests, Biodiversity and Seascape Ecosystems Management, its implemented by RCMRD & CIFOR.",0,1
884,situs slot gacor,Beranda - Dinas Energi dan Sumber Daya Mineral,https://esdm.kaltimprov.go.id/,Website informasi publik Dinas Energi dan Sumber Daya Mineral.,0,1
885,situs slot gacor,Direktorat Teknologi Informasi - Universitas Andalas,https://dti.unand.ac.id/,"Membuat Copyright di Halaman Website Joomla 4. Apr 11, 2025. Copyright di website adalah pernyataan hukum yang menunjukkan bahwa konten di situs tersebut ...",0,1
886,situs slot gacor,"19 New House ideas | home diy, diy home decor, rustic ...",https://www.pinterest.com/ssbicheno/new-house/,Alexistoto | Link Gacor Terpercaya Modal Kecil di Situs Slot Gacor · Pool Room Ideas · Laundry Room Paint Color ; Kosas Collections Kosas Home Myrna Square Bar ...,0,1
887,situs slot gacor,Geoportal Data RCoE,https://translate.google.com/translate?u=https://rcoe-geoportal.rcmrd.org/&hl=id&sl=en&tl=id&client=srp,"Pusat Keunggulan Regional (RCoE) untuk Pengelolaan Ekosistem Hutan, Keanekaragaman Hayati dan Bentang Laut, yang dilaksanakan oleh RCMRD & CIFOR.Regional Centre of Excellence (RCoE) for Forests, Biodiversity and Seascape Ecosystems Management, its implemented by RCMRD & CIFOR.",0,1
888,situs slot gacor,Link Gacor OVO99 Situs Slot777 Online Gacor Pasti Maxwin ...,https://parco.gov.ba/,Link Gacor OVO99 dikenal sebagai situs slot777 gacor yang menyediakan slot gacor yang gampang menang maxwin hari ini dijamin wd gede serta tersedia slot ...,0,1
889,situs slot gacor,UF | EHS – Keselamatan di Tempat Kerja,https://translate.google.com/translate?u=https://www.ehs.ufl.edu/&hl=id&sl=en&tl=id&client=srp,Akses Gator TRACS · Penilaian ADA · Ajukan Izin Mendirikan Bangunan · Sertifikat Cakupan · Pengambilan Limbah Kimia/Radiasi · Persetujuan Drone · Evaluasi Ergonomis ...Public Records · Title IX · Bookstore. Website. A-Z Listing · Text-Only Version · Accessibility · Online/Internet Privacy Statement. © 2025 University of ...,0,1
890,situs slot gacor,CODESRIA – Council for the Development of Social Science ...,https://codesria.org/,The Council for the Development of Social Science Research in Africa (CODESRIA) is pleased to welcome you to the AFRIAK Induction Workshop for the 2025 ...,0,1
891,situs slot gacor,https://drive.cinorp.sp.gov.br/themes.php/264/daft...,https://drive.cinorp.sp.gov.br/themes.php/264/daftar-situs-slot-online-gacor/,Tidak ada informasi mengenai halaman ini.,0,1
892,situs slot gacor,situs gacor,https://saa.uin-antasari.ac.id/2024/12/harmoni-dalam-perayaan-mahasiswa-studi-agama-agama-hadiri-natal-prii-banjarmasin/,Tidak ada informasi mengenai halaman ini.,0,1
893,situs slot gacor,Direktorat Teknologi Informasi - Universitas Andalas,https://dti.unand.ac.id/,"Membuat Copyright di Halaman Website Joomla 4. Apr 11, 2025. Copyright di website adalah pernyataan hukum yang menunjukkan bahwa konten di situs tersebut ...",0,1
894,situs slot gacor,Nordgold • Nordgold,https://translate.google.com/translate?u=https://nordgold.com/&hl=id&sl=en&tl=id&client=srp,"Nordgold adalah produsen emas satu juta ons yang terdiversifikasi secara internasional dengan sekitar 8.000 orang yang mengoperasikan portofolio delapan ...Nordgold is an internationally diversified one million ounce gold producer with about 8000 people operating a portfolio of eight mines (in Russia, ...",0,1
895,situs slot gacor,Informasi tentang penggunaan cookie kami,https://translate.google.com/translate?u=https://blackswan.com/cookie-policy&hl=id&sl=en&tl=id&client=srp,"Kuki penargetan. Kuki ini mencatat kunjungan Anda ke situs web kami, halaman yang telah Anda kunjungi, dan tautan yang Anda ikuti. Kami akan menggunakan ...Our website uses cookies to distinguish you from other users of our website. This helps us to provide you with a good experience when you browse our website.",0,1
896,situs slot gacor,Koleksi Dwarika: Hotel Terbaik di Kathmandu Nepal,https://translate.google.com/translate?u=https://www.dwarikas.com/&hl=id&sl=en&tl=id&client=srp,Koleksi Dwarika berdedikasi untuk menjunjung tinggi pengalaman keramahtamahan dan warisan Nepal yang sesungguhnya. Pelajari lebih lanjut tentang kami di ...Dwarika's Collection is dedicated in upholding the experience of true Nepali hospitality and heritage. Learn more about us here.,0,1
897,situs slot gacor,Shorehill Capital | Home,https://shorehillcapital.com/,Shorehill Capital is a Chicago-based private equity firm focused on partnering with entrepreneur- and family-owned companies in the lower middle market to ...,0,1
898,situs slot gacor,Center for Environmental and Technology Ethics - Prague ...,https://cetep.eu/,Center for Environmental and Technology Ethics - Prague | Centrum pro environmentální a technologickou etiku - Praha.,0,1
899,situs slot gacor,ITOCA (Pusat Pelatihan dan Penjangkauan Informasi untuk ...,https://translate.google.com/translate?u=https://www.itoca.org/&hl=id&sl=en&tl=id&client=srp,"Untuk informasi lebih lanjut tentang panggilan tersebut, silakan kunjungi situs di sini: http://librariescd.itoca.org/. Pelatihan Sintesis Bukti untuk ...ITOCA (Information Training & Outreach Centre for Africa) is a capacity building organisation aimed at enhancing information and communications technology (ICT ...",0,1
900,situs slot gacor,Imagine Museum: Contemporary glass art museum,https://www.imaginemuseum.com/,... up Newsletter. Large Trips Badge. Florida Culture. stpete. accesibility. Large Trips Badge. Florida Culture · stpete. accesibility. Slot Gacor Slot Gacor.,0,1
901,situs slot gacor,Laboratorium Pembelajaran Sains Interdisipliner,https://translate.google.com/translate?u=https://www.udel.edu/academics/colleges/cas/units/centers-and-programs/isll&hl=id&sl=en&tl=id&client=srp,Lewati ke konten situs. University of Delaware. Visit; Apply; Give; Search. Tautan Cepat. MyUD · Peta · Direktori Orang · E-mail · Karier · Perpustakaan ...Oops! Something went wrong.,0,1
902,slot88,SLOT88 RESMI: Situs Demo Slot Gacor Online Agen Judi ...,https://www.visitlexingtonmo.com/,Slot88 Resmi adalah situs demo slot gacor yang menjadi opsi pertama untuk agen judi slot online demo pragmatic gratis penyedia permainan paling seru.,0,1
903,slot88,LINESLOT88 : Situs Slot88 Gacor Indonesia Resmi Rilis ...,https://buiqui.com/universities/,"LINESLOT88 merupakan platform slot88 resmi yang berkembang pesat karena menghadirkan sistem permainan seru, mudah diakses, serta rutin mengadakan event menarik.",0,1
904,slot88,TEXAS88: Link APK Situs Judi Slot Gacor Hari Ini Slot88 ...,https://www.rocknthegrill.com/menu,TEXAS88 adalah situs slot gacor yang menyediakan link apk gampang pecah perkalian sampai x1000 hari ini dipercaya oleh 3 juta member judi slot88 di ...,0,1
905,slot88,SUPER88: Situs Slot88 Resmi Terpercaya Gacor & Gampang ...,https://fangobsgyn.com/,"Dengan ratusan pilihan slot gacor dari berbagai tema populer—mulai dari klasik hingga modern, SUPER88 memberikan pengalaman bermain yang seru dan menguntungkan.",0,1
906,slot88,OVODEWA : Bandar Situs Slot Gacor Online & Link ...,https://sajs.ntt.edu.vn/,OVODEWA adalah Bandar situs slot gacor online yang menawarkan link tergacor terpercaya slot88 resmi dan sudah terbukti paten serta banyak promo menarik 2026 p .,0,1
907,slot88,Slot88ku: Link Bandar Slot88 Online Terpercaya & Situs ...,https://eva.istjm.edu.ec/,Slot88ku menurut slot88 merupakan login link bandar slot online terpercaya dan platform situs gacor yang resmi hari ini dengan rtp game slot gampang maxwin di ...,0,1
908,slot88,Beh Link Situs Slot Online Gacor Slot88 Terpercaya Hari Ini,https://www.westsidefh.com/listings,Beh link situs slot online terpercaya HOKI178 menyediakan game server slot88 dan daftar judi slot gacor hari ini resmi gampang menang jackpot dengan live ...,0,1
909,slot88,Situs Slot Gacor 88 Gampang Menang 888slot Link Alternatif ...,https://www.islandpawsretreat.com/,Situs slot depo 10k praktis slot 88 ga perlu ribet-ribet. QRIS Instant sebagai metode pembayaran terbaru slot depo 10k kilat memberikan kemudahan bagai makan ...,0,1
910,slot88,OLYMPUS88: Link Situs Slot Gacor Online SLOT88 On ...,https://www.riceboxkitchen.com/menu,"OLYMPUS88 menawarkan ratusan permainan situs link slot gacor gampang menang dari provider terbaik Pragmatic Play, PG Soft, Habanero, Slot88 Resmi, hingga Joker ...",0,1
911,slot88,SLOT88: Link Superior Situs Slot Gacor SLOT777 Terpercaya ...,https://www.carmnella.com/il-menu/,Slot88 merupakan game judi slot online bertema fantasi dan petualangan dengan grafis 3D dikenal sebagai slot gacor 5 reel modern dilengkapi fitur free spin ...,0,1
912,slot88,SLOT88 # Situs Resmi Agen Slot88 Gacor Hari Ini Gampang ...,https://ristorantecasanostra.com/dinner-menu/,SLOT88 adalah link resmi situs slot gacor online terpercaya yang telah bekerja sama dengan slot88 terbaik menyediakan koleksi game slot88 online gampang ...,0,1
913,slot88,JAKARTASLOT88: Link Terpanas Situs Slot Gacor Terpercaya ...,https://www.mqw.de/index.php/patienten,Jakartaslot88 divonis sebagai situs slot gacor online terlengkap hari ini gampang menang dan agen slot88 terbaik penyedia domain judi online dengan jp besar.,0,1
914,slot88,MEDUSA88: Link Situs APK Slot Gacor Terbaru & Slot88 ...,https://granddutacity.propertifit.com/,MEDUSA88 adalah platform slot88 terpercaya yang menghadirkan inovasi permainan terbaru dengan winrate tinggi. Disebut situs slot gacor karena kami bekerja sama ...,0,1
915,slot88,SLOT88: Situs Judi Slot Gacor Terbaik Hari Ini Dengan ...,https://www.channelwin.tv/product/harry-t-shirt/,"SLOT88 adalah situs judi slot gacor terbaik dengan RTP slot online tinggi yang mudah maxwin dan dijamin WD. Nikmati ratusan game populer, bonus menarik, serta ...",0,1
916,slot88,SLOT88 # Link Situs Gacor Slot Online 88 Resmi & Mudah ...,https://ojs.lp2m.uinjambi.ac.id/index.php/jatp/article/view/2256/1080,"oleh MM Arief · 2023 · Dirujuk 2 kali — SLOT88 adalah link situs gacor slot online 88 resmi dengan winrate tinggi, mudah maxwin, dan pilihan game terlengkap. Nikmati bonus besar, deposit cepat, ...",0,1
917,slot88,RAJASLOT88 Login Alternatif SLOT88 Link Resmi Game Online,https://razi.edu.ly/en/events/,"Tidak hanya toto, RAJASLOT88 juga menghadirkan berbagai game slot populer dengan tampilan grafis modern, fitur bonus menarik, serta gameplay yang seru. Pemain ...",0,1
918,slot88,SLOT Thailand » Link Gacor Slot Online Terbaru TOTO 4D ...,https://e-journal.upr.ac.id/,"SLOT Thailand menghadirkan link gacor 4D terbaru, login mudah di situs slot 888, dan peluang maxwin 2025. Main cepat, aman, dan menang konsisten!",0,1
919,slot88,SLOT88: Situs Raja Slot Gacor 4D Maxwin Online Link ...,https://bpmpaceh.kemendikdasmen.go.id/bimtekspmelpmpaceh/,SLOT88 adalah situs slot gacor server jepang online resmi terpercaya yang menyediakan link raja maxwin terbaru malam hari ini dijamin gampang menang serta ...,0,1
920,slot88,TOKYO77: Situs Slot Gacor SLOT777 Gampang Menang ...,https://www.starscafeaustin.com/menu,"TOKYO77 situs link slot777 gampang menang pilihan slot gacor viral hari ini, situs pola slot gacor online maxwin SLOT88 terbaru dengan jackpot terbesar.",0,1
921,slot88,Nikeslot88 - Platform Situs Judi Slot Online Gampang ...,https://www.dottemobilegrocer.com/search,Nikeslot88 merupakan situs dewaslot88 gacor membawakan bocoran link slot gampang menang terbaru dengan bonus jackpot maxwin setiap hari.,0,1
922,slot88,JAKARTASLOT88 | Paket Situs Toto Slot Gacor Mudah ...,https://www.chostay.com/ja/,Jakartaslot88 merupakan situs toto slot gacor mudah menang hari ini dengan paket proxy slot88 terlengkap sebagai mitra agen terpercaya judi online paling mantap,0,1
923,slot88,SUPRASLOT: Situs Judi Slot Online Daftar Gacor Hari Ini ...,https://old.comune.solarino.sr.it/imu/,SUPRASLOT merupakan situs game judi slot online yang menyediakan slot88 terbaru. Banyak pilihan game slot gacor yang ditawarkan HOKIRAJA untuk para member ...,0,1
924,slot88,ZONA66 : Situs Slot88 Gacor Indonesia Resmi Mudah ...,https://en.sdec-france.com/,"ZONA66 adalah platform Situs Slot88 resmi yang dikenal stabil, cepat, dan menyediakan banyak pilihan game slot gacor mudah maxwin hari ini.",0,1
925,slot88,SLOT88: Situs Slot Gacor 88 Terpercaya & Link Agen Judi ...,https://tmpizza.com/pizza,838WIN merupakan situs judi slot gacor 88 terpercaya gampang menang yang dikenal sebagai agen slot online terbaik dengan fitur jackpot dari link SLOT88 ...,0,1
926,slot88,SLOT88JP Login Situs Edisi Terbaru Slot88 JP dengan RTP ...,https://www.bradysnoodle.com/blank-4,"SLOT88JP sudah hadir sebagai situs edisi terbaru dan menjadi destinasi favorit berkat tingkat kemenangan yang stabil, aman dan menyenangkan.",0,1
927,slot88,SLOT88 : Link Situs Slot Gacor Hari Ini Gampang Menang ...,https://tribratanews.sulteng.polri.go.id/category/polres/polresmorowali/,SLOT88 adalah situs slot gacor hari ini di Indonesia karena setiap harinya membagikan scatter hitam kepada member baru gampang menang dengan deposit 10rb ...,0,1
928,slot88,JANJISLOT: SLOT777 Situs Slot Online Gacor Hari Ini ...,https://theironturbine.com/menu/,JANJISLOT adalah link situs slot online gacor gampang menang hari ini menyediakan bocoran slot online terbaru dari provider SLOT777 dan ...,0,1
929,slot88,RJSLOT88 - Situs Judi Raja Slot Gacor Online Hoki Slot88 ...,https://cpco.co/ceramicschinese,RJSLOT88 adalah situs judi raja slot gacor online terbaik yang menawarkan pengalaman terpercaya dari hoki slot88 gampang pecah tak terbatas sehingga tidak ...,0,1
930,slot88,SLOT99BET: Link Situs Slot Gacor Hari ini Online Terbaru ...,https://www.figoitalian.com/menu,SLOT99BET ialah situs slot gacor hari ini terbaru dengan beragam pilihan game link slot online gampang jackpot terpercaya perkalian hingga x1000 maxwin.,0,1
931,slot88,Agen Link Slot Gacor Hari Ini Terlengkap Situs Slot88 ...,https://www.restauranteloslaureles.com.mx/restaurante.html,"SLOT 88 merupakan link slot gacor hari ini terbukti gampang menang secara lengkap menyediakan daftar situs slot88, slot online dan toto slot dengan keunikan ...",0,1
932,slot88,SLOT88: Link Situs Toto Slot Gacor Depobos Dan ...,https://journal.institutpendidikan.ac.id/index.php/mosharafa/article/view/266/230,SLOT88 Link Situs Toto Slot Gacor Depobos dan Danatoto Populer Resmi Terbaru Kolaborasi Slot777 Viral Malam Ini Bang menjadi salah satu kombinasi kata kunci ...,0,1
933,slot88,KATANAPLAY88 Link Toto Slot 4D & Slot88 Gacor Depo 10K ...,https://sapubarbar.biroumum.jatengprov.go.id/,"KATANAPLAY88 merupakan gabungan sempurna antara toto slot 4d dengan slot88 gacor server luar yang super panas malam ini! Cukup depo 10K, langsung bisa ...",0,1
934,slot88,MULTIBET88: Viral Situs Slot Gacor Hari Ini Link Slot88 ...,https://www.sociolegalreview.com/home,Multibet88 adalah situs slot gacor hari ini viral yang memberikan akses link Slot88 online gampang menang terpercaya dengan RTP tertinggi dan peluang ...,0,1
935,slot88,SLOT88: Situs Slot Paling Gacor 88 New & Login Toto ...,https://pressto.amu.edu.pl/index.php/rpeis/article/download/9188/8931/17826,Slot88 adalah situs slot paling gacor 88 terbaru 2025 yang dikenal sebagai agen resmi toto slot 4D dengan RTP tertinggi.,0,1
936,slot88,Daftar Situs Baru Paling Gacor Server Thailand & Jamin Pasti Jp,https://mochidonuts-eg.com/en/service/30,SLOT88 hadir! Daftar Situs Baru Paling Gacor dengan performa Server Thailand yang unggul. Kami Jamin Pasti JP untuk setiap pemain.,0,1
937,slot88,AYAMJP # Agen Resmi Situs Slot Gacor Online Link Slot88 ...,https://www.masterplandesa.com/masukan/,"AYAMJP merupakan situs Slot88 online resmi dan terpercaya yang fokus pada permainan Slot Gacor dengan berbagai provider slot. Dengan sistem keamanan modern, ...",0,1
938,slot88,SLOT88 : Resmi Situs Gacor Eksklusif Event Natal Mudah ...,https://opf.org.pk/membership/,Slot88 resmi merupakan situs gacor resmi yang menghadirkan event slot natal eksklusif dengan peluang menang lebih besar hari ini.,0,1
939,slot88,SLOTO89: Kunci Slot Gacor Online Hari Ini - Little Trouble,https://www.littletroublelockhart.com/about-1,SLOTO89 adalah situs yang dijuluki kunci slot gacor online link alternatif terpercaya dan aman. Temukan bocoran rahasia di balik slot RTP dan layanan CS ...,0,1
940,slot88,Slot Gacor ! Link Slot88 Situs Toto Slot 4D Server Thailand ...,https://www.pagepressjournals.org/index.php/bam/article/download/6164/5880,oleh F Resquín · 2016 · Dirujuk 46 kali — Slot Gacor menghadirkan link Slot88 situs toto slot 4D Server Thailand dan Slot777 online terpercaya dengan berbagai game populer dengan rtp tertinggi ...,0,1
941,slot88,SLOT88: Situs Maxwin Slot Gacor Online Hari Ini Link ...,https://shrekthemusicaltour.com/tour/,SLOT88 adalah situs maxwin slot gacor online hari ini yang menyediakan link slot777 gampang menang dan APK slot resmi dipercaya mudah meledak mega jackpot.,0,1
942,slot88,Slot Gacor ! Link Slot88 Situs Toto Slot 4D Server Thailand ...,https://www.pagepressjournals.org/index.php/bam/article/download/6164/5880,oleh F Resquín · 2016 · Dirujuk 46 kali — Slot Gacor menghadirkan link Slot88 situs toto slot 4D Server Thailand dan Slot777 online terpercaya dengan berbagai game populer dengan rtp tertinggi ...,0,1
943,slot88,SLOT88: Situs Maxwin Slot Gacor Online Hari Ini Link ...,https://shrekthemusicaltour.com/tour/,SLOT88 adalah situs maxwin slot gacor online hari ini yang menyediakan link slot777 gampang menang dan APK slot resmi dipercaya mudah meledak mega jackpot.,0,1
944,slot88,SLOTLIONS88 : Link Situs Resmi Slot88 Hari Ini Izin ...,https://www.pleasantvalleykidsclub.com/contact,Slot lions88 situs unggulan dengan link gacor saat ini dan sudah berlisensi resmi SLOT88. Memiliki ratusan permainan judi online dengan persentase menang ...,0,1
945,slot88,JAWARA79: Daftar Situs Slot Gacor Link slot88 Gampang ...,https://www.midwestbreakfastco.com/menu/,JAWARA79 merupakan situs slot gacor terpercaya di tahun 2025 dan juga penyedia slot88 gampang menang dengan pola rtp terbaik di slot 777 terbukti gacor hari ...,0,1
