No,Keyword,Title,Link,Description,is_legal,is_ilegal
292,casino online,Play Casino Games Online,https://casino.hardrock.com/atlantic-city/casino/online-casino,Explore the online casino options offered by the Hard Rock Hotel & Casino in Atlantic City for when you can't make it down to the Boardwalk.,0,1
293,casino online,Play Casino Games Online,https://casino.hardrock.com/atlantic-city/casino/online-casino,Explore the online casino options offered by the Hard Rock Hotel & Casino in Atlantic City for when you can't make it down to the Boardwalk.,0,1
294,casino online,ATG Casino: Casino Online,https://www.atg.se/casino/start,"Hos ATG hittar du alltid det senaste inom Casino online. Spela casino på nätet och välj mellan slots, Roulette, Blackjack och massvis av andra spel.",0,1
295,casino online,Circus: online casino and sports betting | Circus,https://www.circus.be/,"Explore thousands of casino games and place sports bets on your favorite matches. Circus is 100% fun, 100% Belgian and 100% responsible!",0,1
296,casino online,Permainan Kasino Online Terbaik di Agustus 2025,https://translate.google.com/translate?u=https://www.actionnetwork.com/casino/games&hl=id&sl=en&tl=id&client=srp,"Logo Bally Bet Sports & Casino · Bally Bet Sports & Casino. Dapatkan hingga $100 Kembali dalam Bentuk Uang Bonus + Bonus $50 pada Deposit ...Discover the most popular types of online casino games, and how you can set started. Sign up, claim welcome bonuses, and more!",0,1
297,casino online,Experiență Unică de Cazino Live la Fortuna,https://casino.efortuna.ro/cazinou-live,"Bucură-te de experiența unui cazinou real la tine acasă, cu jocurile noastre de casino live. Joacă cele mai populare jocuri cu dealeri reali în timp real!",0,1
298,casino online,Online Casino | Casino Online | Casino777,https://www.casino777.be/en/,"We have a vast array of online casino games, from our innovative slots and dice games to various adaptations of Online Blackjack, Online Roulette and Online ...",0,1
299,casino online,Comeon Online Casino - Play Online Favorites!,https://www.comeon.com/no/casino/explore,"Explore Comeon's wide range of casino games, including slots and table games. Enjoy seamless, secure gameplay on an award-winning platform.",0,1
300,casino online,Casino online de PokerStars,https://www.pokerstars.es/casino/,Juega en el casino online de PokerStars. Encuentra una exclusiva gama de mesas y juegos en vivo y podrás doblar tu primer depósito hasta 200 €.,0,1
301,casino online,Posido - The Best Online Casino and Bookmaker,https://posido.com/en/,Welcome to an ideal unity of online casino and bookmaker under one roof - Posido! Enjoy the latest casino games and leading betting odds!,0,1
302,casino online,Juega al Casino Online en Betsafe Perú,https://www.betsafe.pe/es/casino,"Descubre todo lo que Betsafe ofrece en juegos de casino online en Perú. Desde tragamonedas clásicas hasta tragamonedas con jackpots, ruleta y juegos de cartas ...",0,1
303,casino online,Alle Legale Online Casino's in Nederland (2025),https://intikkertje.nl/legale-online-casinos-in-nederland/,Ontdek ook welk online casino Nederland nog gaat betreden. Lees waarom je moet spelen bij een legaal casino met een vergunning van de Kansspelautoriteit. Er ...,0,1
304,casino online,Play Casino Games Online at 888 Casino,https://www.888casino.com/casino-games/,"Casino Games - Enjoy over 2000 exciting casino games at 888 Casino, with daily jackpots, scratch cards, blackjack, roulette, baccarat and more.",0,1
305,casino online,Slots: Heart of Vegas Casino - Apps on Google Play,https://play.google.com/store/apps/details?id=com.productmadness.hovmobile,"Heart of Vegas Casino – The Ultimate Online Social Casino Slots Experience for 2025! Welcome to Heart of Vegas, the best social casino slots ...",0,1
306,casino online,"Online Casino – Gokkasten, Tafelspellen & Live Casino",https://www.unibet.nl/casino,"Hier vind je alles van de nieuwste online gokkasten en klassieke fruitautomaten tot tafelspellen als roulette, blackjack, poker en baccarat. Met ons live casino ...",0,1
307,casino online,Betsson: Apuestas deportivas y casino online,https://www.betsson.co/,Casa de apuestas y casino online Betsson Colombia. Vive la emoción de apostar en todos los deportes y juegos de casino. ¡Regístrate y obtén bono de ...,0,1
308,casino online,Live Casino - Online Live Dealer Games at BetMGM UK,https://www.betmgm.co.uk/live-casino,Live casino at BetMGM offers an immersive experience with real dealers and interactive gameplay across a variety of classic casino games. Headlined by our show- ...,0,1
309,casino online,Online Casino Games in the Philippines | OKBet,https://games.okbet.com/,"OKBet is a PAGCOR accredited online casino games in the Philippines. Offers a wide options of slots, live dealers and esports. Sign up to play now!",0,1
310,casino online,Grand Mondial Casino™ | Official Website,https://grandmondial.casino/en/,Play at Grand Mondial Casino today ◊ Receive 150 Extra Chances to Become our Next Instant Millionaire for Just $10 ☆All the Latest Online Casino Games ...,0,1
311,casino online,Online Casino Österreich | Bonus & Freispiele,https://betway.com/g/de/casino,"Lizensiertes, sicheres & faires Online Casino Österreich. Spiele Spielautomaten, Roulette, Blackjack & Live Casino um Echtgeld.",0,1
312,casino online,🎰 Play 21000+ FREE Online Casino Games | No Download,https://www.casino.org/games/free/,Play the Most Popular Casino Games for Fun in 2025 - Enjoy 18600+ Slots ✓ 170+ Blackjack ✓ 210+ Roulette ✓ 80+ Video Poker.,0,1
313,casino online,Casino Online Indo,https://www.facebook.com/casinoindon/,Casino Online Indo. 127 likes · 1 talking about this. kasino online indo.,0,1
314,casino online,Live Casino UK - Play Casino Games Live at Betfair,https://casino.betfair.com/p/live-casino,"EXPERIENCE LIVE CASINO ONLINE AT BETFAIR CASINO · TAKE A SEAT, RELAX AND ENJOY PLAYING AT A CASINO LIVE ONLINE · WHAT IS LIVE CASINO? · WHY THE BETFAIR LIVE CASINO ...",0,1
315,casino online,Online Casino Games | Casino Online in Ireland - Novibet,https://www.novibet.ie/casino,Enjoy the online casino games at Novibet! Explore a wide range of slots and claim your welcome bonus up to €150 + 50 free spins. *T&Cs apply.,0,1
316,casino online,Permainan kasino,https://id.wikipedia.org/wiki/Permainan_kasino,"Ruang undian online mewakili pendekatan alternatif untuk perjudian online ... ↑ ""How Does RNG In Online Casino Software Work?"". www.techicy.com. Diakses ...",0,1
317,casino online,Live Casino | Play Live Dealer Casino Games,https://vegas.williamhill.com/live-casino,Does William Hill's Live Casino have real live dealers? Playing in a William Hill live casino is the closest online experience to playing in a traditional ...,0,1
318,casino online,Online Casino Betway | Play Casino Games Online,https://betway.com/g/en/casino,"Play Online Casino Games at Betway Online Casino. Sign On Bonus to Play your favourite casino games online. Roulette, Blackjack, Slots and more.",0,1
319,casino online,Tragaperras Online España | Jugar Slots con Dinero Real,https://www.bwin.es/es/games/c/slots,"Si lo tuyo es darle a la tragaperras y disfrutar de la emoción del juego con dinero real, en bwin España tenemos lo que buscas. Como casino online con ...",0,1
320,casino online,Juegos de casino gratis,https://es.vegas-expert.com/juegos-casino-gratis,"Prueba juegos de casino gratis sin descargar ni registrarse. Juega a tragaperras, a la ruleta y otros juegos de casino online sin gastar dinero.",0,1
321,casino online,Online casino Deutschland | 6000+ Spiele & Bonus,https://winz.io/de/casino,"Probieren Sie eine riesige Auswahl: Slots, Roulette, Blackjack, Baccarat, Jackpot-Spiele und Tischspiele. Alle Spiele sind risikofrei, völlig kostenlos und ...",0,1
322,casino online,Kasino Online & Taruhan Olahraga - Main & Bertaruh Online,https://stake.com/id,"Mainkan game kasino online terbaik, slot, & game kasino langsung, atau bertaruh di olahraga di Stake.com! Buka bonus VIP, bertaruh dengan kripto, ...",0,1
323,casino online,Live Casino | Play Live Casino Games at 888 Casino,https://www.888casino.com/live-casino/,"Thanks to the thrilling online live casino experience at 888, you can enjoy all the excitement of the casino floor without leaving the comfort of your home.",0,1
324,casino online,Huuuge Casino 777 Slots Games,https://play.google.com/store/apps/details?id=com.huuuge.casino.slots&hl=en_ZA,"Slots games & 777 slot machines. Social casino destination for players who love free slots, 777 slot machines, and exciting casino games.",0,1
325,casino online,Casino online | Juega partidas con dinero real en PokerStars,https://www.pokerstars.com/es-419/casino/,"Juega con PokerStars, una marca de confianza durante más de 20 años. Disfruta de las tragamonedas, las mesas de blackjack, ruleta y con dealer en vivo.",0,1
326,casino online,Permainan kasino Spanyol - Selamat datang di Casino.es,https://translate.google.com/translate?u=https://www.casino.es/en/&hl=id&sl=en&tl=id&client=srp,"Informasi terbaik tentang kasino online di Casino.es, temukan semua permainan kasino: Roulette, Slot, Blackjack, Poker, dan Video Poker.The best information about online casinos in Casino.es, find all the casino games: Roulette, Slots, Blackjack, Poker and Video Poker.",0,1
327,casino online,Online gambling,https://en.wikipedia.org/wiki/Online_gambling,... online casino not licensed and operating before May 2000 to operate. This meant Lasseter's Online became the only online casino able to operate legally in ...,0,1
328,casino online,Apa nama situs yang bagus untuk bermain Casino online ?,https://id.quora.com/Apa-nama-situs-yang-bagus-untuk-bermain-Casino-online,"Untuk pengalaman bermain yang 100% aman dan terjamin, situs RAJASLOT adalah situs terpercaya yang telah lama beroperasi. Strategi Bermain Slot ...",0,1
329,casino online,Casino Online | Juegos de Casino Hasta $4000 de Bono,https://betway.mx/mx/es-mx/casino,"Bono de Bienvenida hasta $4000*. Más de 100 Tragamonedas y Slots, Blackjack, Ruleta y muchos más juegos a tu disposición en el mejor casino en línea.",0,1
330,casino online,online casino slot games - SEPLAG,https://drive.seplag.ac.gov.br/iosgames/online-casino-slot-games/,Tidak ada informasi mengenai halaman ini.,0,1
331,casino online,18000+ Free Online Slots to Play for Fun,https://casino.guru/free-casino-games/slots,Play the best and newest free slots for fun in demo mode. Enjoy 18000+ free demo slots on Casino Guru. Free online slot machines & other games.,0,1
332,casino online,Aprovecha +23.000 Juegos de Casino Gratis Sin Registro 🎰,https://www.casino.org/es-cl/juegos/gratis/,"Disfruta más de 23.000 juegos de casino online gratis hoy. Juega sin riesgo, sin descargas y sin registros en los mejores juegos gratis de Chile.",0,1
333,casino online,Casino Online | Juegos de Casino Hasta $4000 de Bono,https://betway.mx/mx/es-mx/casino,"Bono de Bienvenida hasta $4000*. Más de 100 Tragamonedas y Slots, Blackjack, Ruleta y muchos más juegos a tu disposición en el mejor casino en línea.",0,1
334,casino online,Casino - Android Apps on Google Play,https://play.google.com/store/apps/category/GAME_CASINO,Top free casino games. Top free. Top grossing. Top paid. 1. 2. 3. 4. 5. 6. 7. 8. 9. chevron_right. Google Play. Play Pass · Play Points.,0,1
335,casino online,Cashman Casino: Mesin Judi - Aplikasi di Google Play,https://play.google.com/store/apps/details?id=com.productmadness.cashmancasino&hl=id,Susun kantung uang dan uang tunai secara BESAR dengan CASHMAN - game judi kasino gratis baru yang menampilkan mesin judi terbaik Aristocrat!,0,1
336,casino online,Casino Slots - Slot Machines - Aplikasi di ...,https://play.google.com/store/apps/details?id=free.slots.casino.slot.machine&hl=id,"Bagi para pemain mesin permainan, mungkin, ini menjadi salah satu slot video yang paling digemari dengan permainan kasino yang paling populer.",0,1
337,casino online,Casino X - Apps on Google Play,https://play.google.com/store/apps/details?id=itembox.crayfish.x,**NEW** Now with MASSIVE Jackpot Payouts!! **NEW** Best FREE online slots app for Android! Play with your friends and thousands of other ...,0,1
338,microgaming,Microgaming 🏢 Perusahaan Situs Game Online Terbaik ...,https://sultanturkishalfreton.com/order-now/soft-drinks,Microgaming menyediakan berbagai game online yang mudah dimainkan secara global dengan bonus besar disetiap situs game. Ayo manfaatkan hoki jackpot anda di ...,0,1
339,microgaming,Microgaming,https://www.instagram.com/microgaming/,We aggregate the best games for online casinos worldwide (excluding the USA and several other countries). • gamcare.org.uk • begambleaware.org ...,0,1
340,microgaming,Situs Live Casino Online Resmi Agen Max Speed Baccarat ...,https://c-if.jp/about/,MICROGAMING adalah bandar Casino Online terpercaya yang paling besar di Asia. 98% penggemar Casino Online di Asia mempercayakan INDORAJA dalam taruhan Baccarat.,0,1
341,microgaming,"Microgaming - Wikipedia bahasa Indonesia, ensiklopedia ...",https://id.wikipedia.org/wiki/Microgaming,Microgaming adalah sebuah perusahaan swasta yang bergerak di bidang software slot online berbasis di Pulau Man. Perusahaan ini pertama kali menciptakan ...,0,1
342,microgaming,Microgaming,https://www.linkedin.com/company/microgamingofficial,"With over three decades of gaming industry expertise, our legacy is built on delivering robust and adaptable casino platforms and sportsbook products that ...",0,1
343,microgaming,Microgaming,https://en.wikipedia.org/wiki/Microgaming,Microgaming is a privately held gambling software company based in the Isle of Man. The company first developed online casino software in 1994.,0,1
344,microgaming,Microgaming,https://everymatrix.com/partners/microgaming/,Microgaming is part of the industry from 1994 and they are for sure a renowned provider of online gambling software. They have released their Viper software ...,0,1
345,microgaming,Microgaming,https://igamingexpress.com/brands/microgaming/,"Microgaming operates the largest progressive jackpot network in online gambling. The most famous title in this category is Mega Moolah. In 2015, Mega Moolah set ...",0,1
346,microgaming,Microgaming Slots | New Games with Free Demos,https://slotslaunch.com/microgaming,A current list of all the Microgaming slots with free demos. Learn how you can add all of these demo slots to your own casino affiliate websites.,0,1
347,microgaming,Apricot,https://www.apricot.co.im/,"Apricot has been delivering market-leading, responsible, robust, and adaptable casino platforms and sportsbook product for over three decades.",0,1
348,microgaming,SLOT99BET: Link Situs Slot Gacor Hari ini Online Terbaru ...,https://www.figoitalian.com/menu,SLOT99BET ialah situs slot gacor hari ini terbaru dengan beragam pilihan game link slot online gampang jackpot terpercaya perkalian hingga x1000 maxwin.,0,1
349,microgaming,Microgaming – Provider Review & Games,https://www.softswiss.com/game-providers/microgaming/,Microgaming holds a Guinness World Record title for the largest jackpot payout in an online slot machine game (13.2 million GBP from a 25p spin).,0,1
350,microgaming,Microgaming,https://x.com/Microgaming,Microgaming ... We supply legendary online gaming platforms systems and services to select customers in key markets. | gamcare.org.uk | begambleaware.org. Posts.,0,1
351,microgaming,Microgaming Slots - Play Free Apricot Games Online,https://www.vegasslotsonline.com/microgaming/,Microgaming's slots are available in more than 800 of the best real money online slots with many of the most popular and successful poker rooms also using ...,0,1
352,microgaming,Microgaming goes back to its roots under new CEO,https://igamingbusiness.com/gaming/online-casino/microgaming-goes-back-to-its-roots-under-new-ceo/,"After the sale of Quickfire, Microgaming's sole focus is its platform business, says new CEO Stephen Fisk. That's what made it great in the ...",0,1
353,microgaming,Microgaming Casino Software,https://www.softgamings.com/online-gambling-software-providers/microgaming-casino-software/,"Microgaming software includes more than 850 multilingual, reliable and high–quality games. You can start your own casino with Microgaming or add this ...",0,1
354,microgaming,RADAR138 | Link Slot Mahjong Maxwin MicroGaming ...,https://juicyfest.co/line-up/,"RADAR138 | Link Slot Mahjong Maxwin MicroGaming Terbaru 2025 Lebih Gacor di Situs 138 · Server Anti-Blokir Nawala: Link situsnya aman banget, gak kena blokir, ...",0,1
355,microgaming,Top Microgaming Casino Sites 2025,https://www.casino.org/us/software/microgaming/,"Microgaming is a company known for offering premium bonuses and promotions to its players, with many bonuses on offer on specific games only. Most bonuses will ...",0,1
356,microgaming,CERMIN4D | Situs Slot Gacor Malam Ini Slot Online Server ...,https://thekitchen.la/lunch/,"CERMIN4D adalah situs slot gacor malam ini yang menyediakan slot online server Thailand dengan performa stabil dan peluang menang tinggi, didukung RTP besar ...",0,1
357,microgaming,21 Best Microgaming (Apricot) Slots to Play Online Now,https://www.pokernews.com/casino/slots/microgaming-slots.htm,"In this article, I am going to give you access to all the best Microgaming (now called Apricot) slots you can play.",0,1
358,microgaming,ZONA66 : Situs Slot88 Gacor Indonesia Resmi Mudah ...,https://en.sdec-france.com/,"ZONA66 adalah platform Situs Slot88 resmi yang dikenal stabil, cepat, dan menyediakan banyak pilihan game slot gacor mudah maxwin hari ini.",0,1
359,microgaming,INDOBET77 : Situs Judi Resmi Agen Live Casino Online ...,https://core-indonesia.com/public/,"INDOBET77 adalah situs resmi judi agen live casino online bekerja sama Microgaming dengan permainan seperti Baccarat, Blackjack, Roulette, Poker",0,1
360,microgaming,Read Customer Service Reviews of microgaming.co.uk,https://www.trustpilot.com/review/microgaming.co.uk,Poor. TrustScore 2 out of 5. 13 reviews. 5-star. 4-star. 3-star. 2-star. 1-star. How is the TrustScore calculated? How this company uses Trustpilot.,0,1
361,microgaming,Bigo234 Situs Slot Gacor Populer 2026,https://momentumsupport.ca/work-with-us,Bigo234 adalah situs slot gacor online berlisensi resmi yang menjadi rekomendasi Google paling modern pada tahun 2026. Platform ini menghadirkan ekosistem ...,0,1
362,microgaming,MPO1221 : Link Situs Slot Gacor Terpercaya Jaminan ...,https://dent.ilearn.unand.ac.id/,"Sebagai situs resmi, MPO1221 menawarkan beragam permainan slot online dengan winrate tinggi dan peluang maxwin yang lebih mudah didapatkan. Sistem permainan ...",0,1
363,microgaming,DEWANAGA | Situs Slot Gacor Maxwin Gampang Cuan ...,https://www.bruceparkerdmd.com/our-doctor/,"Agen slot Pragmatic, Slot88, PG Soft, Microgaming terbaik, aman, dan terpercaya. Ikuti Kami.",0,1
364,microgaming,Tentang Kami & Hubungi Kami | MicrogamingDemo,https://www.microgamingdemo.com/tentang-kami/,"Dengan koleksi game terlengkap dari Microgaming, kamu bisa langsung mencoba berbagai permainan tanpa perlu registrasi atau instalasi apa pun. Semua game ...",0,1
365,microgaming,Top 10 Microgaming Casinos Online,https://www.gamblingsites.com/online-casino/software-providers/microgaming/,Microgaming casinos offer fun games with big payouts and exciting features. Learn where Microgaming games are offered and which to play!,0,1
366,microgaming,Microgaming APK untuk Unduhan Android,https://apkpure.com/id/microgaming-casino-%E0%B9%80%E0%B8%81%E0%B8%A1%E0%B8%AA%E0%B8%A5%E0%B9%87%E0%B8%AD%E0%B8%95/com.microgaming.brand.slot,"Unduhan APK Microgaming 1.0 untuk Android. Microgaming Casino, dimensi baru permainan slot yang akan membuat Anda terpesona.",0,1
367,microgaming,The Latest & Full List of Microgaming Casino ... - SBOTOP,https://www.sbotop.com/games/provider/microgaming,"Microgaming slots are celebrated for their captivating features, including jackpots, bonuses, and bonus buys. SBOTOP provides an extensive array of Microgaming ...",0,1
368,microgaming,The Latest & Full List of Microgaming Casino ... - SBOTOP,https://www.sbotop.com/games/provider/microgaming,"Microgaming slots are celebrated for their captivating features, including jackpots, bonuses, and bonus buys. SBOTOP provides an extensive array of Microgaming ...",0,1
369,microgaming,https://tribal.mp.gov.in/online2025/slot-microgami...,https://tribal.mp.gov.in/online2025/slot-microgaming-terbaik-58989t49/,,0,1
370,microgaming,MICROGAMING,https://www.arenampo.today/slot/microgaming,Fire & Diamond Jingle Joker. Permainan Baru. slot-img. RTP 91%. Gift Jackpot Progress 87.66%. Black Friday. Permainan Baru. slot-img.,0,1
371,microgaming,Microgaming — Вікіпедія,https://uk.wikipedia.org/wiki/Microgaming,"Apricot Investments, раніше відома як Microgaming — компанія з розробки ПЗ для азартних ігор, працює на Острові Мен. 2025 року компанія змінила назву на ...",0,1
372,microgaming,RUPIAHSLOT88: Link Asli Situs Slot Gacor Maxwin Hari Ini ...,https://classements.net/villes-plus-propres/,Situs slot gacor rupiahslot88 adalah link asli terdaftar sebagai agen sbobet resmi khusus judi bola online. Temukan taruhan mix parlay terbaik semua lini ...,0,1
373,microgaming,MICROGAMING - mposakti,https://mposaktisuper.com/slot/microgaming,MICROGAMING ; 88.46%. Office Party ; 97.31%. Fire & Diamond Jingle Joker ; 95.38%. Curse of Medusa ; 85.63%. Swoll ; 96.09%. Sew.,0,1
374,microgaming,Microgaming,https://de.wikipedia.org/wiki/Microgaming,Microgaming Software Systems Ltd ist ein privat geführtes Unternehmen im Bereich der Entwicklung von Gaming-Software mit Sitz auf der Isle of Man.,0,1
375,microgaming,MICROGAMING,https://mpoprofit.it.com/slot/microgaming,Fire & Diamond Jingle Joker. Permainan Baru. slot-img. RTP 94%. Gift Jackpot Progress 97.74%. Black Friday. Permainan Baru. slot-img.,0,1
376,microgaming,Permainan Slot,https://qqsawerresmi.com/slots/microgaming,Unduh Aplikasi. Masuk Daftar. Slots · PRAGMATIC. PGSOFT. JOKER. BESOFT. SPADE GAMING. FASTSPIN. JILI. BNG. PLAYTECH. WOW GAMING. HABANERO. FAT PANDA.,0,1
377,microgaming,RTP SLOT GACOR - Microgaming,https://www.hotgameaw88.com/provider/microgaming,"Daftar Game Microgaming - Selasa, 16 Desember 2025. Kembali Slot On Fire · Break Away Ultra HOT #2. 71.5%. Jam Gacor: 12:35 - 15:05. 16:20 - 18:15. 20:20 ...",0,1
378,pg soft,Demo Gacor Pragmatic Play x10000 Dan Ahli Pg Soft Auto ...,https://www.bigbangburger.com/bigbang-burger-menu,Pemain disarankan untuk memanfaatkan fitur ini dalam mode demo dengan modal gratis terlebih dahulu. Tujuannya adalah untuk mengidentifikasi pola RTP (Return to ...,0,1
379,pg soft,"Slot Demo Terlengkap PG Soft, Pragmatic Play Akun ...",https://www.kellys-landing.com/menu/,Tersedia slot demo paket lengkap dari PG Soft dan Pragmatic Play memberikan akun gacor untuk demo super scatter terbaru di tahun ini.,0,1
380,pg soft,Mahjong Slot 🀄️ Daftar Situs Slot Gacor Mahjong ways 2 ...,https://online.pgcollegekawardha.edu.in/admissionindex.aspx,"PG Soft sebagai situs penyedia permainan Mahjong Slot menawarkan akses ke fitur slot Scatter Hitam dengan jaminan JP maxwin, sehingga setiap pemain memiliki ...",0,1
381,pg soft,Ekspansi Global Pgsoft Dan Dampaknya Bagi Pemain,https://repository.uinjkt.ac.id/dspace/bitstream/123456789/67674/10/ekspansi-global-pgsoft-dan-dampaknya-bagi-pemain.html,PG Soft memiliki strategi ekspansi yang ambisius untuk menjangkau pasar global. Langkah pertama dalam proses ini adalah menjalin kemitraan dengan penyedia ...,0,1
382,pg soft,DEPOBOS: Akses Resmi Slot Online Gacor Pg Soft Link ...,https://www.rakerda.pta-jambi.go.id/,"Main di DEPOBOS, akses resmi slot online gacor dengan provider terbaik pg soft yang siap memberikan kenyamanan dengan link slot777 yang memiliki rtp tinggi ...",0,1
383,pg soft,PG SOFT,https://www.youtube.com/channel/UCPUyzKpGbihVRuNqLEiiF0A,"Pocket Games Soft is a world-class mobile games company. We pride ourselves to deliver immersive gaming solutions on iOS, Android, and HTML5 platforms.",0,1
384,pg soft,Demo Slot Gratis Akun Demo Pragmatic Dan PG Soft X1000 ...,http://phrimukomuko.org/,Mainkan demo slot gratis pakai akun demo pragmatic dan pg soft x1000 tanpa daftar dan tanpa deposit. Nikmati berbagai jenis permainan demo pg soft dan ...,0,1
385,pg soft,TOKYO88 : Link Slot Depo 5K PG Soft Slot Gacor Pakai ...,https://www.129centercut.biz/menu,TOKYO88 menyediakan link slot resmi depo 5K melalui aplikasi QRIS. Mainkan game provider PG Soft lebih mudah dengan minimal deposit 5000 rasakan kegacoran ...,0,1
386,pg soft,Bongkar Trik Pola Pg Soft Mudah Modal Dikit Bisa Jadi ...,http://repo.unand.ac.id/5516/23/bongkar-trik-pola-pg-soft-mudah-modal-dikit-bisa-jadi-sultan-panduan-cekatan-2025.html,PG Soft atau Pocket Games Soft adalah salah satu pengembang perangkat lunak game terkemuka yang didirikan pada tahun 2015. Mereka terkenal dengan inovasi dan ...,0,1
387,pg soft,Perbedaan yang Membuat Perbedaan,https://www.pgsoft.com/id/,PG SOFT adalah perusahaan permainan seluler digital kelas dunia. Pocket Games Software menyediakan solusi permainan berdasarkan permintaan pada platform iOS ...,0,1
388,pg soft,SLOT4D 🎮 Kumpulan Game Slot 4D Pragmatic dan PG ...,https://www.baltimorevalley.ca/warranty/,SLOT4D jadi situsnya para pecinta slot gacor. Nikmati kumpulan game slot 4D slot online dari provider ternama seperti Pragmatic Play dan PG Soft dalam satu ...,0,1
389,pg soft,Perbedaan yang Membuat Perbedaan,https://www.pgsoft.com/id/,PG SOFT adalah perusahaan permainan seluler digital kelas dunia. Pocket Games Software menyediakan solusi permainan berdasarkan permintaan pada platform iOS ...,0,1
