No,Keyword,Title,Link,Description,is_legal,is_ilegal
568,porno,Video Porno HD Gratis: Film Definisi Tinggi di xHamster,https://id.xhamster.com/hd,Tonton semua Video HD Porno di xHamster gratis. Streaming film tabung seks Definisi Tinggi baru dari aksi sialan hardcore dengan gadis-gadis panas sekarang!,0,1
569,porno,'bokep' Search - XNXX.COM,https://www.xnxx.com/search/bokep,Porno en espanol · Blonde · Hairy pussy · Best Of · Casting · My commented videos · Photos · Porn Games · Redhead · Sex Stories · Cheating wife · Femdom ...,0,1
570,porno,Video Porno Gratis yang Sedang Tren,https://id.xhamster2.com/4,Video porno gratis yang Anda sukai! Streaming jutaan video seks yang sedang tren untuk semua selera secara instan. xHamster menghadirkan video XXX dengan ...,0,1
571,porno,"Pornhub: Free Porn Videos & Sex Movies - Porno, XXX, Porn ...",https://www.pornhub.com/,"Welcome to Pornhub.com, home of the best hardcore free porn videos with the hottest adult stars. Get full length scenes from your favorite porn studios ...",0,1
572,porno,"Situs Video Bokep Gratis - Film Bokep, Porno & XXX Indo",https://theporndude.com/id/top-porn-tube-sites,"Sebagian besar destinasi dewasa ini memiliki ribuan video porno gratis dan foto vagina HQ yang disajikan berdasarkan kategori, sehingga kamu pasti dimanjakan ...",0,1
573,porno,"Kasus Video Porno Anak Musisi Inisial 'D', Polisi Gali ...",https://www.youtube.com/watch?v=h7r7ZrXaMd0,Sang anak dipaksa untuk menonton VCD porno dan melayani nafsu bejat Ayahnya | JELANG SIANG · IJAZAH JOKOWI: Apa yang Sebenarnya Disembunyikan?,0,1
574,porno,https://digilib.uns.ac.id/dokumen/abstrak/59263/Vi...,https://digilib.uns.ac.id/dokumen/abstrak/59263/Video-Porno-dan-Seks-Bebas-Studi-Kasus-Remaja-Pria-Kelurahan-Gandekan-Kota-Surakarta,Tidak ada informasi mengenai halaman ini.,0,1
575,porno,Dampak Dari Sering Menonton Film Porno,https://www.alodokter.com/komunitas/topic/otak-3,Menonton film Blue (porno) tidak dapat menyebabkan kerusakan saraf otak secara organik dan serius. Namun menonton hal tersebut dapat mengganggu ...,0,1
576,porno,"Menkominfo: Situs Porno Diblokir 100, Tumbuh 1.000",https://www.komdigi.go.id/berita/sorotan-media/detail/menkominfo-situs-porno-diblokir-100-tumbuh-1-000,"""Yang paling banyak diblokir itu situs porno. Ada undang-undang di negara kita melarang konten pornografi. Tapi di sini dilarang, di belahan dunia lain itu jadi ...",0,1
577,porno,Pemeran Film Porno Jaksel Berinisial 'CN' Mengaku Jadi ...,https://www.youtube.com/watch?v=kyWde69YxBk,"Pemeran Film Porno Jaksel Berinisial 'CN' Mengaku Jadi Korban, Dijebak? · Comments. Add a comment... 3:21 · Go to channel · Penyalahgunaan Izin ...",0,1
578,porno,Remaja Indonesia Pelaku Aktif Video Porno Amatir,https://ugm.ac.id/id/berita/4130-remaja-indonesia-pelaku-aktif-video-porno-amatir/,Remaja Indonesia merupakan pelaku aktif dari video porno amatir. Maraknya pemakaian hand phone dan perkembangan pesat teknologi media komunikasi ...,0,1
579,porno,https://digilib.uns.ac.id/dokumen/abstrak/59263/Vi...,https://digilib.uns.ac.id/dokumen/abstrak/59263/Video-Porno-dan-Seks-Bebas-Studi-Kasus-Remaja-Pria-Kelurahan-Gandekan-Kota-Surakarta,Tidak ada informasi mengenai halaman ini.,0,1
580,porno,Film porno,https://id.wikipedia.org/wiki/Film_porno,Film porno mewakili fantasi seksual dan biasanya berisi materi yang merangsang secara erotis seperti ketelanjangan atau fetish dan hubungan seksual. Perbedaan ...,0,1
581,porno,Peredaran Video Porno Sangat Membahayakan Masyarakat,https://kemenag.go.id/nasional/peredaran-video-porno-sangat-membahayakan-masyarakat-k49xoi,,0,1
582,porno,Video Porno Gratis & Film XXX: Video Porno Seks | xHamster,https://id.xhamster.desi/,Nikmati video porno dan film XXX eksklusif hanya di xHamster. Streaming 6Juta+ video seks hardcore pro dan amatir dengan kualitas terbaik secara instan!,0,1
583,porno,"Kasus Video Porno Anak Musisi Inisial 'D', Polisi Gali ...",https://www.youtube.com/watch?v=h7r7ZrXaMd0,Sang anak dipaksa untuk menonton VCD porno dan melayani nafsu bejat Ayahnya | JELANG SIANG · IJAZAH JOKOWI: Apa yang Sebenarnya Disembunyikan?,0,1
584,porno,Terkuak! Ternyata Ini 10 Alasan Pria Suka Pornografi,https://www.klikdokter.com/gaya-hidup/seks/mengapa-pria-menyukai-pornografi?srsltid=AfmBOopr0N4en6ddC6tTVkJPCk2jBFM5G5J7mNVGqzBTkFmCyAyiMZCB,Nonton porno akan membantu mereka merasa bergairah sehingga kepuasan seksual saat masturbasi mudah dicapai. 3. Tidak Memiliki Pasangan Seksual.,0,1
585,porno,"Wanita Menonton Video Porno, Normalkah? Ini Faktanya",https://www.idntimes.com/health/sex/perempuan-menonton-video-porno-1-00-2k3g7-lm6r6p,Rata-rata perempuan menghabiskan waktu 10 menit 33 detik untuk mengakses situs porno. Alasan mengapa perempuan menonton video porno lebih lama ...,0,1
586,porno,'porno' Search - XNXX.COM,https://www.xnxx.tv/search/porno?top,"XNXX.COM 'porno' Search, free sex videos.",0,1
587,porno,Buka situs porno - Komunitas Google Penelusuran,https://support.google.com/websearch/thread/213786904/buka-situs-porno?hl=id,Konten komunitas mungkin tidak diverifikasi atau bukan yang terbaru. Pelajari lebih lanjut. Jawaban yang Direkomendasikan.,0,1
588,porno,Video Porno - JC Reyes & SAIKO: Lirik Lagu ...,https://www.shazam.com/id-id/song/1603112481/video-porno,Video Porno dirilis pada 2 Maret 2021 oleh JC Reyes sebagai bagian dari album Los Green Lanters · Buka di Apple Music.,0,1
589,porno,Pemilik situs 'video porno curian' di Korea ditahan,https://www.bbc.com/indonesia/majalah-44625522,Situs itu menampung lebih dari sejuta pengguna dan menyediakan ribuan video yang diambil dan dibagikan tanpa sepengetahuan perempuan yang ...,0,1
590,porno,Berita Video Porno Hari Ini - Kabar Terbaru Terkini,https://www.liputan6.com/tag/video-porno,"Video Porno · Tersangka kejahatan dunia maya menggunakan akun Instagram palsu untuk meminta video porno saat dihadirkan di Polda · Pemerhati media sosial, ...",0,1
591,porno,++SEX~️XXX!!)Seks Xxxxxxxxxxxxxxxxxxxxxxxxx Porno ...,https://ossfrcmgtest.fr.sodexo.com/tvc/video/video-sex-xxxxxxxxxxxxxxxxxxxxxxxxxx-porn-videos-xnxx-xxxxx-porn-sex-00101-tr.html,Seks Xxxxxxxxxxxxxxxxxxxxxxxxx Porno Videoları.2025 will host Seks Xxxxxxxxxxxxxxxxxxxxxxxxx Porno Videoları.2025 at Durban's Kings Park Stadium ...,0,1
592,porno,Video Porno Gratis - Redtube - Film XXX - La Patria dei Video ...,https://it.redtube.com/,Redtube ti porta NUOVI video porno ogni giorno gratuitamente. Goditi i nostri film XXX in HD su qualsiasi dispositivo. Immergiti completamente negli ultimi ...,0,1
593,porno,https://porno365.plus/categories,https://porno365.plus/categories,,0,1
594,porno,Results for : video porno indonesia terbaru,https://www.xnxx.com/search/video+porno+indonesia+terbaru,"XNXX.COM 'video porno indonesia terbaru' Search, free sex videos. ... Results for : video porno indonesia terbaru. STANDARD - 30,480 GOLD - 30,480.",0,1
595,porno,Dampak Terlalu Sering Menonton Film Porno,https://www.alodokter.com/komunitas/topic/konsultasi-hubungan-seksual,"Konsumsi video porno dapat menyebabkan berbagai perubahan kimiawi otak, hal ini sangat berpengaruh terhadap suasana hati, gairah, pola pikir, ...",0,1
596,porno,Artikel Porno,https://www.um-surabaya.ac.id/article/tag/porno,"Artikel Porno · Kasus Pornografi Anak Terus Meningkat, Dosen UM Surabaya Beri Pesan Ini untuk Para Orang Tua · Marak Anak Kecanduan Game dan Film Dewasa, Dosen ...",0,1
597,porno,‎PORNO GRAFFITTI BEST ACE - Album oleh ...,https://music.apple.com/id/album/porno-graffitti-best-ace/1537263573?l=id,"29 Oktober 2008 13 lagu, 59 menit ℗ 2008 Sony Music Entertainment (Japan) Inc. Versi Lainnya. Porno Graffitti Best Ace. Porno Graffitti Best Ace · Porno ...",0,1
598,porno,Porno rica concha,https://sunplena.fr/athletic/football/premier-league/schedule/,Navega a través de nuestra impresionante selección de videos porno en calidad HD en cualquiera de tus dispositivos. ... Mira Concha Rica videos ...,0,1
599,porno,Polisi: Pelaku Jual Video Porno Anak di Bawah Umur Rp ...,https://sinpo.id/detail/77619/polisi-pelaku-jual-video-porno-anak-di-bawah-umur-rp-165-ribu-perpaket,"Polda Metro Jaya telah menangkap seorang pria berinisial MAFA (20), seorang admin grup telegram video porno anak-anak di bawah umur. Pelaku ...",0,1
600,porno,Video Porno - JC Reyes & SAIKO: Lirik Lagu ...,https://www.shazam.com/id-id/song/1603112481/video-porno,Video Porno dirilis pada 2 Maret 2021 oleh JC Reyes sebagai bagian dari album Los Green Lanters · Buka di Apple Music.,0,1
601,porno,Porno (novel),https://en.wikipedia.org/wiki/Porno_(novel),"Porno is a 2002 novel by Scottish writer Irvine Welsh, the sequel to Trainspotting. The book follows the characters of Trainspotting ten years after the events ...",0,1
602,porno,"Dianggap Bahayakan Anak Muda, Nonton Konten Porno di ...",https://www.abc.net.au/indonesian/2020-03-11/australia-rencana-batasi-usia-nonton-porno/12044994,Parlemen Australia merekomendasikan rancangan undang-undang yang nantinya akan mewajibkan verfikasi batas umur 18 tahun untuk bisa mengakses ...,0,1
603,porno,Kehadiran Sex Entertainment di Jakarta Melahirkan ...,https://most1058fm.com/2023/09/kehadiran-sex-entertainment-di-jakarta-melahirkan-rumah-produksi-film-porno-di-jakarta-selatan/,"Pornografi yang notabenenya menjadi hal yang haram di Indonesia, kini memiliki rumah produksinya sendiri. Berdasarkan keterangan dari Polda ...",0,1
604,porno,Tolong jangan tayangkan Vidio yg porno atau seksual,https://support.google.com/youtube/thread/310235372/tolong-jangan-tayangkan-vidio-yg-porno-atau-seksual?hl=id,"Tolong jangan tayangkan Vidio yg porno atau seksual · Buka aplikasi YouTube . · Buka video yang ingin dilaporkan. · Di bagian atas video, ketuk ...",0,1
605,porno,'vidio porno indonesia' Search,https://www.xnxx.tv/search/vidio+porno+indonesia,"XNXX.COM 'vidio porno indonesia' Search, free sex videos. ... Results for : vidio porno indonesia. STANDARD - 10,956 GOLD - 10,956. Report.",0,1
606,porno,Porno - Free XXX Porn - Porno.com,https://www.porno.com/,Xnxx.com (est.2001) has the hottest free porno movies you can find on any XXX videos tube online. Hot MILF moms and horny girls getting fucked hard in the ass ...,0,1
607,porno,"Porno en Español / Porn in Spanish, page 9 - XVIDEOS.COM",https://www.xvideos.com/lang/espanol/8,"XVIDEOS Porno en Español / Porn in Spanish, page 9, free. ... El Porno del pueblo - 268.5k Views -. 720p · Hot chubby Spanish slut with big natural tits enjoys ...",0,1
608,porno,vistos - mas luxuretv - porno extremo - zooskool latina video,https://iesh-sejour.fr/gkgujpzmmo/86436,Vídeos porno extremo Zoofilia subtitulado - Mas Vistos. Nuevos videos de zooskool jovenes mexicanas añadidos hoy. Vídeos porno extremo Zooskool ...,0,1
609,porno,Dar am porno sotwe a lot of the lead up to the date to find,https://szczesliwa-7.pl/historia/,"Dar am porno sotwe she was incredibly gracefully dressed but looked hot at the same time. Her features is really cute / attractive, and her figure is also ...",0,1
610,porno,𝓍𝓍𝓍 vidéos porno vidéo xxx sexe ...,https://etsiiaa.uva.es/video/video-vid%C3%A9os-porno-sxxy-girl-tuberx_935911.html,xxx vidéos porno vidéo xxx sexe xxx vidéos de sexe vidéos xxx tube porno xxx porno xxx pornohub com XXX streaming video with real-time ...,0,1
611,porno,"Tayangkan Video Klip Porno, KPID NTB Tegur TV9 Lombok",https://www.kpi.go.id/index.php/id/umum/23-berita-daerah/32502-tayangkan-video-klip-porno-kpid-ntb-tegur-tv9-lombok?start=24&detail3=9856&detail5=9468,Kemudian pada pukul 22.30 WITA menampilkan video klip lagu berjudul All of Me dinyanyikan John Legend yang sarat muatan pornografi. Penayangan ...,0,1
612,porno,"Video Porno, Sesso, XXX, Tube Porno Gratis | YouPorn Italiano",https://it.youporn.com/,YOUPORN è la tua casa per XXX & video PORNO Gratis. GUARDA il miglior sesso TEEN della rete! Divertiti con il PORNO più sensuale con le ragazze più belle ...,0,1
613,porno,porno - Wikikamus bahasa Indonesia,https://id.wiktionary.org/wiki/porno,"Frasa mengandung kata porno · film porno · majalah porno. Terjemahan. Terjemahan. Lihat pula. Semua halaman dengan kata ""porno"" · Semua halaman dengan judul ...",0,1
614,porno,Berita Film Porno Terkini Dan Terbaru Hari Ini,https://www.okezone.com/tag/film-porno,Okezone.com - Berita Film Porno Terkini Dan Terbaru Hari Ini - Aksi bejat dilakukan siswa sekolah menengah kejuruan SMK yang tega menyetubuhi keponakannya ...,0,1
615,porno,"Tayangkan Video Klip Porno, KPID NTB Tegur TV9 Lombok",https://www.kpi.go.id/index.php/id/umum/23-berita-daerah/32502-tayangkan-video-klip-porno-kpid-ntb-tegur-tv9-lombok?start=24&detail3=9856&detail5=9468,Kemudian pada pukul 22.30 WITA menampilkan video klip lagu berjudul All of Me dinyanyikan John Legend yang sarat muatan pornografi. Penayangan ...,0,1
616,porno,"Video Porno, Sesso, XXX, Tube Porno Gratis | YouPorn Italiano",https://it.youporn.com/,YOUPORN è la tua casa per XXX & video PORNO Gratis. GUARDA il miglior sesso TEEN della rete! Divertiti con il PORNO più sensuale con le ragazze più belle ...,0,1
617,porno,porno - Wikikamus bahasa Indonesia,https://id.wiktionary.org/wiki/porno,"Frasa mengandung kata porno · film porno · majalah porno. Terjemahan. Terjemahan. Lihat pula. Semua halaman dengan kata ""porno"" · Semua halaman dengan judul ...",0,1
618,porno,xXx-sex-videos! Vídeos porno gay de mormones Pornhub ...,http://ossfrcmgtest.fr.sodexo.com/clip/video/video-mormon-gay-porn-videos-pornhub-com-xnxx-porn-sex-xxxxxxxx-0102-es.html,"Vídeos porno gay de mormones Pornhub com,xnxx Leaked Video Viral On facebook Media! The glamorous english sexy bf xxx bombshell makes her scenes ...",0,1
619,porno,Porno - Film di Google Play,https://play.google.com/store/movies/details/Porno?id=B4417736EE7C42CCMV&hl=id,"A middle-aged man recalls his numerous sexual encounters as he lays in bed. All of his couplings are haphazard and loveless, and he is left feeling hopeless ...",0,1
620,porno,Berita Film Porno Terkini Dan Terbaru Hari Ini,https://www.okezone.com/tag/film-porno,Okezone.com - Berita Film Porno Terkini Dan Terbaru Hari Ini - Aksi bejat dilakukan siswa sekolah menengah kejuruan SMK yang tega menyetubuhi keponakannya ...,0,1
621,porno,"Encontrar porno hoy en día, es super accesible. Lo ...",https://www.instagram.com/p/DOnqoRlD6BP/,"Muchas personas crecen creyendo que el porno funciona como una referencia, cuando en realidad puede distorsionar deseos, prácticas y ...",0,1
622,porno,"Porn Dude - Link Bokep, Situs Porno & Video Bokep Indonesia!",https://theporndude.com/id,Porn Dude mencantumkan situs porno terbaik. Semua situs bokep gratis dan premium disortir berdasarkan kualitas. Temukan video seks HD di situs porno terbaik ...,0,1
623,porno,Berita Film Porno Terbaru,https://www.tempo.co/tag/film-porno,Baca berita terbaru tentang film-porno di sini. Informasi terkini seputar film-porno yang akurat dan terpercaya.,0,1
624,porno,Les Meilleurs VIDÉOS PORNO XXX HD Gratuites | Sex TuKif,https://tukif.porn/videos/,Voici les ⭐VIDÉOS PORNO XXX⭐ en HD que vous aimez le plus sur TuKif. Regardez du SEXE FRANÇAIS favoris gratuitement. Streaming Sex illimité.,0,1
625,porno,Ucapkan Selamat Tinggal pada 120 Ribu Situs Porno,https://m.jpnn.com/news/ucapkan-selamat-tinggal-pada-120-ribu-situs-porno,"Sejak dioperasikan Rabu (3/1), sistem pengais konten negatif itu berhasil menjaring 120 ribu situs porno. Sebanyak 10 ribu URL (uniform resource ...",0,1
626,porno,AD Kembali Jalani Pemeriksaan Terkait Video Porno,https://tribratanews.polri.go.id/blog/hukum-4/ad-kembali-jalani-pemeriksaan-terkait-video-porno-77587,Tribratanews.polri.go.id - Jakarta. Polda Metro Jaya kembali memeriksa Audrey Davis terkait kasus pornografi. Pemeriksaan ini dilakukan ...,0,1
627,porno,"Ramai Komedian Beli Video Porno, Ini Dampak Kecanduan ...",https://www.gooddoctor.co.id/hidup-sehat/mental/ramai-komedian-beli-video-porno-ini-dampak-kecanduan-pornografi-bagi-kesehatan/,"Pornografi menjadi hal yang bisa menimbulkan kecanduan. Dampak pornografi yang ditimbulkan dapat menciptakan disfungsi seksual, hal ini ...",0,1
628,porno,"Bongkar Jaringan Film Porno Anak, Polisi Amankan 3.870 ...",https://www.rctiplus.com/news/detail/terkini/4269085/bongkar-jaringan-film-porno-anak-polisi-amankan-3870-video-panas,Polres Metro Bandara Soekarno-Hatta membongkar kasus jaringan produsen film porno yang melibatkan anak di bawah umur.,0,1
629,porno,Marak Jual-Beli Video Porno Anak Cerminkan Sebagian ...,https://www.medcom.id/nasional/hukum/ObzP7j0K-marak-jual-beli-video-porno-anak-cerminkan-sebagian-masyarakat-indonesia-berperilaku-menyimpang,Populasi masyarakat dunia penggemar pornografi anak kan besar. Ingat bahwa volume bisnis pornografi menduduki urutan ke empat setelah penjualan ...,0,1
630,porno,Polisi selidiki kasus pria yang diduga tontonkan video ...,https://www.antaranews.com/berita/4406845/polisi-selidiki-kasus-pria-yang-diduga-tontonkan-video-porno-ke-anak,"Kepolisian menyelidiki kasus seorang pria yang merupakan pedagang mainan di Cengkareng, Jakarta Barat, karena diduga mempertontonkan video ...",0,1
631,porno,Mandysfashionwalks porno she was very responsive before the,http://rugantino-bxl.be/li-auto/,"Mandysfashionwalks porno shes a curvy woman having enormous tits and a nice ass. She possesses a killer body, great breasts plus an incredible rear.",0,1
632,porno,Perlindungan Hukum Terhadap Privasi Dan Dampak Sosial ...,https://journal.appihi.or.id/index.php/Terang/article/view/348,Perlindungan Hukum Terhadap Privasi Dan Dampak Sosial Akibat Penyebaran Video Porno di Media Sosial. Authors. Helen Tina BR Lumban Batu ...,0,1
633,porno,Porno türk simge barankoğlu she recognized me and we hit it,https://sophrologie-christinaleognan.fr/news/mois/2017-3,"Porno türk simge barankoğlu saw that Mia was open and didn't wait to schedule with her. I feel she was quite recent when I visited her, and I believe she is ...",0,1
634,porno,Instagram Blake Lively Dibanjiri Spam Porno di Tengah ...,https://lifestyle.sindonews.com/read/1523961/187/instagram-blake-lively-dibanjiri-spam-porno-di-tengah-masalah-pelecehan-seksual-justin-baldoni-1738389756,Instagram Blake Lively baru-baru ini menjadi sasaran kampanye spam porno di tengah sengketa hukumnya yang sedang berlangsung dengan Justin ...,0,1
635,porno,PornHat - ¡nosotros ❤️ los vídeos porno gratuitos en HD!,https://es.pornhat.com/,Mira nuevas ⚡ películas XXX en HD en el canal Porn Hat gratis! Famosas estrellas porno ⭐ y chicas amateur ✌️. ¡Transmite! ¡Descarga! ¡Disfruta!,0,1
636,porno,Porno - Porno İzle - XXX Porn Filmleri - En Büyük Arşivli Site ...,https://7dak.com/,"Porno ❤️7DAK❤️; hergün güncellenen 300.000den fazla Porno videoları ile rakipsiz hizmetinizde, Türkiyenin ilk profesyonel porno sitesi.",0,1
637,porno,Results for : video porno paling bagus dan terbaru,https://www.xnxx.com/search/video%20porno%20paling%20bagus%20dan%20terbaru,"XNXX.COM 'video porno paling bagus dan terbaru' Search, free sex videos.",0,1
638,porno,"Porno (Norton Paperback): 9780393324501: Welsh, Irvine",https://www.amazon.com/Porno-Norton-Paperback-Irvine-Welsh/dp/0393324508,"In the last gasp of youth, Simon ""Sick Boy"" Williamson is back in Edinburgh. He taps into one last great scam: directing and producing a porn film.",0,1
639,porno,Порно 365 секс - каждый час новое порно. Порнуха в HD.,http://porno365.sexy/,Порно 365 - смотри сочное или скачай новое порно видео каждый день в HD качестве! Мы отбираем для вас только лучшие ролики отборной порнухи.,0,1
640,porno,Vagina.nl: Gratis porno videos en Nederlandse sex films,https://vagina.nl/,"Dé Tube site van Nederland! Gratis Nederlandse sex films van oa. Don en Ad, Rijschool69 en Porno Bob. Geheel gratis, uniek in Nederland, kom je?",0,1
641,porno,"Pornhub: Gratis pornovideo's en seksfilms - Porno, XXX ...",https://nl.pornhub.com/,"Welkom bij Pornhub.com, de thuisbasis van de beste gratis hardcore pornovideo's met de heetste 18+ pornosterren. Bekijk 24/7 volledige scènes van je ...",0,1
642,porno,xXx-sex-videos! Üniversiteli Kız Porno Videoları Sızan,http://ossfrcmgtest.fr.sodexo.com/x2/video/video-college-girl-leaked-porn-videos---xhamster-xnxx-porn-sex-xxxxxxxx-0102-tr.html,"Üniversiteli Kız Porno Videoları Sızan - xHamster,xnxx Leaked Video Viral On facebook Media! The glamorous english sexy bf xxx bombshell makes ...",0,1
643,porno,Berita porno Terbaru Hari Ini - Tribunjabar.id,https://jabar.tribunnews.com/tag/porno,"Berita porno - Anak Pasutri Polisi Jadi Tersangka Konten Video Syur, Mayoritas Korban Siswi SMAN 11 Semarang.",0,1
644,porno,"19 Bocah di Garut Gemar Menonton Video Porno, Ini 7 ...",https://www.orami.co.id/magazine/19-bocah-di-garut-gemar-menonton-video-porno-ini-langkah-yang-perlu-dilakukan-jika-pergoki-anak-lihat-porno,Sebanyak 19 bocah berusia sekitar 12 tahun dari Garut kecanduan seks karena sering nonton film dewasa via ponsel pintar.,0,1
645,porno,Alasan Kamu Harus Tinggalin yang Porno-porno,https://www.hipwee.com/list/alasan-kamu-harus-tinggalin-porno-sekarang-juga/,Pornografi adalah salah satu dampak negatif dari kecanggihan informasi yang sangat mudah untuk diakses baik dari siswa SD sampai tingkat ...,0,1
646,porno,PORNO MAN MEETING HER FOR THE FIRST TIME,https://www.xvideos.com/video.ucoflhbd54f/porno_man_meeting_her_for_the_first_time,PORNO MAN MEETING HER FOR THE FIRST TIME 14 min720p. Queen Anita · Angel Peace · Black Long Cock · porn · porno · cumshot · black · fucking ...,0,1
647,porno,"HOBI Nonton Film Porno, Hati-hati Sekarang Polisi Punya ...",https://www.youtube.com/watch?v=vDmuIcC3txU,https://medan.tribunne... TRI BUN-MEDAN.com - Bagi Anda yang sering menonton film porno di internet diimbau berhati-hati.,0,1
648,porno,Video porno,https://www.pilar.id/tag/video-porno/,"Video Kebaya Merah, Polda Jatim: Pelakunya Sudah Buat 92 Video Porno! Hendro D. Laksono 9 November 2022. Surabaya (pilar.id) – Dua pameran ...",0,1
649,porno,"Pornhub: Kostenlose Porno Videos & Sex Filme - Porno, XXX ...",https://de.pornhub.org/,"Willkommen bei Pornhub.com, die Heimat der besten kostenlosen Hardcore-Pornovideos mit den heißesten Stars. Holen Sie sich Szenen in voller Länge von Ihrem ...",0,1
650,porno,DOMLEPEN: Porno Video İzle - Sikiş ve Mobil Sex - HD Porna ...,https://www.domlepen.com/,"Porno videolarını takılma ve donma olmadan bedava, hd kalitede kesintisiz izle. Domlepen Escobar Aracılığıyla Her gün eklenen en yeni, en kaliteli porno ...",0,1
651,porno,Videos tagged « porno,https://www.xvideos.com/tags/porno,"Videos tagged « porno » (45,803 results) Report. Sort by : Relevance.",0,1
652,porno,"Porno Terbaru - Berita, Foto, Video",https://www.fimela.com/tag/porno,"Diduga Jual Konten Porno, Wanita Ini Ambil Foto Bugil Pengunjung Pemandian Umum · Siapa bilang film porno hanya menarik bagi para pria saja. Lifestyle. Konten ...",0,1
653,porno,PORN Definition & Meaning,https://www.merriam-webster.com/dictionary/porn,1 ... informal ... pornography ... watching porn ... often used before another noun ... a porn star ... the porn industry ... a porno theater ... 2 ... porno ... plural ... pornos ...,0,1
654,porno,Порно 365 - новое порно каждый день. Порнуха в HD.,http://porno365.plus/,Порно 365 - смотри сочное и новое порно видео каждый день в HD качестве! Мы отбираем для вась только лучшие ролики отборной порнухи.,0,1
655,porno,"Porno Terbaru - Berita, Foto, Video",https://www.fimela.com/tag/porno,"Diduga Jual Konten Porno, Wanita Ini Ambil Foto Bugil Pengunjung Pemandian Umum · Siapa bilang film porno hanya menarik bagi para pria saja. Lifestyle. Konten ...",0,1
656,porno,PORN Definition & Meaning,https://www.merriam-webster.com/dictionary/porn,1 ... informal ... pornography ... watching porn ... often used before another noun ... a porn star ... the porn industry ... a porno theater ... 2 ... porno ... plural ... pornos ...,0,1
657,porno,Порно 365 - новое порно каждый день. Порнуха в HD.,http://porno365.plus/,Порно 365 - смотри сочное и новое порно видео каждый день в HD качестве! Мы отбираем для вась только лучшие ролики отборной порнухи.,0,1
658,porno,Situs Terbaik untuk XXX Porno di tahun 2025 - XXX.xxx,https://www.xxx.xxx/id/,BERBAGAI JENIS XXX SITUS. Situs porno itu seperti pizza – ada jenis yang sesuai dengan selera masing-masing! Anda dapat mengelompokkannya berdasarkan apa yang ...,0,1
659,porno,Siskaeee Cs Jadi Tersangka Pembuatan Film Porno ...,https://www.youtube.com/watch?v=Fnn2N1hg9Hg,"Sahabat KompasTV Banjarmasin, jangan lupa like, comment, dan subscribe channel YouTube KompasTV Banjarmasin, juga aktifkan lonceng ...",0,1
660,porno,Berita dan Informasi Porno Terbaru Hari Ini,https://tirto.id/q/porno-jwy,"Jangan lewatkan informasi terbaru tentang Porno dengan mengunjungi laman Porno Tirto.id. Berita terkini, analisis, dan liputan dari sumber terpercaya.",0,1
661,porno,PORNO MAN MEETING HER FOR THE FIRST TIME,https://www.xvideos.com/video.ucoflhbd54f/porno_man_meeting_her_for_the_first_time,PORNO MAN MEETING HER FOR THE FIRST TIME 14 min720p. Queen Anita · Angel Peace · Black Long Cock · porn · porno · cumshot · black · fucking ...,0,1
662,porno,Berita Video Porno Terkini Dan Terbaru Hari Ini,https://www.okezone.com/tag/video-porno,"video porno. · Nusantara 8 December 2025 Viral Aktris Porno Inggris Bonnie Blue Ditangkap saat Produksi Film Asusila Bersama 18 WNA di Bali, Ini Kronologinya ...",0,1
