No,Keyword,Title,Link,Description,is_legal,is_ilegal
1,SLOT,RAJA99: Situs Slot Gacor Online Link Raja Maxwin Terbaru ...,https://www.rrcifitchburg.com/sober-living-houses,RAJA99 adalah situs slot gacor online resmi terpercaya yang menyediakan link raja maxwin terbaru malam hari ini dijamin gampang menang serta tersedia rtp ...,0,1
2,SLOT,SLOT777 Slot Gacor Link LOGIN Situs Gampang Menang ...,https://click2clinic.com/,"SLOT777 adalah platform slot gacor 777 terbaru yang mengundang Anda untuk menikmati permainan dari beragam provider terbaik (seperti Pragmatic, PG Soft, dan ...",0,1
3,SLOT,SUMO777 : Link Situs Slot Gacor Hari Ini Gampang ...,https://amosgateway.org/home/,SUMO777 adalah situs slot gacor hari ini di Indonesia karena setiap harinya membagikan scatter hitam kepada member baru gampang menang dengan deposit 10rb ...,0,1
4,SLOT,Ajo89 : Situs Slot Gacor Terbaru Hari Ini Punya Rtp Thebest,https://masaasianexpress.com/menu/,AJO89 adalah platform slot online resmi di Indonesia yang menawarkan pengalaman bermain slot gacor dengan sistem keamanan tinggi. Keunggulannya terletak pada ...,0,1
5,SLOT,NAGAHOKI88 : Link Situs Slot Gacor Hari Ini Slot88 Terbaru ...,https://www.southernshinedetail.com/exterior-detailing,"NAGAHOKI88 Sportsbook Gaming Platform Slot777 Terbaik menawarkan lebih banyak game, odds yang lebih tinggi, dan menyediakan pilihan yang lebih banyak untuk ...",0,1
6,SLOT,AYAMJP: Rekomendasi Link Situs Slot Gacor Terbaru Hari Ini ...,https://doktorpendidikan.fkip.unib.ac.id/,"Mulai dari slot klasik hingga slot modern dengan fitur free spin, scatter, dan jackpot maxwin, semuanya tersedia untuk memberikan peluang cuan maksimal.",0,1
7,SLOT,ORIENTAL66: Situs Slot Gacor Maxwin Hari Ini Link Slot88 ...,https://www.patagoniagrillhouston.com/menu/,ORIENTAL66 menawarkan link situs slot gacor hari ini gampang menang anti kalah terbaru 2026 dengan server besar SLOT777 online serta APK SLOT88 terpercaya.,0,1
8,SLOT,SLOT 4D | Link Situs Solusi Slot Gacor #1 Hari Ini Game ...,https://lpp.kemri.go.ke/,"LINK LOGIN SLOT. If something goes wrong with your order, you'll get a full refund. Here's what's eligible: Your order doesn't match the item description or ...",0,1
9,SLOT,WATITOTO: Link Situs Slot Gacor Online Resmi Terbaik Bet ...,https://ppid.sumbawakab.go.id/,WATITOTO menghadirkan link situs slot gacor online resmi terbaik yang memudahkan setiap player karena hanya dengan minimal deposit 10k serta slot bet 200 ...,0,1
10,SLOT,Slot Deposit 5000 Gacor: Main Pakai Pulsa Tanpa ...,https://www.medytox.com/page/coretox,"Slot deposit 5000 berarti Anda memulai sesi permainan dengan modal awal Rp 5.000 lewat kanal pembayaran mikro. Kanal populer meliputi QRIS, DANA, OVO, ...",0,1
11,SLOT,LINESLOT88 : Situs Slot88 Gacor Indonesia Resmi Rilis ...,https://buiqui.com/universities/,LINESLOT88 sebagai situs Slot88 gacor Indonesia resmi meluncurkan event Spin The Wheel Anti Zonk yang memberi peluang hadiah nyata di setiap putaran tanpa ...,0,1
12,SLOT,Slots online: Fruit Machines - Aplikasi di Google Play,https://play.google.com/store/apps/details?id=casino.slot.machines.slots.free&hl=id,"Slot online: Mesin Buah adalah permainan kasino gratis baru . Mainkan slot scatter gratis, nikmati sensasi mesin slot sungguhan dengan permainan simulator ...",0,1
13,SLOT,MADU303: Link Situs Slot Gacor Hari Ini Terbaru Gampang ...,https://sushi-rama.com/sushi-restaurants/sushi-rino/,"MADU303 bukan sekadar link slot online yang menjanjikan, kami adalah platform berlisensi resmi yang diakui lembaga perjudian internasional dan dijamin legal di ...",0,1
14,SLOT,LINK GACOR SLOT SERVER THAILAND HARI INI ...,https://jurnal.fk.untad.ac.id/,KMET168 adalah link slot gacor server Thailand hari ini dengan sistem stabil dan peluang Maxwin terbaru 2026 yang dirancang untuk memberikan pengalaman ...,0,1
15,SLOT,TOKYO77: Situs Slot Gacor SLOT777 Gampang Menang ...,https://www.starscafeaustin.com/menu,"TOKYO77 situs link slot777 gampang menang pilihan slot gacor viral hari ini, situs pola slot gacor online maxwin SLOT88 terbaru dengan jackpot terbesar.",0,1
16,SLOT,MURAHSLOT: Situs Link Slot Gacor Online Hari Ini Live ...,https://www.fujigrill3.com/sushi.html,MURAHSLOT dinobatkan sebagai situs link slot gacor online hari ini yang memberikan bocoran live rtp slot777 gampang menang maxwin dengan fitur paling update dan ...,0,1
17,SLOT,JAKARTASLOT88 | Paket Situs Toto Slot Gacor Mudah ...,https://www.chostay.com/ja/,Jakartaslot88 merupakan situs toto slot gacor mudah menang hari ini dengan paket proxy slot88 terlengkap sebagai mitra agen terpercaya judi online paling ...,0,1
18,SLOT,ROYAL22: Situs Slot Online Gacor Gampang Menang Link ...,https://dranilyadav.com/about-doctor/,"ROYAL22 adalah situs slot online gacor terpercaya dengan link Slot88 Royal yang stabil, menawarkan peluang menang tinggi, permainan seru, ...",0,1
19,SLOT,SLOT777 ❄️ Link Daftar Situs Slot Gacor 777 Online ...,https://jamesmazurdpm.com/salisbury-office/,SLOT777 merupakan salah satu rekomendasi slot gacor 777 online terbaik se Indonesia yang menghadirkan permainan judi slotgacor banjir maxwin ...,0,1
20,SLOT,NVMSLOT898 LINK SITUS SLOT ONLINE GACOR TERBUKTI ...,https://jurnal.feb.unila.ac.id/,NVMSLOT898 merupakan link situs slot online gacor yang sudah membuktikan permainannya gampang menang melalui pilihan terbaiknya dan menjadi rekomendasi ...,0,1
21,SLOT,HOKIWIN77: Daftar Situs Link Slot Gacor Maxwin Slot777 dan ...,https://www.officeloungeandliquorstore.com/menu,"Hokiwin77 hadir menawarkan situs link slot gacor maxwin gampang menang dengan koleksi permainan slot777 dan slot88 terbaru hari ini, buruan daftar dibantu ...",0,1
22,SLOT,ZEUS4D: Link Slot Gacor Gampang Menang Situs Slot777 ...,https://www.jbcruisincuisine.com/order,"ZEUS4D SLOT777 situs slot gacor link slot maxwin gampang menang viral terbaru, slot88 gacor hari ini dengan jackpot maksimal slot gacor 2025.",0,1
23,SLOT,MAXSLOT88: Link Core Situs Slot Online Gacor Hari Ini ...,https://www.newgoldenpacificholbrook.com/menu,"Maxslot88 adalah slot777 resmi sebagai situs slot gacor hari ini mudah maxwin dengan link agen slot88 terpercaya, memberikan pengalaman bermain yang aman dan ...",0,1
24,SLOT,Madrasah Jurnal,https://ejournal.unia.ac.id/,Madrasah Jurnal merupakan lembaga semi otonom yang dibentuk untuk menjadi Pusat Pengembangan Jurnal Ilmiah di Universitas Al-Amien Prenduan. Copyright © 2025 ...,0,1
25,SLOT,OLYMPUS88: Link Situs Slot Gacor Online SLOT88 On ...,https://www.riceboxkitchen.com/menu,"OLYMPUS88 menawarkan ratusan permainan situs link slot gacor gampang menang dari provider terbaik Pragmatic Play, PG Soft, Habanero, Slot88 Resmi, hingga Joker ...",0,1
26,SLOT,GACOR22: Situs Slot Gacor QRIS Gampang Menang Hari Ini ...,https://miranchitoct.net/mi-ranchito-menu/,GACOR22 adalah situs slot gacor deposit qris terbaru yang disediakan oleh provider slot88 online terpercaya gampang menang dijamin jackpot x500. ayo main di ...,0,1
27,SLOT,ZEUS007 # Situs Slot Gacor Hari Ini Link Slot777 Terbaik ...,https://www.sydneychamberopera.com/contact/,ZEUS007 adalah situs slot gacor hari ini link slot777 terbaik 2025 di Indonesia dengan pola rtp slot gacor winrate diatas 97% minimal deposit hanya 5k untuk ...,0,1
28,SLOT,SIP33 - Perputaran Situs Slot Online Maxwin Terpercaya ...,https://www.swrandalltoys.com/about-us/,Cuan banyak hanya di situs slot online maxwin terpercaya sip33 dengan permainan slot88 bagi pemain slot gacor hari ini di tahun 2026.,0,1
29,SLOT,JAWA88 ~ Link Situs Slot Gacor Resmi Slot777 & Apk Slot ...,https://www.pizzaordertakingjobs.com/available-positions.html,Jawa88 merupakan situs slot gacor resmi yang menyediakan berbagai macam permainan slot777 dan apk slot thailand yang bisa langsung dimainkan di perangkat ...,0,1
30,SLOT,E-Jurnal Universitas Buddhi Dharma,https://jurnal.buddhidharma.ac.id/,"Jurnal ini bertujuan untuk menyajikan penelitian-penelitian mutakhir yang mengkaji fenomena komunikasi dan ekspresi budaya melalui pendekatan tekstual, ...",0,1
31,SLOT,Pemeriksaan Stasiun Radio: Login,https://apstard.postel.go.id/,Aplikasi Pemeriksaan Stasiun Radio (APSTARD) merupakan salah satu inovasi yang dikembangkan oleh SDPPI Kominfo untuk melakukan monitoring serta pemeriksaan ...,0,1
32,SLOT,GARUDA303: Situs Judi Slot Gacor Online Slot88 Gampang ...,https://www.ginzabellevue.com/copy-of-menu,GARUDA303 Situs Slot Online Gacor Hari Ini dengan berbagai permainan Slot88 gampang menang maxwin hari ini dari berbagai provider terpercaya di Indonesia.,0,1
33,SLOT,Slot88ku: Link Bandar Slot88 Online Terpercaya & Situs ...,https://eva.istjm.edu.ec/,Slot88ku menurut slot88 merupakan login link bandar slot online terpercaya dan platform situs gacor yang resmi hari ini dengan rtp game slot gampang maxwin ...,0,1
34,SLOT,Rumah Jurnal Fanshur Institute,https://jurnal.fanshurinstitute.org/,"Jurnal Ilmu Sosial dan Humaniora bertujuan untuk menyebarluaskan pemikiran konseptual dan hasil penelitian yang telah dicapai. Editor in Chief. Sumardi Efendi, ...",0,1
35,SLOT,VIPBET88: Situs Judi Online Slot Gacor Hari Ini Link Resmi ...,https://sanlucastexmex.com/about/,VIPBET88 adalah situs judi online resmi yang gampang menang serta sebagai link slot gacor hari ini terbaik paling bisa di andalkan dan fair play.,0,1
36,SLOT,Slots - Classic Vegas Casino - Aplikasi di Google Play,https://play.google.com/store/apps/details?id=com.zentertain.classicvegasslots&hl=id,"Slots - Classic Vegas Casino menyediakan mesin slots online Vegas paling panas dan PERMAINAN SLOT BARU. Mulai dengan bonus selamat datang sebesar 1,000,000 KOIN ...",0,1
37,SLOT,Website Sedang Maintenance,https://bpkad.kotawaringinbaratkab.go.id/,"Layanan pada subdomain ini sedang dalam pemeliharaan. Silakan coba beberapa saat lagi. Jika Anda adalah pengelola server atau domain ini, silakan hubungi ...",0,1
38,SLOT,Online Slots & Games,https://vegas.williamhill.com/online-slots,"We offer a wide range of online slots, with huge jackpots, top-quality visuals, free spins, giant multipliers and much more!",0,1
39,SLOT,MadepKulon Universitas Hayam Wuruk Perbanas,https://madepkulon.perbanas.ac.id/,Diploma 3 Akuntansi Diploma 3 Perbankan Keuangan Sarjana Akuntansi Sarjana Manajemen Sarjana Ekonomi Syariah Magister Manajemen Sarjana Sistem Informasi ...,0,1
40,SLOT,Play Online Slots at 32Red,https://www.32red.com/casino/slots,Looking for the best online slots in the UK? Play at 32Red and enjoy top-rated casino slot games with jackpots & megaways. Enjoy £150 Welcome Bonus!,0,1
41,SLOT,TOKYO88: SLOT777 Link Situs Slot Gacor Slot88 ...,https://www.royalsportsbarga.com/shop,"TOKYO88 link slot gacor viral SLOT777 gampang menang maxwin terbaru, SLOT88 online apk situs slot gacor hari ini pecah x15000 terbukti winrate 95%.",0,1
42,SLOT,"Slot - Wikipedia bahasa Indonesia, ensiklopedia bebas",https://id.wikipedia.org/wiki/Slot,"Mesin slot, salah satu jenis mesin perjudian yang juga dikenal sebagai ""slot gacor""; Saldo untung, yang dalam bahasa Belanda disebut batig slot; Slot 1 dan Slot ...",0,1
43,SLOT,Fisip Umrah – Fisip Umrah,https://fisip.umrah.ac.id/,Selamat Datang di Fisip Umrah · Acara Terbaru · Alumni Berprestasi · Asosiasi Fakultas Ilmu Sosial dan Ilmu Politik.,0,1
44,SLOT,SLOT99BET: Link Situs Slot Gacor Hari ini Online Terbaru ...,https://www.figoitalian.com/menu,SLOT99BET ialah situs slot gacor hari ini terbaru dengan beragam pilihan game link slot online gampang jackpot terpercaya perkalian hingga x1000 maxwin.,0,1
45,SLOT,Unduh aplikasi perjudian untuk Android secara gratis,https://id.uptodown.com/android/gambling,Super Casino Slot Machines 777 adalah game kasino dan mesin slot yang memungkinkanmu mencoba berbagai mesin slot dengan beragam tema. ... 777 Slots - Free Vegas ...,0,1
46,SLOT,Play Slot Games Online,https://betway.com/g/en/casino/slots,"Play Slot Games Online. More than 400 Slot games to choose from including Starburst, Rainbow Riches and many more. Play online slots on Betway.",0,1
47,SLOT,CODESRIA – Council for the Development of Social Science ...,https://codesria.org/,The Council for the Development of Social Science Research in Africa (CODESRIA) is pleased to welcome you to the AFRIAK Induction Workshop for the 2025 ...,0,1
48,SLOT,Home | ALSF,https://www.alsf.int/,The life of ALSF · 10 Dec. The African Legal Support Facility Capacity Building Workshop Strengthens Public-Private Partnership (PPP) Development in the Kingdom ...,0,1
49,SLOT,MGM Slots Live - Vegas Casino - Aplikasi di Google Play,https://play.google.com/store/apps/details?id=com.playstudios.showstar&hl=id,"MGM Slots Live offers the most unique bonuses compared to other free online slots games. Play our casino games for free to collect daily bonuses, accumulate ...",0,1
50,SLOT,SLOT88: Situs Slot Gacor Gampang Menang Hari Ini & Link ...,https://www.silversandsnashville.com/menu,SLOT88 situs slot gacor gampang menang hari ini untuk semua para player yang baru saja join ke link slot88 online maxwin terbukti viral.,0,1
51,SLOT,CODESRIA – Council for the Development of Social Science ...,https://codesria.org/,The Council for the Development of Social Science Research in Africa (CODESRIA) is pleased to welcome you to the AFRIAK Induction Workshop for the 2025 ...,0,1
52,SLOT,SLOT88: Situs Slot Gacor Gampang Menang Hari Ini & Link ...,https://www.silversandsnashville.com/menu,SLOT88 situs slot gacor gampang menang hari ini untuk semua para player yang baru saja join ke link slot88 online maxwin terbukti viral.,0,1
53,SLOT,UF | EHS – Safety in the Workplace,https://www.ehs.ufl.edu/,Quick links to commonly requested EH&S services and resources. Visit each program's page for more information.,0,1
54,SLOT,umanis business school - UBS,https://foad.ubsburkina.education/,,0,1
55,SLOT,Slotomania™ Casino Slots Games - Aplikasi di Google Play,https://play.google.com/store/apps/details?id=air.com.playtika.slotomania&hl=id,"Slotomania adalah koleksi permainan kasino slot paling seru yang pernah ada. Permainan slot kasino Las Vegas hadir untukmu, dengan lebih dari 200+ mesin slot ...",0,1
56,SLOT,SICANA,https://sicana.kejaksaan.go.id/,Meningkatkan efektifitas perencanaan Kejaksaan Agung bagian Pengelolaan Data Biro Perencanaan.,0,1
57,SLOT,"19 New House ideas | home diy, diy home decor, rustic ...",https://www.pinterest.com/ssbicheno/new-house/,Alexistoto | Link Gacor Terpercaya Modal Kecil di Situs Slot Gacor · Pool Room Ideas · Laundry Room Paint Color ; Kosas Collections Kosas Home Myrna Square Bar ...,0,1
58,SLOT,Probolo: Balai Pengelolaan Sumber Daya Air,https://bpusdataru-probolo.jatengprov.go.id/,logo. 376 Days. 04 Hours. 59 Minutes. 55 Seconds.,0,1
59,SLOT,Shorehill Capital | Home,https://shorehillcapital.com/,Shorehill Capital is a Chicago-based private equity firm focused on partnering with entrepreneur- and family-owned companies in the lower middle market to ...,0,1
60,SLOT,88 Fortunes Casino Slot Games - Aplikasi di Google Play,https://play.google.com/store/apps/details?id=com.ballytechnologies.f88&hl=id,Spin these slot games for free and win every slot reward on the classic and new casino slots! Let the slots mania begin! Spin casino games free of charge and ...,0,1
61,SLOT,Slots™ - Aplikasi di Google Play,https://play.google.com/store/apps/details?id=com.sharkparty.slots&hl=id,"Permainan mesin slot terbaik tahun 2016! Bertaruh, Putar, dan Menang Besar dengan permainan slot kasino bergaya Vegas. Banyak kredit, koin, dan kesenangan!",0,1
62,SLOT,Aplikasi Android dari Slots Limited di ...,https://play.google.com/store/apps/dev?id=6730360297060261228&hl=id,"Putar game slot realistis & kasual, kemenangan jackpot online atau offline! Lainnya oleh Slots Limited. Gambar ikon Golden Casino: Slot Kasino 777. Golden ...",0,1
63,bandar slot terpercaya,Slot88ku: Link Bandar Slot88 Online Terpercaya & Situs ...,https://eva.istjm.edu.ec/,Slot88ku menurut slot88 merupakan login link bandar slot online terpercaya dan platform situs gacor yang resmi hari ini dengan rtp game slot gampang maxwin ...,0,1
64,bandar slot terpercaya,Link Resmi Slot Gacor Maxwin Terpercaya Slot88 Online Bet ...,https://ditsmp.dikdasmen.go.id/,HOKIJITU merupakan link slot gacor terpercaya hari ini sangat mudah menang dapat maxwin dengan slot88 online minimal bet 200 dengan lisensi resmi platform game ...,0,1
65,bandar slot terpercaya,Rekomendasi Link Situs slot Gacor Terpercaya Hari Ini & ...,https://sidbankumda.jabarprov.go.id/index.php/page,"Sebagai slot resmi dari bandar slot 888, TAWONBET menghadirkan pengalaman bermain slot gacor online yang stabil, aman, serta mudah diakses kapan saja. Melalui ...",0,1
66,bandar slot terpercaya,NVMSLOT898 LINK SITUS SLOT ONLINE GACOR TERBUKTI ...,https://jurnal.feb.unila.ac.id/,NVMSLOT898 merupakan link situs slot online gacor yang sudah membuktikan permainannya gampang menang melalui pilihan terbaiknya dan menjadi rekomendasi ...,0,1
67,bandar slot terpercaya,WATITOTO: Link Situs Slot Gacor Online Resmi Terbaik Bet ...,https://ppid.sumbawakab.go.id/,WATITOTO menghadirkan link situs slot gacor online resmi terbaik yang memudahkan setiap player karena hanya dengan minimal deposit 10k serta slot bet 200 ...,0,1
68,bandar slot terpercaya,RANS288 # Bandar Slot Server Thailand Bet 200 Resmi ...,https://ece.uksw.edu/,RANS288 Adalah salah satu platform bandar slot server thailand yang sudah menggunakan metode dengan minimal bet 200 rupiah dengan pengalaman bermain game ...,0,1
69,bandar slot terpercaya,OYO777: Link Game Situs Slot Online Gacor Terpercaya ...,https://dpmis.dost.gov.ph/,"OYO777 menyediakan link game untuk bermain situs slot online terpercaya dan resmi dari server slot thailand paling gacor hari ini, dan jelas unggulan RTP ...",0,1
70,bandar slot terpercaya,ZOROTOTO >> Situs Slot Gacor Toto 4D Online Bandar ...,https://e-sospol.jurnal.unej.ac.id/,ZOROTOTO menyediakan permainan situs slot gacor toto 4d online yang menyajikan beragam permainan milik bandar slot777 resmi dimana sudah terpercaya ...,0,1
71,bandar slot terpercaya,HUNTERTOTO | Link Daftar & Login Situs Bandar Slot Gacor ...,https://www.mentalthemotherload.com/films,"HUNTERTOTO berfungsi sebagai situs bandar slot gacor terpercaya 2026 yang menyediakan akses daftar dan login resmi, berbagai permainan slot online terbaik, ...",0,1
72,bandar slot terpercaya,Login Slot Togel BINJAITOTO Resmi Terpercaya No 1 ...,https://bibliotecamaxplanck.fi.unsj.edu.ar/,"BINJAITOTO adalah platform togel dan toto slot online terpercaya yang menyediakan permainan resmi dengan sistem keamanan tinggi, transaksi cepat, dan peluang ...",0,1
73,bandar slot terpercaya,SLOT123: Login Situs Resmi Slot Joker123 Gaming Populer ...,https://thesanctumcafe.com/catering/,SLOT123 merupakan situs judi online berlisensi resmi dengan permainan slot terpopuler hari ini dari provider joker123 gaming yang telah dikenal akan peluang ...,0,1
74,bandar slot terpercaya,MACANASIA88: Situs Resmi Raja Slot Gacor Asia Terpercaya ...,https://eatcompany.co/wildhabit/,MACANASIA88 adalah situs resmi raja slot gacor terpercaya rekomendasi malam ini yang telah dikenal mudah menang di seluruh Asia. Dengan fitur khusus Akun ...,0,1
75,bandar slot terpercaya,ZOROTOTO >> Situs Slot Gacor Toto 4D Online Bandar ...,https://e-sospol.jurnal.unej.ac.id/,ZOROTOTO menyediakan permainan situs slot gacor toto 4d online yang menyajikan beragam permainan milik bandar slot777 resmi dimana sudah terpercaya ...,0,1
76,bandar slot terpercaya,SEMUTWIN | Rekomendasi Tempat Bermain Game Online ...,https://www.gusleagues.com/soccer-home,"SEMUTWIN hadir sebagai lapak terpercaya AGEN SLOT ONLINE Pragmatic, dengan dukungan transaksi modern melalui deposit QRIS resmi. Sistem ...",0,1
77,bandar slot terpercaya,Login Slot Togel BINJAITOTO Resmi Terpercaya No 1 ...,https://bibliotecamaxplanck.fi.unsj.edu.ar/,"BINJAITOTO adalah platform togel dan toto slot online terpercaya yang menyediakan permainan resmi dengan sistem keamanan tinggi, transaksi cepat, dan peluang ...",0,1
78,bandar slot terpercaya,RAJATOTO4 > Situs Toto Slot Gacor 4D Anti Rumit Jamin JP ...,https://keas.uodiyala.edu.iq/,"RAJATOTO4 hadir sebagai situs Toto Slot Gacor 4D yang dirancang anti rumit untuk semua pemain. Dengan tampilan simple, akses cepat, dan menu yang jelas, siapa ...",0,1
79,bandar slot terpercaya,HUNTERTOTO | Link Daftar & Login Situs Bandar Slot Gacor ...,https://www.mentalthemotherload.com/films,"HUNTERTOTO berfungsi sebagai situs bandar slot gacor terpercaya 2026 yang menyediakan akses daftar dan login resmi, berbagai permainan slot online terbaik, ...",0,1
80,bandar slot terpercaya,Operator Situs Toto Terpercaya Serta Agen Slot Depo 10k ...,https://medwinpublishers.com/JENR/,Morfintoto adalah operator situs toto terpercaya serta agen slot minimal depo 10k dengan peluang hoki yang tinggi dan hadiah terbesar setiap hari.,0,1
81,bandar slot terpercaya,LINK GACOR SLOT88 SLOT PULSA TANPA POTONGAN ...,https://journal.poltekip.ac.id/,"Sebagai bandar situs slot gacor hari ini, SLOT 88 kasih akses ke server premium dengan RTP tinggi, ritme permainan yang mudah pecah, dan peluang maxwin yang ...",0,1
82,bandar slot terpercaya,DANALIGA: Situs Slot Gacor 777 Resmi Bandar ...,https://premieregypthotels.com/en/,DANALIGA adalah situs slot gacor 777 resmi dan bandar slot terpercaya yang menawarkan deposit Dana malam ini. Dapatkan pengalaman bermain terbaik dan raih ...,0,1
83,bandar slot terpercaya,DEWATOTO: Agen Slot Toto Gacor Hari Ini & Bandar Togel ...,http://icysmod.omicsbio.info/,Dewatoto merupakan sebuah agen slot toto gacor yang dapat dimainkan dengan minimal deposit hanya 10ribu dimana terdapat banyak jenis permainan yang asik dan ...,0,1
84,bandar slot terpercaya,JudolHoki88 : Agen Link Daftar Slot Maxwin Hari Ini Pasti ...,http://innateimmunity.mit.edu/,JudolHoki88 merupakan sebuah platform informasi yang menyajikan kumpulan link serta akses menuju berbagai layanan permainan daring yang banyak dicari oleh ...,0,1
85,bandar slot terpercaya,RAJATOGEL * Situs Slot Gacor Hari Ini Fitur RTP Maxwin ...,https://dinkes.okuselatankab.go.id/misi/,RAJATOGEL merupakan situs slot gacor terpercaya yang menyediakan fitur rtp slot maxwin terbaik dengan minimal bet 200 perak gampang konek perkalian besar.,0,1
86,bandar slot terpercaya,Situs Togel Resmi 2025 - OMTOGEL Link Slot 4D Online ...,https://www.handaragolfresort.com/wellness/,OMTOGEL membuka gerbang permainan akhir tahun 2025 ...,0,1
87,bandar slot terpercaya,BANDAR SLOT ✈️ Situs Gacor Pola777 Slot Depo 5K ...,https://app.ironclic.com/c/cubemed,Bandar slot depo 5k dari situs gacor terpercaya pola777 adalah satu-satunya yang selalu tebar bonus besar-besaran setiap hari nya dan menjadi bandar paling ...,0,1
88,bandar slot terpercaya,BANDARTOTO # Link Agen Situs Togel Slot Online & Situs ...,https://star.ff.uns.ac.rs/,BANDARTOTO adalah salah satu website game judi online yang tersebar di indonesia. Bukan hanya itu sebagai salah satu situs toto togel online dengan hadiah 4d ...,0,1
89,bandar slot terpercaya,SLOT88 : Resmi Situs Gacor Eksklusif Event Natal Mudah ...,https://opf.org.pk/membership/,Slot88 resmi merupakan situs gacor resmi yang menghadirkan event slot natal eksklusif dengan peluang menang lebih besar hari ini. Menyediakan permainan slot ...,0,1
90,bandar slot terpercaya,DANALIGA: Situs Slot Gacor 777 Resmi Bandar Slot ...,https://jihan.uniss.ac.id/,DANALIGA adalah situs slot gacor 777 resmi dan bandar slot terpercaya yang menawarkan deposit Dana malam ini. Dapatkan pengalaman bermain terbaik dan raih ...,0,1
91,bandar slot terpercaya,TOTO88 🚑 80 Pasaran FTV 4D Bandar Toto Togel Resmi ...,https://montlakefutures.com/products/landen-hatchet-and-jonah-coleman-signed-ball,TOTO88 telah menjadi pilihan utama bagi banyak pemain togel di Indonesia karena menyediakan layanan bandar toto togel dengan 80 pasaran 4D yang ...,0,1
92,bandar slot terpercaya,BUNCISTOTO 🔥 Situs Toto Slot Minimal Depo Qris 5k,https://pugseal.com/blog/,"BUNCISTOTO adalah platform game online resmi dengan menyediakan beragam game slot toto gacor dengan deposit minimal Rp 5.000 via QRIS super gacor, selain itu ...",0,1
93,bandar slot terpercaya,RAJATOGEL * Situs Slot Gacor Hari Ini Fitur RTP Maxwin ...,https://dinkes.okuselatankab.go.id/misi/,RAJATOGEL merupakan situs slot gacor terpercaya yang menyediakan fitur rtp slot maxwin terbaik dengan minimal bet 200 perak gampang konek perkalian besar.,0,1
94,bandar slot terpercaya,Situs Toto BOBATOTO : Link Toto Slot 4D Pasti Bayar & ...,https://bbksda-papuabarat.com/mengenal-konservasi/,BOBATOTO kini hadir sebagai salah satu link situs toto terbaik & terpercaya pertama yang menyediakan berbagai jenis layanan permainan dan provider toto slot ...,0,1
95,bandar slot terpercaya,OLXTOTO : Bandar Togel Online Terpercaya Dengan ...,https://www.crushwinefestival.com/team,"OLXTOTO adalah Bandar Togel Online terpercaya yang menyediakan pasaran Situs Toto Macau paling lengkap. Dengan fitur live result cepat, transaksi aman, serta ...",0,1
96,bandar slot terpercaya,Pusat Pengetahuan | Sistem Pangan Tangguh,https://translate.google.com/translate?u=https://www.resilientfoodsystems.co/kc&hl=id&sl=en&tl=id&client=srp,"Pusat Pengetahuan Sistem Pangan Tangguh berfungsi sebagai platform sentral untuk berbagi sumber daya dan informasi yang dihasilkan oleh 12 proyek negara dan ...Cukup depo 10K via QRIS, Anda sudah bisa bermain slot terpercaya dengan kesempatan jackpot dan maxwin setiap hari ... Link Situs SLOT123 Ways 2 AGEN SLOT Slot ...",0,1
97,bandar slot terpercaya,Slot Maxwin : Link Akses Cepat Situs Slot Gacor Terbaru ...,http://predictor.nchu.edu.tw/,Slot Maxwin merupakan platform hiburan slot online yang menyediakan akses cepat bagi pemain untuk menikmati berbagai pilihan game terbaru dengan tampilan modern ...,0,1
