title,link,snippet,position,rating,ratingCount
Slot88ku: Link Bandar Slot88 Online Terpercaya & Situs ...,https://eva.istjm.edu.ec/,Slot88ku menurut slot88 merupakan login link bandar slot online terpercaya dan platform situs gacor yang resmi hari ini dengan rtp game slot gampang maxwin ...,1,,
Link Resmi Slot Gacor Maxwin Terpercaya Slot88 Online Bet ...,https://ditsmp.dikdasmen.go.id/,HOKIJITU merupakan link slot gacor terpercaya hari ini sangat mudah menang dapat maxwin dengan slot88 online minimal bet 200 dengan lisensi resmi platform game ...,2,,
Rekomendasi Link Situs slot Gacor Terpercaya Hari Ini & ...,https://sidbankumda.jabarprov.go.id/index.php/page,"Sebagai slot resmi dari bandar slot 888, TAWONBET menghadirkan pengalaman bermain slot gacor online yang stabil, aman, serta mudah diakses kapan saja. Melalui ...",3,,
NVMSLOT898 LINK SITUS SLOT ONLINE GACOR TERBUKTI ...,https://jurnal.feb.unila.ac.id/,NVMSLOT898 merupakan link situs slot online gacor yang sudah membuktikan permainannya gampang menang melalui pilihan terbaiknya dan menjadi rekomendasi ...,4,,
WATITOTO: Link Situs Slot Gacor Online Resmi Terbaik Bet ...,https://ppid.sumbawakab.go.id/,WATITOTO menghadirkan link situs slot gacor online resmi terbaik yang memudahkan setiap player karena hanya dengan minimal deposit 10k serta slot bet 200 ...,5,,
RANS288 # Bandar Slot Server Thailand Bet 200 Resmi ...,https://ece.uksw.edu/,RANS288 Adalah salah satu platform bandar slot server thailand yang sudah menggunakan metode dengan minimal bet 200 rupiah dengan pengalaman bermain game ...,6,,
OYO777: Link Game Situs Slot Online Gacor Terpercaya ...,https://dpmis.dost.gov.ph/,"OYO777 menyediakan link game untuk bermain situs slot online terpercaya dan resmi dari server slot thailand paling gacor hari ini, dan jelas unggulan RTP ...",7,,
ZOROTOTO >> Situs Slot Gacor Toto 4D Online Bandar ...,https://e-sospol.jurnal.unej.ac.id/,ZOROTOTO menyediakan permainan situs slot gacor toto 4d online yang menyajikan beragam permainan milik bandar slot777 resmi dimana sudah terpercaya ...,8,,
HUNTERTOTO | Link Daftar & Login Situs Bandar Slot Gacor ...,https://www.mentalthemotherload.com/films,"HUNTERTOTO berfungsi sebagai situs bandar slot gacor terpercaya 2026 yang menyediakan akses daftar dan login resmi, berbagai permainan slot online terbaik, ...",9,4.9,62595
Login Slot Togel BINJAITOTO Resmi Terpercaya No 1 ...,https://bibliotecamaxplanck.fi.unsj.edu.ar/,"BINJAITOTO adalah platform togel dan toto slot online terpercaya yang menyediakan permainan resmi dengan sistem keamanan tinggi, transaksi cepat, dan peluang ...",10,,
SLOT123: Login Situs Resmi Slot Joker123 Gaming Populer ...,https://thesanctumcafe.com/catering/,SLOT123 merupakan situs judi online berlisensi resmi dengan permainan slot terpopuler hari ini dari provider joker123 gaming yang telah dikenal akan peluang ...,1,,
MACANASIA88: Situs Resmi Raja Slot Gacor Asia Terpercaya ...,https://eatcompany.co/wildhabit/,MACANASIA88 adalah situs resmi raja slot gacor terpercaya rekomendasi malam ini yang telah dikenal mudah menang di seluruh Asia. Dengan fitur khusus Akun ...,2,5,14282456
ZOROTOTO >> Situs Slot Gacor Toto 4D Online Bandar ...,https://e-sospol.jurnal.unej.ac.id/,ZOROTOTO menyediakan permainan situs slot gacor toto 4d online yang menyajikan beragam permainan milik bandar slot777 resmi dimana sudah terpercaya ...,3,,
SEMUTWIN | Rekomendasi Tempat Bermain Game Online ...,https://www.gusleagues.com/soccer-home,"SEMUTWIN hadir sebagai lapak terpercaya AGEN SLOT ONLINE Pragmatic, dengan dukungan transaksi modern melalui deposit QRIS resmi. Sistem ...",4,,
Login Slot Togel BINJAITOTO Resmi Terpercaya No 1 ...,https://bibliotecamaxplanck.fi.unsj.edu.ar/,"BINJAITOTO adalah platform togel dan toto slot online terpercaya yang menyediakan permainan resmi dengan sistem keamanan tinggi, transaksi cepat, dan peluang ...",5,,
RAJATOTO4 > Situs Toto Slot Gacor 4D Anti Rumit Jamin JP ...,https://keas.uodiyala.edu.iq/,"RAJATOTO4 hadir sebagai situs Toto Slot Gacor 4D yang dirancang anti rumit untuk semua pemain. Dengan tampilan simple, akses cepat, dan menu yang jelas, siapa ...",6,,
HUNTERTOTO | Link Daftar & Login Situs Bandar Slot Gacor ...,https://www.mentalthemotherload.com/films,"HUNTERTOTO berfungsi sebagai situs bandar slot gacor terpercaya 2026 yang menyediakan akses daftar dan login resmi, berbagai permainan slot online terbaik, ...",7,4.9,62595
Operator Situs Toto Terpercaya Serta Agen Slot Depo 10k ...,https://medwinpublishers.com/JENR/,Morfintoto adalah operator situs toto terpercaya serta agen slot minimal depo 10k dengan peluang hoki yang tinggi dan hadiah terbesar setiap hari.,8,,
LINK GACOR SLOT88 SLOT PULSA TANPA POTONGAN ...,https://journal.poltekip.ac.id/,"Sebagai bandar situs slot gacor hari ini, SLOT 88 kasih akses ke server premium dengan RTP tinggi, ritme permainan yang mudah pecah, dan peluang maxwin yang ...",9,,
DANALIGA: Situs Slot Gacor 777 Resmi Bandar ...,https://premieregypthotels.com/en/,DANALIGA adalah situs slot gacor 777 resmi dan bandar slot terpercaya yang menawarkan deposit Dana malam ini. Dapatkan pengalaman bermain terbaik dan raih ...,10,4.7,18548
DEWATOTO: Agen Slot Toto Gacor Hari Ini & Bandar Togel ...,http://icysmod.omicsbio.info/,Dewatoto merupakan sebuah agen slot toto gacor yang dapat dimainkan dengan minimal deposit hanya 10ribu dimana terdapat banyak jenis permainan yang asik dan ...,1,,
JudolHoki88 : Agen Link Daftar Slot Maxwin Hari Ini Pasti ...,http://innateimmunity.mit.edu/,JudolHoki88 merupakan sebuah platform informasi yang menyajikan kumpulan link serta akses menuju berbagai layanan permainan daring yang banyak dicari oleh ...,2,,
RAJATOGEL * Situs Slot Gacor Hari Ini Fitur RTP Maxwin ...,https://dinkes.okuselatankab.go.id/misi/,RAJATOGEL merupakan situs slot gacor terpercaya yang menyediakan fitur rtp slot maxwin terbaik dengan minimal bet 200 perak gampang konek perkalian besar.,3,,
Situs Togel Resmi 2025 - OMTOGEL Link Slot 4D Online ...,https://www.handaragolfresort.com/wellness/,OMTOGEL membuka gerbang permainan akhir tahun 2025 ...,4,,
BANDAR SLOT ✈️ Situs Gacor Pola777 Slot Depo 5K ...,https://app.ironclic.com/c/cubemed,Bandar slot depo 5k dari situs gacor terpercaya pola777 adalah satu-satunya yang selalu tebar bonus besar-besaran setiap hari nya dan menjadi bandar paling ...,5,,
BANDARTOTO # Link Agen Situs Togel Slot Online & Situs ...,https://star.ff.uns.ac.rs/,BANDARTOTO adalah salah satu website game judi online yang tersebar di indonesia. Bukan hanya itu sebagai salah satu situs toto togel online dengan hadiah 4d ...,6,,
SLOT88 : Resmi Situs Gacor Eksklusif Event Natal Mudah ...,https://opf.org.pk/membership/,Slot88 resmi merupakan situs gacor resmi yang menghadirkan event slot natal eksklusif dengan peluang menang lebih besar hari ini. Menyediakan permainan slot ...,7,,
DANALIGA: Situs Slot Gacor 777 Resmi Bandar Slot ...,https://jihan.uniss.ac.id/,DANALIGA adalah situs slot gacor 777 resmi dan bandar slot terpercaya yang menawarkan deposit Dana malam ini. Dapatkan pengalaman bermain terbaik dan raih ...,8,,
TOTO88 🚑 80 Pasaran FTV 4D Bandar Toto Togel Resmi ...,https://montlakefutures.com/products/landen-hatchet-and-jonah-coleman-signed-ball,TOTO88 telah menjadi pilihan utama bagi banyak pemain togel di Indonesia karena menyediakan layanan bandar toto togel dengan 80 pasaran 4D yang ...,9,,
BUNCISTOTO 🔥 Situs Toto Slot Minimal Depo Qris 5k,https://pugseal.com/blog/,"BUNCISTOTO adalah platform game online resmi dengan menyediakan beragam game slot toto gacor dengan deposit minimal Rp 5.000 via QRIS super gacor, selain itu ...",10,,
RAJATOGEL * Situs Slot Gacor Hari Ini Fitur RTP Maxwin ...,https://dinkes.okuselatankab.go.id/misi/,RAJATOGEL merupakan situs slot gacor terpercaya yang menyediakan fitur rtp slot maxwin terbaik dengan minimal bet 200 perak gampang konek perkalian besar.,1,,
Situs Toto BOBATOTO : Link Toto Slot 4D Pasti Bayar & ...,https://bbksda-papuabarat.com/mengenal-konservasi/,BOBATOTO kini hadir sebagai salah satu link situs toto terbaik & terpercaya pertama yang menyediakan berbagai jenis layanan permainan dan provider toto slot ...,2,,
OLXTOTO : Bandar Togel Online Terpercaya Dengan ...,https://www.crushwinefestival.com/team,"OLXTOTO adalah Bandar Togel Online terpercaya yang menyediakan pasaran Situs Toto Macau paling lengkap. Dengan fitur live result cepat, transaksi aman, serta ...",3,4.9,62595
Pusat Pengetahuan | Sistem Pangan Tangguh,https://translate.google.com/translate?u=https://www.resilientfoodsystems.co/kc&hl=id&sl=en&tl=id&client=srp,"Pusat Pengetahuan Sistem Pangan Tangguh berfungsi sebagai platform sentral untuk berbagi sumber daya dan informasi yang dihasilkan oleh 12 proyek negara dan ...Cukup depo 10K via QRIS, Anda sudah bisa bermain slot terpercaya dengan kesempatan jackpot dan maxwin setiap hari ... Link Situs SLOT123 Ways 2 AGEN SLOT Slot ...",4,,
Slot Maxwin : Link Akses Cepat Situs Slot Gacor Terbaru ...,http://predictor.nchu.edu.tw/,Slot Maxwin merupakan platform hiburan slot online yang menyediakan akses cepat bagi pemain untuk menikmati berbagai pilihan game terbaru dengan tampilan modern ...,5,,
ALEXISTOGEL ⚡️ Situs Toto Macau Togel 4D Online ...,https://worldplayerscare.co/local-support,"ALEXISTOGEL menghadirkan layanan Toto Macau togel 4D online update 2025 dengan sistem stabil, transparan, dan mudah diakses kapan saja. SITUS SLOT; SLOT ONLINE ...",6,,
Madrasah Jurnal,https://ejournal.unia.ac.id/,... agen slot gacor terpercaya anti rungkadtransaksi cepat aman lewat agen slotagen slot online terpercaya winrate tinggiagen slot resmi paling ramai pemain.,7,,
NIASTOTO ⚡️ Situs Judi Toto Slot Gacor Hari Ini 88 & ...,https://old.summaedu.org/todos-los-articulos/,NIASTOTO merupakan situs judi toto slot gacor hari ini dan bandar toto togel HK online 4D Macau terpercaya nomor #1 di Indonesia. Kami menghadirkan ribuan ...,8,,
Situs From Indonesia Bandar Togel Terbaik Fitur Toto Slot ...,https://www.paesanoscafe.net/gallery.htm,"JUTAWANBET Situs Togel dan Slot Online resmi di Indonesia. Nikmati permainan 4D yang adil, layanan 24/7, dan peluang Jackpot tertinggi di tahun 2025.",9,,
Mawartoto - Situs Toto Togel Trusted #1 & Bandar Togel ...,https://www.implementnutrition.org/sisnframeworkwebinar/,"Mawartoto merupakan situs toto togel & bandar togel online terpercaya dan populer Nomor 1 di Indonesia, dengan pasaran togel paling lengkap & hadiah terbesar.",10,,
E-Jurnal Universitas Buddhi Dharma,https://jurnal.buddhidharma.ac.id/,"Jurnal Bhumantara merupakan wadah akademik yang berfokus pada kajian multidisipliner dalam bidang ilmu komunikasi, sastra, linguistik, dan budaya.",1,,
Grav: Home,https://ppid.cirebonkab.go.id/,"Grav is an easy to use, yet powerful, open source flat-file CMS.",2,,
Fisip Umrah – Fisip Umrah,https://fisip.umrah.ac.id/,"Belajar di FISIP UMRAH bukan hanya soal teori politik, pemerintahan, dan sosial, tetapi juga tentang bagaimana kita bisa menjadi agen perubahan bagi masyarakat.",3,,
MadepKulon Universitas Hayam Wuruk Perbanas,https://madepkulon.perbanas.ac.id/,Masa Depan Kuliah Online UHW Perbanas.,4,,
Nordgold • Nordgold,https://translate.google.com/translate?u=https://nordgold.com/&hl=id&sl=en&tl=id&client=srp,"Nordgold adalah produsen emas satu juta ons yang terdiversifikasi secara internasional dengan sekitar 8.000 orang yang mengoperasikan portofolio delapan ...Nordgold is an internationally diversified one million ounce gold producer with about 8000 people operating a portfolio of eight mines (in Russia, ...",5,,
Majelis Nasional Badan Kesenian Negara - Beranda,https://translate.google.com/translate?u=https://nasaa-arts.org/&hl=id&sl=en&tl=id&client=srp,"NASAA dan badan seni negara bagian memajukan seni untuk kesejahteraan dan kemakmuran individu, komunitas, dan keluarga di negara kita.NASAA and the state arts agencies advance the arts for the well-being and prosperity of our nation's individuals, communities and families.",6,,
CODESRIA – Council for the Development of Social Science ...,https://codesria.org/,The Council for the Development of Social Science Research in Africa (CODESRIA) is pleased to welcome you to the AFRIAK Induction Workshop for the 2025 ...,7,,
Cbart: Kunstnerartikler - Alt i kunstnerartikler i højeste kvalitet,https://www.cbart.dk/,"Gode kunstnerartikler til gode priser. Så besøg Cbart.dk eller vores butik i Karlslunde og se vores store udvalg af bl.a. akrylmaling, oliemaling, akvarel, ...",8,,
Laboratorio di Informatica Musicale (LIM),https://www.lim.di.unimi.it/,"Official website of the Laboratorio di Informatica Musicale (Laboratory of Music Informatics, LIM), focusing on sound and music computing and music ...",9,,
