title,link,snippet,position,rating,ratingCount
Demo Gacor Pragmatic Play x10000 Dan Ahli Pg Soft Auto ...,https://www.bigbangburger.com/bigbang-burger-menu,Pemain disarankan untuk memanfaatkan fitur ini dalam mode demo dengan modal gratis terlebih dahulu. Tujuannya adalah untuk mengidentifikasi pola RTP (Return to ...,1,,
"Slot Demo Terlengkap PG Soft, Pragmatic Play Akun ...",https://www.kellys-landing.com/menu/,Tersedia slot demo paket lengkap dari PG Soft dan Pragmatic Play memberikan akun gacor untuk demo super scatter terbaru di tahun ini.,2,,
Mahjong Slot 🀄️ Daftar Situs Slot Gacor Mahjong ways 2 ...,https://online.pgcollegekawardha.edu.in/admissionindex.aspx,"PG Soft sebagai situs penyedia permainan Mahjong Slot menawarkan akses ke fitur slot Scatter Hitam dengan jaminan JP maxwin, sehingga setiap pemain memiliki ...",3,5,7174
Ekspansi Global Pgsoft Dan Dampaknya Bagi Pemain,https://repository.uinjkt.ac.id/dspace/bitstream/123456789/67674/10/ekspansi-global-pgsoft-dan-dampaknya-bagi-pemain.html,PG Soft memiliki strategi ekspansi yang ambisius untuk menjangkau pasar global. Langkah pertama dalam proses ini adalah menjalin kemitraan dengan penyedia ...,4,5,889
DEPOBOS: Akses Resmi Slot Online Gacor Pg Soft Link ...,https://www.rakerda.pta-jambi.go.id/,"Main di DEPOBOS, akses resmi slot online gacor dengan provider terbaik pg soft yang siap memberikan kenyamanan dengan link slot777 yang memiliki rtp tinggi ...",5,,
PG SOFT,https://www.youtube.com/channel/UCPUyzKpGbihVRuNqLEiiF0A,"Pocket Games Soft is a world-class mobile games company. We pride ourselves to deliver immersive gaming solutions on iOS, Android, and HTML5 platforms.",6,,
Demo Slot Gratis Akun Demo Pragmatic Dan PG Soft X1000 ...,http://phrimukomuko.org/,Mainkan demo slot gratis pakai akun demo pragmatic dan pg soft x1000 tanpa daftar dan tanpa deposit. Nikmati berbagai jenis permainan demo pg soft dan ...,7,,
TOKYO88 : Link Slot Depo 5K PG Soft Slot Gacor Pakai ...,https://www.129centercut.biz/menu,TOKYO88 menyediakan link slot resmi depo 5K melalui aplikasi QRIS. Mainkan game provider PG Soft lebih mudah dengan minimal deposit 5000 rasakan kegacoran ...,8,,
Bongkar Trik Pola Pg Soft Mudah Modal Dikit Bisa Jadi ...,http://repo.unand.ac.id/5516/23/bongkar-trik-pola-pg-soft-mudah-modal-dikit-bisa-jadi-sultan-panduan-cekatan-2025.html,PG Soft atau Pocket Games Soft adalah salah satu pengembang perangkat lunak game terkemuka yang didirikan pada tahun 2015. Mereka terkenal dengan inovasi dan ...,9,5,889
Perbedaan yang Membuat Perbedaan,https://www.pgsoft.com/id/,PG SOFT adalah perusahaan permainan seluler digital kelas dunia. Pocket Games Software menyediakan solusi permainan berdasarkan permintaan pada platform iOS ...,10,,
SLOT4D 🎮 Kumpulan Game Slot 4D Pragmatic dan PG ...,https://www.baltimorevalley.ca/warranty/,SLOT4D jadi situsnya para pecinta slot gacor. Nikmati kumpulan game slot 4D slot online dari provider ternama seperti Pragmatic Play dan PG Soft dalam satu ...,1,4.1,91
Perbedaan yang Membuat Perbedaan,https://www.pgsoft.com/id/,PG SOFT adalah perusahaan permainan seluler digital kelas dunia. Pocket Games Software menyediakan solusi permainan berdasarkan permintaan pada platform iOS ...,2,,
Beli Pg Soft Logo Online Harga Terbaik,https://www.lazada.co.id/tag/pg-soft-logo/,Kaos PG SOFT WILD BANDITO Basic Cotton Combeds Premium Quality BISA COD TERMURAH!!!!! Rp55.000. Kab. Purbalingga · Cutting Sticker LOGO PG KEREN Stiker ...,3,4.8,3160
Cara Rahasia Bermain Pg Soft Modal Rendah Jadi Cuan ...,https://repository.uinjkt.ac.id/dspace/bitstream/123456789/51118/6/cara-rahasia-bermain-pg-soft-modal-rendah-jadi-cuan-sultan-besar-untuk-semua-usia.html,"PG Soft, atau Pocket Games Soft, adalah pengembang permainan slot online yang didirikan pada tahun 2015. Dengan kantor pusat di Malta dan tim pengembang global, ...",4,5,889
SLOT777 | Situs Link Pg Soft Mahjong Slot Gacor 777 Resmi ...,https://biologi.fkip.unila.ac.id/,SLOT777 adalah situs link resmi PG Soft Mahjong Slot Gacor 777 yang hadir sebagai pilihan terbaik bagi para pecinta slot online yang ingin meraih maxwin ...,5,,
PG Soft (@PGSoftX),https://www.facebook.com/PGSoftX/,"Pocket Games Soft is a world-class mobile games company. We pride ourselves to deliver immersive gaming solutions on iOS, Android, and HTML5 platforms.",6,,
Situs Gacor Mahjong Ways 2 Banyak Scatter Mudah Menang ...,https://jsums.net/admissions/,RAJAMAHJONG menyuguhkan situs mahjong slot gacor yang bertemakan seperti game klasik mahjong ways 2 dengan fitur bonus favorit gampang menang scatter hitam ...,7,5,237865
Mahjong Ways 2 PG Soft Gratis & Pragmatic Play ...,https://mpcnyc.org/contact,Demo Mahjong Ways 2 Resmi Dari PG Soft Asli Gacor Scatter Turun Terus. - Radit. Awalnya Coba-coba Main Demo Gratis PG Soft Mahjong Ways 2 Dan Mahjong Wins 3 ...,8,5,18838
PG Soft Merilis Alat Verifikasi Game untuk Memastikan ...,https://translate.google.com/translate?u=https://igamingfuture.com/pg-soft-releases-games-verification-tool-to-ensure-authentic-player-experiences/&hl=id&sl=en&tl=id&client=srp,"Alat verifikasi PG Soft intuitif dan tersedia melalui lobi kasino. Pemain hanya perlu mengeklik tombol ""Terima"" untuk memverifikasi ID Transaksi ...This robust system has been designed to enable players to quickly verify the authenticity of any PG Soft title to confirm they are playing the genuine, ...",9,,
POPOTOGEL: Link Toto Slot Pragmatic Play Gacor & PG ...,https://squarerootlife.com/blogs/news/a-detailed-comparison-between-the-paleo-and-gluten-free-diet?srsltid=AfmBOoq6gYkON2TRgJvmgM0UfSCYAQ_vqVMjOFa-KM9bOQeNbPwL6O0R,"POPOTOGEL dikenal sebagai salah satu situs slot depo 5k yang menghadirkan berbagai permainan dari banyak pengembang populer, termasuk nama besar seperti ...",10,,
POPOTOGEL: Link Toto Slot Pragmatic Play Gacor & PG ...,https://squarerootlife.com/blogs/news/a-detailed-comparison-between-the-paleo-and-gluten-free-diet?srsltid=AfmBOopImknaXtfyO7hd7J5GrkRuNBv4XYxR-jXS3jsUXPjBGjDH4wrg,"POPOTOGEL dikenal sebagai salah satu situs slot depo 5k yang menghadirkan berbagai permainan dari banyak pengembang populer, termasuk nama besar seperti ...",1,,
pg soft เครดิตฟรี50  สล็อตเว็บตรง ค่ายใหญ่ APIแท้ เว็บสล็อตมาแรง ...,https://kbj.kasbit.edu.pk/,รวมค่าย สล็อต ฝาก10รับ100 สนุกได้ไม่มีเบื่อ! ระบบเสถียรและปลอดภัย! เล่น PG สล็อตโดยไม่ต้องกังวลเรื่องขั้นต่ำในการฝาก-ถอน เงินทุนเยอะหรือน้อยก็สามารถร่วมสนุกได้! ทุกการหมุนมีโอกาสชนะรางวัลใหญ่!,2,,
PG SLOT : Vote Game PG - Aplikasi di Google Play,https://play.google.com/store/apps/details?id=com.lenney.pgslotvotegame&hl=id,PGSLOT VOTE GAME adalah aplikasi yang dirancang untuk membantu semua pengguna memberikan suara pada permainan yang mereka mainkan dan coba.,3,4.3,9150
Bongkar Trik Pola Pg Soft Mudah Modal Dikit Bisa Jadi ...,http://repo.unand.ac.id/5516/23/bongkar-trik-pola-pg-soft-mudah-modal-dikit-bisa-jadi-sultan-panduan-cekatan-2025.html,PG Soft atau Pocket Games Soft adalah salah satu pengembang perangkat lunak game terkemuka yang didirikan pada tahun 2015. Mereka terkenal dengan inovasi dan ...,4,5,889
"Kementerian Pendidikan, Kebudayaan, Riset, dan Teknologi",https://www.kemendikbudristek.com/,Layanan · Informasi Merdeka Belajar · Akun Belajar Sekolah Daring · Merdeka Mengajar · Rapor Pendidikan · ARKAS · Merdeka dari Kekerasan · Banper Binsuslat · Sekolah ...,5,,
Mainkan Slot Online PG Soft | Slot Seluler Uang Asli,https://translate.google.com/translate?u=https://mrq.com/providers/pocket-games-soft/all&hl=id&sl=en&tl=id&client=srp,"Anda dapat memainkan semua permainan terbaik dari PG Soft, termasuk Rooster Rumble, Fortune Tiger, dan Candy Bonanza, sekarang di MrQ. Daftar hari ini dan ...Oops! Something went wrong.",6,,
Link Daftar Resmi Slot Mahjong Ways PG Soft Mudah ...,https://bellalunanail.com/our-services/,Mahjong Ways merupakan sebuah platform gacor mahjong slot terpopuler yang memberikan fitur scatter hitam resmi dari PG Soft yang memberikan peluang menang ...,7,,
PG Soft Rilis Alat Verifikasi Game untuk Memastikan ...,"https://translate.google.com/translate?u=https://news.cision.com/igaming-news/r/pg-soft-releases-games-verification-tool-to-ensure-authentic-player-experiences,c4040565&hl=id&sl=en&tl=id&client=srp","Alat verifikasi PG Soft intuitif dan tersedia melalui lobi kasino. Pemain hanya perlu mengeklik tombol ""Terima"" untuk memverifikasi ID Transaksi ...This robust system has been designed to enable players to quickly verify the authenticity of any PG Soft title to confirm they are playing the genuine, ...",8,,
PG Soft | Jakarta,https://www.facebook.com/61576209766475/,"PG Soft (Pocket Games Soft) is a game developer that makes high-quality mobile online games. Founded in 2015, it's known for great graphics, and engaging ...",9,,
PG Soft Demo Slots ᐈ Play PG Soft Games Online In 2025,https://slotcatalog.com/en/soft/PG-Soft,Check out PG Soft's newest and best free slots in 2025! Our extensive list of 140+ exciting games available at 30+ top casinos.,10,,
Unduh PG SOFT SLOT di PC,https://www.gameloop.com/id/game/simulation/pg-soft-play-on-pc,"1. Download GameLoop dari situs resminya, lalu jalankan file exe untuk menginstal GameLoop. Buka GameLoop dan cari “PG SOFT SLOT”, temukan PG SOFT SLOT ...",1,,
Play Free PGSoft Slots Online,https://clashofslots.com/slots/pgsoft/,"PG Soft has a range of slots that cater to different tastes and preferences, from classic fruit machines to immersive adventures with engaging plots.",2,,
Aplikasi Android dari PG soft di Google Play,https://play.google.com/store/apps/dev?id=6884312093007475097&hl=id,Aplikasi Android dari PG soft di Google Play. Game · Aplikasi.,3,,
PG Soft Slots: Play 161 Free Demo Games!,https://www.livebet.com/casino/slots/pg-soft,Some of the most popular PG Soft Slots demos on LiveBet. Click any game to start the free demo in your browser. Play Demo. Garuda Gems Slot Demo.,4,,
PG Soft - 365RAJA,https://www.clairebretecher.com/id/slots/pgsoft-slot,Temukan slot mobile terbaik dari PG Soft di 365RAJA dengan grafis modern dan gameplay inovatif. Mainkan sekarang untuk pengalaman bermain yang memukau!,5,,
"PG Soft Slots - Play for Free, Casino Lists & Bonuses",https://www.slotstemple.com/free-slots/pg-soft/,PG Soft demo slot games designed to be enjoyed on super-sharp screens with headphones on. High on entertainment value and replayability.,6,,
Unduh PG SOFT SLOT 1.1 APK untuk Android,https://apkpure.net/id/slot-demo-pg-soft/pg.soft.play/download,"Unduh versi terbaru dari PG SOFT SLOT (1.1) APK untuk Android. Mainkan sekarang slot yang mudah menang, gratis,dan seru dimanapun dan kapanpun.",7,,
Pusat Pengurangan Bencana Asia (ADRC),https://translate.google.com/translate?u=https://www.adrc.asia/&hl=id&sl=en&tl=id&client=srp,Kami mempromosikan pembangunan jaringan multilateral untuk meningkatkan kapasitas pengurangan risiko bencana (DRR) termasuk peningkatan pertukaran personel ...We are promoting multilateral network building for improving disaster risk reduction (DRR) capacity including enhancement of DRR-related personnel exchanges ...,8,,
PG Pocket Game Soft APK (Android App) - Unduh Gratis,https://apkcombo.com/id/pg-pocket-game-soft/com.pgpocketgames.mobile/,ยินดีต้อนรับสู่ PG Pocket Game Slot แอพออนไลน์ ที่สามารถเล่นได้ง่ายๆบนมือถือและยังติดตั้งฟรี สมัครเลยวันนี้รับสิทธิพิเศษมากมาย. Baca selengkapnya.,9,,
PG SOFT SLOT APK untuk Unduhan Android,https://apkpure.com/id/slot-demo-pg-soft/pg.soft.play,"Main dan Spin game demo PG SOFT SLOT mudah menang secara gratis. Tersedia Mahjong Ways 2, Caishen Wins, Lucky Neko, Treasure of Aztec dan Candy ...",10,,
login,https://www.pgsoft.com/en/math/login/,"PG SOFT, also known as Pocket Games Soft, is a brand that was founded in 2015 and has since become a well-established and reputable name in the online ...",1,,
slot pg soft gacor,https://cafe.fapes.es.gov.br/game/202510/slot%20pg%20soft%20gacor,Tidak ada informasi mengenai halaman ini.,2,,
Selamat datang,https://translate.google.com/translate?u=https://www.hobby-electronics.info/en/&hl=id&sl=en&tl=id&client=srp,Selamat Datang di. www.hobby-electronics.info. Situs informasi untuk hobi elektronika Anda. Pembaruan terakhir: 29 Desember 2021.Oops! Something went wrong.,3,,
PG SOFT,https://www.facebook.com/agenpgsoft/,PG SOFT. 274 likes · 1 talking about this. Daftar Situs Judi Slot Online Asia MPO Agen PG Soft Terbaik di Indonesia Aman & Terpercaya. Menerima.,4,,
PG Document Download,https://www.pgsoft.com/download//,Game Marketing. Company Logotype. Video Slot. Table Game. Game Language : All Languages. All Languages. English. Chinese Simplified.,5,,
pg soft slots - SEPLAG - AC.GOV,https://drive.seplag.ac.gov.br/androidgames/pg-soft-slots/,Tidak ada informasi mengenai halaman ini.,6,,
Permainan PG | Pocket Games Soft | Perbedaan yang ...,https://www.pgsoft.com/id/games/home/,Pusat Permainan PG adalah tempat di mana Anda bisa menemukan aplikasi-aplikasi Pocket Games.,7,,
PG Games | Pocket Games Soft | Difference Makes The ...,https://www.pgsoft.com/games/home/,"PG SOFT® has just launched their very first Mahjong inspired slot machine game – “Mahjong Ways”! Mahjong is a game that originated from China, created from ...",8,,
Pocket Games Soft,https://www.pgsoft.com/vi/,PG SOFT là một công ty trò chơi di động kỹ thuật số đẳng cấp thế giới. Pocket Games Software cung cấp các nền tảng chơi game được thiết kế riêng cho các nền ...,9,,
Pocket Games Soft | Difference Makes The Difference,https://www.pgsoft.com/en/%C2%B4,"PG SOFT is a world-class digital mobile games company. Pocket Games Software provide bespoke gaming solutions on iOS, Android, MacOS, Windows and HTML5 ...",10,,
Grup PG | Pocket Games Soft | Perbedaan yang Membuat ...,https://www.pgsoft.com/id/company/,"PG SOFT® adalah studio desainer, seniman, animator, dan produser internasional pemenang penghargaan yang membuat konten untuk perusahaan-perusahaan terbesar di ...",1,,
Juegos PG | Pocket Games Soft | La diferencia que marca ...,https://www.pgsoft.com/es/games/home/,El Centro de Juegos PG es donde se muestran las aplicaciones de Pocket Games.,2,,
PG Math,https://www.pgsoft.com/id/math/login/,"PG SOFT yang juga dikenal sebagai Pocket Games Soft, adalah sebuah merek yang didirikan pada tahun 2015 dan sejak saat itu telah menjadi nama yang diakui ...",3,,
Pocket Games Soft | Ser Diferente Faz a Diferença,https://www.pgsoft.com/pt/,A PG SOFT é uma empresa de classe mundial de jogos digitais para dispositivos móveis. A Pocket Games Software fornece soluções de jogos sob medida para as ...,4,,
PG Games | Pocket Games Soft | ความแตกต่างที่เป็นตัวตัดสิน,https://www.pgsoft.com/th/games/home/,"PG SOFT® has just launched their very first Mahjong inspired slot machine game – “Mahjong Ways”! Mahjong is a game that originated from China, created from ...",5,,
ความแตกต่างที่เป็นตัวตัดสิน,https://www.pgsoft.com/th/,"PG SOFT คือบริษัทเกมดิจิทัลพกพาระดับชั้นนำของโลก Pocket Games Software บริการโซลูชันการเล่นเกมที่ตอบโจทย์ความต้องการของลูกค้าบนแพลตฟอร์ม iOS, Android, MacOS, Windows และ HTML5.",6,,
Dawn of the New Mobile Gaming Era: PG SOFT,https://www.pgsoft.com/id/news/2/,PG SOFT® hadir untuk merevolusi gamifikasi aplikasi seluler dengan memanfaatkan spektrum solusi permainan kami yang luas. Permainan kami adalah lambang dari ...,7,,
PG Games,https://www.pgsoft.com/vi/games/home/,"PG SOFT® has just launched their very first Mahjong inspired slot machine game – “Mahjong Ways”! Mahjong is a game that originated from China, created from ...",8,,
